b'DocType: Currency',b'Smallest circulating fraction unit (coin). For e.g. 1 cent for USD and it should be entered as 0.01',"b'Fracci\xc3\xb3n m\xc3\xa1s peque\xc3\xb1a de circulaci\xc3\xb3n (moneda). Por ejemplo, 1 centavo por USD y debe ser ingresado como 0.01'"
b'DocType: System Settings',"b'If Apply Strict User Permission is checked and User Permission is defined for a DocType for a User, then all the documents where value of the link is blank, will not be shown to that User'","b'Si est\xc3\xa1 activado Aplicar Permiso de Usuario Estricto y se ha definido el Permiso de Usuario para un DocType para un Usuario, todos los documentos en los que el valor del enlace est\xc3\xa9 en blanco no se mostrar\xc3\xa1n a ese Usuario'"
b'DocType: System Settings',"b'If Apply User Permissions is checked for Report DocType but no User Permissions are defined for Report for a User, then all Reports are shown to that User'","b'Si est\xc3\xa1 activado Aplicar Permisos de Usuario para Informe de DocType pero no estan definidos Permisos de Usuario para Informe para un Usuario, entonces todos los informes se muestran a ese Usuario'"
b'DocType: Website Settings',b'&lt;head&gt; HTML',b'&lt;head&gt; HTML'
b'apps/frappe/frappe/core/doctype/system_settings/system_settings.py +19',b'Please select Minimum Password Score',b'Por favor selecciona la Puntuaci\xc3\xb3n M\xc3\xadnima de la Contrase\xc3\xb1a'
b'DocType: Currency',b'Smallest Currency Fraction Value',b'Valor de la fracci\xc3\xb3n de moneda m\xc3\xa1s peque\xc3\xb1a'
b'apps/frappe/frappe/custom/doctype/customize_form/customize_form.js +229',b'Permissions can be managed via Setup &gt; Role Permissions Manager',b'Los permisos se pueden gestionar a trav\xc3\xa9s de Configuraci\xc3\xb3n &gt; Administrador de permisos'
b'DocType: Address Template',"b'<h4>Default Template</h4>\n<p>Uses <a href=""http://jinja.pocoo.org/docs/templates/"">Jinja Templating</a> and all the fields of Address (including Custom Fields if any) will be available</p>\n<pre><code>{{ address_line1 }}&lt;br&gt;\n{% if address_line2 %}{{ address_line2 }}&lt;br&gt;{% endif -%}\n{{ city }}&lt;br&gt;\n{% if state %}{{ state }}&lt;br&gt;{% endif -%}\n{% if pincode %} PIN:  {{ pincode }}&lt;br&gt;{% endif -%}\n{{ country }}&lt;br&gt;\n{% if phone %}Phone: {{ phone }}&lt;br&gt;{% endif -%}\n{% if fax %}Fax: {{ fax }}&lt;br&gt;{% endif -%}\n{% if email_id %}Email: {{ email_id }}&lt;br&gt;{% endif -%}\n</code></pre>'","b'<h4> Por defecto la plantilla <!-- h4--> \n <p> <a href=""http://jinja.pocoo.org/docs/templates/""> Jinja Templating </a> y todos los campos de la Direcci\xc3\xb3n ( incluyendo campos personalizados en su caso) estar\xc3\xa1 disponible <!-- p--> \n </p><pre> <code> {{address_line1}} &amp; lt; br &amp; gt; \n {% if address_line2%} {{address_line2}} &amp; lt; br &amp; gt; { endif% -%} \n {{ciudad}} &amp; lt; br &amp; gt; \n {% if%} Estado {{Estado}} &amp; lt; br &amp; gt; {% endif -%} {% if \n c\xc3\xb3digo PIN%} PIN: {{c\xc3\xb3digo PIN}} &amp; lt; br &amp; gt; {% endif -%} \n {{pa\xc3\xads}} &amp; lt; br &amp; gt; \n {% if tel\xc3\xa9fono%} Tel\xc3\xa9fono: {{tel\xc3\xa9fono}} &amp; lt; br &amp; gt; { % endif -%} \n {% if fax%} Fax: {{fax}} &amp; lt; br &amp; gt; {% endif -%} \n {% if email_ID%} Email: {{email_ID}} &amp; lt; br &amp; gt ; {% endif -%} \n <!-- code--> <!-- pre--></code></pre></h4>'"
