apps/frappe/frappe/core/page/user_permissions/user_permissions.js +297,Add A User Restriction,เพิ่มข้อ จำกัด ผู้ใช้
DocType: DocType,Name Case,กรณีชื่อ
apps/frappe/frappe/public/js/frappe/form/share.js +26,Shared with everyone,ที่ใช้ร่วมกันกับทุกคน
apps/frappe/frappe/model/base_document.py +358,Data missing in table,ข้อมูลที่หายไปในตาราง
DocType: Web Form,Success URL,URL ที่ประสบความสำเร็จ
DocType: Email Account,Append To,ผนวกกับ
DocType: Workflow Document State,Only Allow Edit For,อนุญาตให้เฉพาะสำหรับแก้ไข
DocType: File,Is Folder,เป็นโฟลเดอร์
DocType: DocType,DocType,DOCTYPE
apps/frappe/frappe/core/doctype/user/user.py +393,User {0} does not exist,ผู้ใช้ {0} ไม่อยู่
DocType: Website Theme,"If image is selected, color will be ignored.",หากภาพเลือกสีจะถูกละเว้น
DocType: User,Mute Sounds,ปิดเสียง
DocType: Top Bar Item,Top Bar Item,รายการ Bar สถานที่ยอด
apps/frappe/frappe/utils/csvutils.py +50,"Unknown file encoding. Tried utf-8, windows-1250, windows-1252.","การเข้ารหัส ไฟล์ ที่ไม่รู้จัก พยายาม UTF -8 , Windows - 1250 1252 หน้าต่าง"
apps/frappe/frappe/core/doctype/user/user.py +104,Sorry! Sharing with Website User is prohibited.,ขออภัย! ร่วมกับผู้ใช้เว็บไซต์เป็นสิ่งต้องห้าม
apps/frappe/frappe/core/doctype/user/user.js +152,Add all roles,เพิ่ม บทบาท ทั้งหมด
apps/frappe/frappe/templates/includes/contact.js +11,"Please enter both your email and message so that we \
				can get back to you. Thanks!","กรุณากรอกตัวอักษรทั้งอีเมล์และข้อความของคุณเพื่อให้เรา \
 จะได้รับกลับมาให้คุณ ขอบคุณ!"
apps/frappe/frappe/email/smtp.py +151,Could not connect to outgoing email server,ไม่สามารถ เชื่อมต่อกับเซิร์ฟเวอร์ อีเมลขาออก
apps/frappe/frappe/public/js/frappe/form/control.js +1331,Rich Text,Rich ข้อความ
DocType: Workflow State,resize-full,ปรับขนาดเต็ม
DocType: Workflow State,off,ปิด
apps/frappe/frappe/desk/query_report.py +26,Report {0} is disabled,รายงาน {0} เป็นคนพิการ
apps/frappe/frappe/core/page/data_import_tool/data_import_main.html +24,Recommended for inserting new records.,แนะนำสำหรับการแทรกระเบียนใหม่
DocType: Async Task,Core,แกน
DocType: DocField,Set non-standard precision for a Float or Currency field,ตั้งความแม่นยำที่ไม่ได้มาตรฐานสำหรับลอยหรือสาขาสกุลเงิน
DocType: Email Account,Ignore attachments over this size,ละเว้นสิ่งที่แนบมามากกว่าขนาดนี้
apps/frappe/frappe/database.py +217,Too many writes in one request. Please send smaller requests,เขียน มากเกินไปใน หนึ่งขอ กรุณา ส่งคำขอ มีขนาดเล็ก
DocType: Workflow State,arrow-up,ลูกศรขึ้น
DocType: DocField,Allow on Submit,อนุญาตให้ส่ง
apps/frappe/frappe/core/page/desktop/desktop.js +59,All Applications,แอพทั้งหมด
apps/frappe/frappe/public/js/frappe/views/reports/reportview.js +422,Pick Columns,เลือกคอลัมน์
DocType: Web Page,Add code as &lt;script&gt;,เพิ่มรหัสเป็น &lt;script&gt;
apps/frappe/frappe/core/page/data_import_tool/data_import_main.html +7,Select Type,เลือกประเภท
apps/frappe/frappe/core/doctype/file/file.py +221,No permission to write / remove.,ได้รับอนุญาตให้เขียน / ลบไม่มี
apps/frappe/frappe/print/page/print_format_builder/print_format_builder_layout.html +3,Drag elements from the sidebar to add. Drag them back to trash.,องค์ประกอบลากจากแถบด้านข้างเพื่อเพิ่ม ลากพวกเขากลับไปยังถังขยะ
DocType: Workflow State,resize-small,ปรับขนาดเล็ก
apps/frappe/frappe/public/js/frappe/ui/editor.html +69,Horizontal Line Break,แบ่งบรรทัดแนวนอน
DocType: Top Bar Item,Right,ขวา
DocType: User,User Type,ประเภทผู้ใช้
apps/frappe/frappe/core/page/user_permissions/user_permissions.js +68,Select User,เลือกผู้ใช้
DocType: Async Task,Reference Doc,อ้างอิงหมอ
DocType: Communication,Keep a track of all communications,ติดตามการสื่อสารทั้งหมด
apps/frappe/frappe/desk/form/save.py +30,Did not save,ไม่ได้บันทึก
DocType: Property Setter,Property,คุณสมบัติ
DocType: Email Account,Yandex.Mail,Yandex.Mail
DocType: Website Slideshow,"Note: For best results, images must be of the same size and width must be greater than height.",หมายเหตุ: สำหรับผลลัพธ์ที่ดีที่สุดภาพต้องมีขนาดเท่ากันและความกว้างต้องมากกว่าความสูง
DocType: DocType,Auto Name,ชื่ออัตโนมัติ
apps/frappe/frappe/custom/doctype/custom_field/custom_field.js +55,Option 3,ตัวเลือกที่ 3
apps/frappe/frappe/custom/doctype/customize_form/customize_form.js +170,Permissions can be managed via Setup &gt; Role Permissions Manager,สิทธิ์สามารถจัดการได้ผ่านการตั้งค่า & gt; บทบาทผู้จัดการสิทธิ์
apps/frappe/frappe/core/page/data_import_tool/importer.py +70,Please make sure that there are no empty columns in the file.,กรุณาตรวจสอบให้แน่ใจว่าไม่มีคอลัมน์ที่ว่างเปล่าในแฟ้ม
apps/frappe/frappe/public/js/frappe/model/create_new.js +218,You have unsaved changes in this form. Please save before you continue.,คุณมีการเปลี่ยนแปลง ที่ไม่ได้บันทึก ในรูปแบบ นี้
apps/frappe/frappe/core/doctype/doctype/doctype.py +286,Default for {0} must be an option,เริ่มต้นสำหรับ {0} จะต้องเป็นตัวเลือก
DocType: User,User Image,รูปภาพของผู้ใช้
apps/frappe/frappe/email/bulk.py +243,Emails are muted,อีเมลเป็น เงียบ
apps/frappe/frappe/public/js/frappe/form/grid_form.html +22,Ctrl + Up,Ctrl + ขึ้น
DocType: Website Theme,Heading Style,สไตล์มุ่งหน้าไป
apps/frappe/frappe/desk/page/applications/applications.py +62,You cannot install this app,คุณไม่สามารถ ติดตั้ง app นี้
DocType: Scheduler Log,Error,ความผิดพลาด
apps/frappe/frappe/model/document.py +524,Cannot link cancelled document: {0},ไม่สามารถเชื่อมโยงเอกสารยกเลิก: {0}
apps/frappe/frappe/print/page/print_format_builder/print_format_builder.js +556,"For example: If you want to include the document ID, use {0}",ตัวอย่างเช่นถ้าคุณต้องการที่จะรวม ID เอกสารใช้ {0}
apps/frappe/frappe/print/page/print_format_builder/print_format_builder.js +482,Select Table Columns for {0},เลือกคอลัมน์ตารางสำหรับ {0}
DocType: Custom Field,Options Help,ตัวเลือกความช่วยเหลือ
DocType: DocField,Report Hide,แจ้งซ่อน
DocType: Custom Field,Label Help,ช่วยเหลือฉลาก
DocType: Workflow State,star-empty,ดาวที่ว่างเปล่า
apps/frappe/frappe/public/js/frappe/form/workflow.js +39,Next actions,ดำเนินการต่อไป
apps/frappe/frappe/public/js/frappe/views/ganttview.js +79,Nothing to show for this selection,อะไรที่จะแสดง การเลือกนี้
DocType: Workflow State,ok,ok
DocType: User,These values will be automatically updated in transactions and also will be useful to restrict permissions for this user on transactions containing these values.,ค่าเหล่านี้จะถูกปรับปรุงโดยอัตโนมัติในการทำธุรกรรมและยังจะเป็นประโยชน์เพื่อ จำกัด สิทธิ์สำหรับผู้ใช้นี้ในการทำธุรกรรมที่มีค่าเหล่านี้
apps/frappe/frappe/desk/page/applications/application_row.html +15,Publisher,ผู้พิมพ์
apps/frappe/frappe/model/rename_doc.py +361,** Failed: {0} to {1}: {2},** ล้มเหลว: {0} เป็น {1}: {2}
apps/frappe/frappe/public/js/frappe/ui/upload.html +4,Browse,เรียกดู
apps/frappe/frappe/templates/includes/comments/comments.py +52,View it in your browser,ดูในเบราว์เซอร์ของคุณ
DocType: Async Task,Running,วิ่ง
apps/frappe/frappe/templates/pages/update-password.html +1,Reset Password,ตั้งค่ารหัสผ่าน
DocType: Workflow State,hand-left,มือซ้าย
apps/frappe/frappe/core/doctype/doctype/doctype.py +294,Fieldtype {0} for {1} cannot be unique,fieldtype {0} สำหรับ {1} ไม่สามารถที่ไม่ซ้ำกัน
DocType: Email Account,Use SSL,ใช้ SSL
DocType: Workflow State,play-circle,เล่นวงกลม
apps/frappe/frappe/print/page/print_format_builder/print_format_builder.js +75,Select Print Format to Edit,เลือกรูปแบบการพิมพ์ที่จะแก้ไข
DocType: Workflow State,circle-arrow-down,วงกลมลูกศรลง
apps/frappe/frappe/config/desk.py +33,Private and public Notes.,หมายเหตุภาครัฐและเอกชน
DocType: DocField,Datetime,datetime
DocType: Workflow State,arrow-right,ลูกศรขวา
DocType: Workflow State,Workflow state represents the current state of a document.,รัฐ Workflow หมายถึงสถานะปัจจุบันของเอกสาร
apps/frappe/frappe/public/js/frappe/ui/editor.js +445,Open Link in a new Window,ลิงค์เปิดในหน้าต่างใหม่
apps/frappe/frappe/utils/file_manager.py +244,Removed {0},ลบออก {0}
DocType: Company History,Highlight,เน้น
apps/frappe/frappe/public/js/frappe/views/reports/reportview.js +451,Ascending,Ascending
apps/frappe/frappe/print/doctype/print_format/print_format.py +18,Standard Print Format cannot be updated,พิมพ์รูปแบบ มาตรฐาน ไม่สามารถปรับปรุง
apps/frappe/frappe/custom/doctype/customize_form/customize_form.js +147,Help: Field Properties,ช่วยเหลือ: คุณสมบัติเขตข้อมูล
apps/frappe/frappe/core/page/data_import_tool/data_import_tool.js +86,Importing...,นำเข้า ...
apps/frappe/frappe/model/document.py +738,Incorrect value in row {0}: {1} must be {2} {3},ค่าไม่ถูกต้อง ในแถว {0}: {1} ต้อง {2} {3}
apps/frappe/frappe/workflow/doctype/workflow/workflow.py +67,Submitted Document cannot be converted back to draft. Transition row {0},ส่ง เอกสาร ไม่สามารถแปลง กลับไปที่ ร่าง
apps/frappe/frappe/print/page/print_format_builder/print_format_builder_start.html +2,Select an existing format to edit or start a new format.,เลือกรูปแบบที่มีอยู่เพื่อแก้ไขหรือเริ่มต้นรูปแบบใหม่
apps/frappe/frappe/workflow/doctype/workflow/workflow.py +38,Created Custom Field {0} in {1},สร้าง ฟิลด์ที่กำหนดเอง {0} ใน {1}
apps/frappe/frappe/core/page/user_permissions/user_permissions.js +31,A user can be permitted to multiple records of the same DocType.,ผู้ใช้สามารถ ได้รับอนุญาตให้ บันทึก หลายDocType เดียวกัน
DocType: Workflow State,Home,บ้าน
DocType: Workflow State,question-sign,คำถามการลงชื่อเข้าใช้
DocType: Email Account,Add Signature,เพิ่มลายเซ็น
apps/frappe/frappe/email/doctype/email_unsubscribe/email_unsubscribe.py +38,Left this conversation,ออกจากการสนทนานี้
apps/frappe/frappe/core/page/permission_manager/permission_manager.js +474,Did not set,ไม่ได้ระบุราคา
DocType: ToDo,ToDo,สิ่งที่ต้องทำ
DocType: DocField,No Copy,คัดลอกไม่มี
DocType: Workflow State,qrcode,QRCode
DocType: Web Form,Breadcrumbs,สวดมนต์
apps/frappe/frappe/core/doctype/doctype/doctype.py +414,If Owner,หากเจ้าของ
apps/frappe/frappe/website/doctype/web_form/web_form.py +55,You need to be logged in to access this {0}.,คุณจำเป็นต้องเข้าสู่ระบบเพื่อเข้าถึง {0}
apps/frappe/frappe/public/js/frappe/form/footer/assign_to.js +167,Complete By,เสร็จสมบูรณ์โดย
apps/frappe/frappe/templates/includes/comments/comments.py +50,{0} by {1},{0} โดย {1}
apps/frappe/frappe/core/doctype/comment/comment.py +57,Cannot add more than 50 comments,ไม่สามารถเพิ่ม มากขึ้นกว่า 50 ความเห็น
DocType: Website Settings,Top Bar Items,รายการ Bar สถานที่ยอด
DocType: Print Settings,Print Settings,ตั้งค่าการพิมพ์
DocType: DocType,Max Attachments,สิ่งที่แนบมาแม็กซ์
DocType: Page,Page,หน้า
DocType: Workflow State,briefcase,กระเป๋าเอกสาร
apps/frappe/frappe/model/base_document.py +451,Value cannot be changed for {0},ค่า ไม่สามารถเปลี่ยนแปลงได้ เพื่อ {0}
apps/frappe/frappe/templates/includes/contact.js +17,"You seem to have written your name instead of your email. \
					Please enter a valid email address so that we can get back.","คุณดูเหมือนจะได้เขียนชื่อของคุณแทนของอีเมลของคุณ \
 โปรดป้อนที่อยู่อีเมลที่ถูกต้องเพื่อให้เราสามารถได้รับกลับมา"
DocType: Workflow State,"Style represents the button color: Success - Green, Danger - Red, Inverse - Black, Primary - Dark Blue, Info - Light Blue, Warning - Orange","สไตล์เป็นสีของปุ่ม: ความสำเร็จ - สีเขียว, อันตราย - แดง, Inverse - ดำ, ประถม - มืดข้อมูล, บลู - Light Blue, คำเตือน - ออเรนจ์"
apps/frappe/frappe/public/js/frappe/views/reports/query_report.js +124,No Report Loaded. Please use query-report/[Report Name] to run a report.,รายงาน Loaded ไม่มี กรุณาใช้แบบสอบถามรายงาน / [ชื่อรายงาน] เพื่อเรียกใช้รายงาน
DocType: Workflow Transition,Workflow Transition,เปลี่ยนเวิร์กโฟลว์
DocType: Workflow State,resize-horizontal,ปรับขนาดในแนวนอน-
DocType: Communication,Content,เนื้อหา
DocType: Web Form,Go to this url after completing the form.,ไปที่ url นี้หลังจากที่กรอกแบบฟอร์ม
DocType: DocType,Document,เอกสาร
DocType: DocField,Code,รหัส
DocType: Website Theme,Footer Text Color,ท้ายสีข้อความ
apps/frappe/frappe/core/page/permission_manager/permission_manager_help.html +24,"Permissions at level 0 are Document Level permissions, i.e. they are primary for access to the document.",สิทธิ์ที่ระดับ 0 มีเอกสารสิทธิ์ระดับคือพวกเขาเป็นหลักสำหรับการเข้าถึงเอกสาร
DocType: Print Format,Print Format,พิมพ์รูปแบบ
apps/frappe/frappe/config/website.py +28,User ID of a blog writer.,รหัสผู้ใช้ ของ นักเขียน บล็อก
apps/frappe/frappe/config/setup.py +32,Set Permissions on Document Types and Roles,กำหนดสิทธิ์ ใน ประเภท เอกสาร และบทบาท
DocType: About Us Settings,"""Company History""","""ประวัติบริษัท"""
apps/frappe/frappe/permissions.py +330,Permission already set,ได้รับอนุญาตตั้งอยู่แล้ว
apps/frappe/frappe/desk/page/activity/activity_row.html +15,Commented on {0}: {1},แสดงความคิดเห็นใน {0}: {1}
apps/frappe/frappe/core/page/user_permissions/user_permissions.js +243,These restrictions will apply for Document Types where 'Apply User Permissions' is checked for the permission rule and a field with this value is present.,ข้อ จำกัด เหล่านี้จะนำไปใช้สำหรับประเภทเอกสารที่ &#39;ใช้สิทธิ์ของผู้ใช้&#39; การตรวจสอบสำหรับการปกครองได้รับอนุญาตและเขตข้อมูลที่มีค่านี้เป็นปัจจุบัน
DocType: Email Alert,Send alert if this field's value changes,ส่งการแจ้งเตือนหากมีการเปลี่ยนแปลงค่าของเขตนี้
apps/frappe/frappe/print/page/print_format_builder/print_format_builder.js +102,Select a DocType to make a new format,เลือก DocType ที่จะทำให้รูปแบบใหม่
DocType: Module Def,Module Def,Def โมดูล
apps/frappe/frappe/public/js/frappe/form/grid_form.html +7,Done,เสร็จสิ้น
apps/frappe/frappe/public/js/frappe/form/footer/timeline_item.html +48,Reply,ตอบ
DocType: DocField,Collapsible Depends On,พับขึ้นอยู่กับ
DocType: Email Account,SMTP Server,SMTP เซิร์ฟเวอร์
DocType: Print Format,Print Format Help,พิมพ์รูปแบบความช่วยเหลือ
apps/frappe/frappe/public/js/frappe/views/reports/grid_report.js +890,With Groups,ด้วย กลุ่ม
apps/frappe/frappe/core/page/data_import_tool/exporter.py +70,"If you are updating, please select ""Overwrite"" else existing rows will not be deleted.","หากคุณกำลังปรับปรุงโปรดเลือก ""ทับ"" แถวอื่น ๆ ที่มีอยู่จะไม่ถูกลบ"
DocType: Event,Every Month,ทุกเดือน
DocType: Letter Head,Letter Head in HTML,ตัวอักษรตัว ใหญ่ ในรูปแบบ HTML
DocType: Web Form,Web Form,ฟอร์มเว็บ
DocType: About Us Settings,Org History Heading,ประวัติ org หัวเรื่อง
DocType: Communication,Integrations can use this field to set email delivery status,Integrations สามารถใช้ข้อมูลนี้ในการตั้งค่าสถานะการส่งอีเมล
DocType: Web Form,Web Page Link Text,หน้าเว็บลิงค์ข้อความ
apps/frappe/frappe/config/setup.py +142,"Set default format, page size, print style etc.",รูปแบบการตั้งค่าเริ่มต้นขนาดหน้าลักษณะการพิมพ์ ฯลฯ
DocType: DocType,Naming,การตั้งชื่อ
DocType: Event,Every Year,ทุกปี
apps/frappe/frappe/public/js/frappe/list/list_item_main_head.html +23,Select All,เลือกทั้งหมด
apps/frappe/frappe/public/js/frappe/form/linked_with.js +86,Not Linked to any record.,ไม่ได้เชื่อมโยงไปยังระเบียนใด ๆ
apps/frappe/frappe/public/js/frappe/form/workflow.js +32, by Role ,โดยบทบาท
apps/frappe/frappe/core/doctype/user/user.py +359,Registered but disabled.,สมาชิก แต่ปิดการใช้งาน
apps/frappe/frappe/public/js/frappe/list/doclistview.js +536,Delete permanently?,ลบอย่างถาวร?
apps/frappe/frappe/public/js/frappe/ui/toolbar/awesome_bar.js +89,Search in a document type,ค้นหาในรูปแบบเอกสาร
apps/frappe/frappe/custom/doctype/customize_form/customize_form.js +202,Allow field to remain editable even after submission,อนุญาตให้ข้อมูลที่จะยังคงสามารถแก้ไขได้แม้หลังจากที่ส่ง
DocType: DocPerm,Role and Level,บทบาท และ ระดับ
DocType: File,Thumbnail URL,URL รูปขนาดย่อ
apps/frappe/frappe/desk/moduleview.py +31,Custom Reports,รายงานที่กำหนดเอง
DocType: Website Script,Website Script,สคริปต์เว็บไซต์
apps/frappe/frappe/config/setup.py +147,Customized HTML Templates for printing transactions.,แม่แบบ HTML ที่กำหนดเองสำหรับการทำธุรกรรมการพิมพ์
apps/frappe/frappe/desk/form/utils.py +87,No further records,ไม่มีระเบียนใด
DocType: DocField,Long Text,ข้อความยาว
apps/frappe/frappe/core/page/data_import_tool/importer.py +38,Please do not change the rows above {0},กรุณาอย่า เปลี่ยน แถว ด้านบน {0}
apps/frappe/frappe/public/js/frappe/ui/toolbar/navbar.html +58,(Ctrl + G),(Ctrl + G)
apps/frappe/frappe/public/js/frappe/views/pageview.js +110,Sorry! You are not permitted to view this page.,ขออภัย! คุณยังไม่ได้รับอนุญาตให้ดูหน้านี้
DocType: Workflow State,bell,ระฆัง
apps/frappe/frappe/public/js/frappe/form/set_sharing.html +39,Share this document with,แบ่งปันเอกสารกับเรื่องนี้
apps/frappe/frappe/desk/page/activity/activity.js +152,Jun,มิถุนายน
apps/frappe/frappe/utils/nestedset.py +235,{0} {1} cannot be a leaf node as it has children,{0} {1} ไม่สามารถเป็น โหนดใบที่มี เด็ก
DocType: Feed,Info,ข้อมูล
apps/frappe/frappe/templates/includes/contact.js +30,Thank you for your message,ขอบคุณสำหรับข้อความของคุณ
DocType: Website Settings,Home Page,หน้าแรก
DocType: Email Alert,Filters,ตัวกรอง
DocType: Workflow State,share-alt,หุ้น Alt-
DocType: Role,Role Name,ชื่อบทบาท
DocType: Workflow Document State,Workflow Document State,รัฐเอกสารเวิร์กโฟลว์
apps/frappe/frappe/core/page/permission_manager/permission_manager_help.html +32,"To give acess to a role for only specific records, check the Apply User Permissions. User Permissions are used to limit users with such role to specific records.",เพื่อให้ Acess บทบาทสำหรับบันทึกเฉพาะตรวจสอบสิทธิ์ของผู้ใช้สมัคร สิทธิ์ของผู้ใช้จะใช้ในการ จำกัด ผู้ใช้ที่มีบทบาทดังกล่าวจะบันทึกเฉพาะ
apps/frappe/frappe/workflow/doctype/workflow/workflow.py +70,Cannot cancel before submitting. See Transition {0},ไม่สามารถยกเลิก ก่อนที่จะส่ง
apps/frappe/frappe/templates/pages/print.py +170,Print Format {0} is disabled,พิมพ์รูปแบบ {0} ถูกปิดใช้งาน
DocType: Email Alert,Send days before or after the reference date,ส่งวันก่อนหรือหลังวันที่อ้างอิง
DocType: User,Allow user to login only after this hour (0-24),อนุญาตให้ผู้ใช้เข้าสู่ระบบเท่านั้นหลังจากชั่วโมงนี้ (0-24)
