apps/frappe/frappe/website/doctype/web_form/web_form.py +60,Please select a Amount Field.,โปรดเลือกฟิลด์ยอดเงิน
apps/frappe/frappe/custom/doctype/customize_form/customize_form.js +281,Press Esc to close,กด Esc เพื่อปิด
apps/frappe/frappe/desk/form/assign_to.py +153,"A new task, {0}, has been assigned to you by {1}. {2}",งานใหม่ {0} ได้รับมอบหมายให้กับคุณโดย {1} {2}
DocType: Email Queue,Email Queue records.,บันทึกคิวอีเมล์
apps/frappe/frappe/desk/page/chat/chat_main.html +14,Post,เสา
apps/frappe/frappe/geo/report/addresses_and_contacts/addresses_and_contacts.js +28,Please select Party Type first,กรุณาเลือกประเภทพรรคแรก
apps/frappe/frappe/config/setup.py +109,Rename many items by uploading a .csv file.,เปลี่ยนชื่อ หลายรายการ โดยการอัปโหลดไฟล์ CSV .
DocType: Workflow State,pause,หยุด
apps/frappe/frappe/www/desk.py +18,You are not permitted to access this page.,คุณยังไม่ได้รับอนุญาตให้เข้าถึงหน้านี้
DocType: About Us Settings,Website,เว็บไซต์
apps/frappe/frappe/www/me.py +14,You need to be logged in to access this page,คุณต้องเข้าสู่ระบบเพื่อเข้าถึงหน้านี้
DocType: User,Facebook Username,Facebook ชื่อผู้ใช้งาน
DocType: System Settings,Note: Multiple sessions will be allowed in case of mobile device,หมายเหตุ: หลายครั้งจะได้รับอนุญาตในกรณีของโทรศัพท์มือถือ
apps/frappe/frappe/email/queue.py +201,Cannot send this email. You have crossed the sending limit of {0} emails for this month.,ไม่สามารถส่งอีเมล์นี้ คุณได้ข้ามขีด จำกัด การส่ง {0} อีเมลสำหรับเดือนนี้
apps/frappe/frappe/public/js/legacy/form.js +750,Permanently Submit {0}?,อย่างถาวร ส่ง {0}?
DocType: Address,County,เขต
DocType: Workflow,If Checked workflow status will not override status in list view,ถ้าสถานะเวิร์กโฟลว์การยืมจะไม่แทนที่สถานะในมุมมองรายการ
apps/frappe/frappe/client.py +278,Invalid file path: {0},เส้นทางของไฟล์ไม่ถูกต้อง: {0}
DocType: Workflow State,eye-open,ตาเปิด
DocType: Email Queue,Send After,หลังจากที่ส่ง
apps/frappe/frappe/utils/file_manager.py +31,Please select a file or url,โปรดเลือกไฟล์หรือพิมพ์ URL
apps/frappe/frappe/public/js/frappe/views/treeview.js +65,{0} Tree,{0} ทรี
DocType: User,Username,ชื่อผู้ใช้
apps/frappe/frappe/model/base_document.py +575,Value too big,ค่ามีขนาดใหญ่เกินไป
DocType: DocField,DocField,DocField
DocType: Contact,Department,แผนก
DocType: DocField,Options,ตัวเลือก
apps/frappe/frappe/client.py +84,Cannot edit standard fields,ไม่สามารถแก้ไข เขตข้อมูลมาตรฐาน
DocType: Print Format,Print Format Builder,พิมพ์รูปแบบสร้าง
apps/frappe/frappe/public/js/frappe/ui/page.js +4,Form,แบบฟอร์ม
DocType: Report,Report Manager,จัดการรายงาน
DocType: Workflow,Document States,เอกสารสหรัฐอเมริกา
apps/frappe/frappe/public/js/frappe/views/pageview.js +104,Sorry! I could not find what you were looking for.,ขออภัย! ฉันไม่สามารถหาสิ่งที่คุณกำลังมองหา
apps/frappe/frappe/config/core.py +42,Logs,บันทึก
DocType: Custom DocPerm,This role update User Permissions for a user,บทบาทนี้ สิทธิ์ การปรับปรุง ผู้ใช้งานของ ผู้ใช้
apps/frappe/frappe/public/js/frappe/model/model.js +486,Rename {0},เปลี่ยนชื่อ {0}
DocType: Workflow State,zoom-out,ซูมออก
apps/frappe/frappe/public/js/legacy/form.js +67,Cannot open {0} when its instance is open,ไม่สามารถเปิด {0} เมื่อ ตัวอย่าง ที่ เปิดให้บริการ
apps/frappe/frappe/model/document.py +927,Table {0} cannot be empty,ตารางที่ {0} ไม่ว่างเปล่า
DocType: Integration Service Parameter,Parameter,พารามิเตอร์
apps/frappe/frappe/public/js/frappe/views/reports/grid_report.js +850,With Ledgers,ด้วย Ledgers
apps/frappe/frappe/public/js/frappe/list/list_sidebar.html +20,Images,ภาพ
DocType: Communication,Reference Owner,เจ้าของอ้างอิง
DocType: Currency,Smallest circulating fraction unit (coin). For e.g. 1 cent for USD and it should be entered as 0.01,หน่วยที่เล็กที่สุดส่วนการไหลเวียน (เหรียญ) สำหรับเช่นร้อยละ 1 เหรียญสหรัฐและมันควรจะป้อนเป็น 0.01
DocType: Social Login Keys,GitHub,GitHub
apps/frappe/frappe/model/base_document.py +569,"{0}, Row {1}",{0} แถว {1}
apps/frappe/frappe/core/doctype/file/file_list.js +102,Error in uploading files.,ข้อผิดพลาดในการอัปโหลดไฟล์
apps/frappe/frappe/model/document.py +901,Beginning with,เริ่มต้นด้วย
apps/frappe/frappe/core/page/data_import_tool/exporter.py +51,Data Import Template,ข้อมูลนำเข้าแม่แบบ
apps/frappe/frappe/public/js/frappe/model/model.js +31,Parent,ผู้ปกครอง
DocType: About Us Settings,"""Team Members"" or ""Management""","“สมาชิกในทีม"" หรือ ""ผู้บริหาร"""
apps/frappe/frappe/core/doctype/doctype/doctype.py +400,Default for 'Check' type of field must be either '0' or '1',เริ่มต้นสำหรับ 'ตรวจสอบ' ประเภทของข้อมูลต้องเป็น '0' หรือ '1'
apps/frappe/frappe/public/js/frappe/misc/pretty_date.js +50,Yesterday,เมื่อวาน
DocType: Contact,Designation,การแต่งตั้ง
apps/frappe/frappe/public/js/frappe/views/test_runner.js +10,Test Runner,วิ่งทดสอบ
DocType: Auto Email Report,Monthly,รายเดือน
DocType: Email Account,Enable Incoming,เปิดใช้งานเข้ามา
apps/frappe/frappe/core/doctype/version/version_view.html +47,Danger,อันตราย
apps/frappe/frappe/www/login.html +19,Email Address,ที่อยู่อีเมล
DocType: Workflow State,th-large,-th ใหญ่
DocType: Communication,Unread Notification Sent,แจ้งส่งยังไม่ได้อ่าน
apps/frappe/frappe/public/js/frappe/misc/tools.js +8,Export not allowed. You need {0} role to export.,ส่งออก ไม่ได้รับอนุญาต คุณต้อง {0} บทบาท ในการส่งออก
DocType: Email Group,Email Group,กลุ่มอีเมล์
DocType: Note,Seen By,เห็นโดย
apps/frappe/frappe/public/js/frappe/ui/filters/filters.js +701,Not Like,ไม่ชอบ
apps/frappe/frappe/custom/doctype/customize_form/customize_form.js +211,Set the display label for the field,ตั้งป้ายแสดงผลสำหรับฟิลด์
apps/frappe/frappe/model/document.py +918,Incorrect value: {0} must be {1} {2},ค่าไม่ถูกต้อง: {0} จะต้อง {1} {2}
apps/frappe/frappe/config/setup.py +242,"Change field properties (hide, readonly, permission etc.)","เปลี่ยนคุณสมบัติ เขตข้อมูล (ซ่อน , อ่านได้อย่างเดียว ได้รับอนุญาต ฯลฯ )"
apps/frappe/frappe/integration_broker/oauth2.py +109,Define Frappe Server URL in Social Login Keys,กำหนด Frappe URL ของเซิร์ฟเวอร์ในสังคมเข้าสู่ระบบคีย์
DocType: Workflow State,lock,ล็อค
apps/frappe/frappe/config/website.py +78,Settings for Contact Us Page.,การตั้งค่าสำหรับหน้าติดต่อเรา
apps/frappe/frappe/core/doctype/user/user.py +751,Administrator Logged In,ผู้ดูแลระบบเข้าสู่ระบบ
DocType: Contact Us Settings,"Contact options, like ""Sales Query, Support Query"" etc each on a new line or separated by commas.",ตัวเลือกการติดต่อเช่น &quot;แบบสอบถามขายการสนับสนุนแบบสอบถาม&quot; ฯลฯ แต่ละบรรทัดใหม่หรือคั่นด้วยเครื่องหมายจุลภาค
apps/frappe/frappe/core/page/data_import_tool/data_import_main.html +30,2. Download,2. ดาวน์โหลด
apps/frappe/frappe/public/js/frappe/form/link_selector.js +20,Select {0},เลือก {0}
DocType: Print Settings,Classic,คลาสสิก
DocType: Desktop Icon,Color,สี
apps/frappe/frappe/public/js/frappe/views/reports/query_report.js +53,For ranges,สำหรับช่วง
DocType: Workflow State,indent-right,เยื้องขวา
apps/frappe/frappe/public/js/frappe/ui/upload.html +12,Web Link,เว็บลิงค์
apps/frappe/frappe/public/js/frappe/misc/pretty_date.js +46,1 minute ago,1 นาทีที่ผ่านมา
apps/frappe/frappe/core/page/data_import_tool/data_import_main.html +46,"Recommended bulk editing records via import, or understanding the import format.",แนะนำบันทึกการแก้ไขเป็นกลุ่มผ่านการนำเข้าหรือการทำความเข้าใจรูปแบบการนำเข้า
apps/frappe/frappe/core/page/permission_manager/permission_manager_help.html +36,"Apart from System Manager, roles with Set User Permissions right can set permissions for other users for that Document Type.",นอกเหนือจากการจัดการระบบบทบาทกับการตั้งค่าสิทธิ์ของผู้ใช้ที่เหมาะสมสามารถกำหนดสิทธิ์สำหรับผู้ใช้อื่น ๆ สำหรับประเภทเอกสารที่
DocType: Company History,Company History,ประวัติ บริษัท
apps/frappe/frappe/website/doctype/portal_settings/portal_settings.js +9,Reset,รีเซ็ต
DocType: Workflow State,volume-up,ปริมาณขึ้น
apps/frappe/frappe/core/page/data_import_tool/importer.py +53,Only allowed {0} rows in one import,ได้รับอนุญาตเท่านั้น {0} แถว หนึ่งใน การนำเข้า
apps/frappe/frappe/core/page/data_import_tool/data_import_main.html +4,"To import or update records, you must first download the template for importing.",ที่จะนำเข้าหรือระเบียนการปรับปรุงก่อนอื่นคุณต้องดาวน์โหลดแม่แบบสำหรับการนำเข้า
DocType: DocType,Default Print Format,รูปแบบการพิมพ์เริ่มต้น
DocType: Workflow State,Tags,แท็ก
apps/frappe/frappe/public/js/frappe/form/workflow.js +33,None: End of Workflow,: ไม่มีสิ้นสุดเวิร์กโฟลว์
apps/frappe/frappe/model/db_schema.py +345,"{0} field cannot be set as unique in {1}, as there are non-unique existing values",{0} สนามไม่สามารถกำหนดให้เป็นเอกลักษณ์ใน {1} เนื่องจากมีค่าที่มีอยู่ที่ไม่ซ้ำกัน
apps/frappe/frappe/core/page/permission_manager/permission_manager.js +47,Document Types,ประเภทเอกสาร
DocType: Workflow,Workflow State Field,ฟิลด์สถานะของเวิร์กโฟลว์
apps/frappe/frappe/templates/generators/web_form.html +54,Please sign-up or login to begin,กรุณาลงทะเบียนหรือเข้าสู่ระบบที่จะเริ่มต้น
DocType: Blog Post,Guest,ผู้เยี่ยมชม
DocType: DocType,Title Field,ชื่อ ฟิลด์
DocType: Error Log,Error Log,บันทึกข้อผิดพลาด
apps/frappe/frappe/utils/password_strength.py +95,"Repeats like ""abcabcabc"" are only slightly harder to guess than ""abc""",ซ้ำเช่น &quot;abcabcabc&quot; เป็นเพียงเล็กน้อยยากที่จะคาดเดามากกว่า &quot;ABC&quot;
apps/frappe/frappe/core/doctype/user/user.py +748,"If you think this is unauthorized, please change the Administrator password.",หากคุณคิดว่านี่คือไม่ได้รับอนุญาตโปรดเปลี่ยนรหัสผ่านของผู้ดูแลระบบ
apps/frappe/frappe/email/doctype/email_account/email_account.py +69,{0} is mandatory,ต้องระบุ {0}
DocType: Workflow State,eject,ขับ
apps/frappe/frappe/core/page/user_permissions/user_permissions.js +16,Help for User Permissions,ช่วยเหลือสำหรับสิทธิ์ของผู้ใช้
DocType: Standard Reply,Owner,เจ้าของ
DocType: Communication,Visit,เยี่ยม
DocType: Translation,Translation,การแปล
apps/frappe/frappe/desk/page/applications/application_row.html +18,Install,ติดตั้ง
DocType: Custom Script,Client,ลูกค้า
apps/frappe/frappe/public/js/legacy/form.js +482,This form has been modified after you have loaded it,รูปแบบนี้ได้รับการแก้ไขหลังจากที่คุณได้โหลด
apps/frappe/frappe/config/website.py +27,Embed image slideshows in website pages.,ฝังภาพสไลด์ภาพในหน้าเว็บไซต์
apps/frappe/frappe/email/doctype/newsletter/newsletter.js +8,Send,ส่ง
DocType: Workflow Action,Workflow Action Name,ชื่อการกระทำ ใน กระบวนการทำงาน
apps/frappe/frappe/core/doctype/doctype/doctype.py +246,DocType can not be merged,DocType ไม่สามารถ รวม
DocType: Web Form Field,Fieldtype,fieldtype
apps/frappe/frappe/core/doctype/file/file.py +245,Not a zip file,ไม่ได้เป็นไฟล์ซิป
apps/frappe/frappe/utils/password_strength.py +167,Capitalization doesn't help very much.,โครงสร้างเงินทุนไม่ได้ช่วยมาก
DocType: Error Snapshot,Friendly Title,ชื่อเรื่องที่เป็นมิตร
DocType: Newsletter,Email Sent?,อีเมลที่ส่ง?
apps/frappe/frappe/desk/form/save.py +50,Did not cancel,ไม่ได้ยกเลิก
DocType: Workflow State,plus,บวก
apps/frappe/frappe/integration_broker/oauth2.py +119,Logged in as Guest or Administrator,เข้าสู่ระบบในฐานะแขกหรือผู้ดูแลระบบ
apps/frappe/frappe/config/desktop.py +27,File Manager,ตัวจัดการไฟล์
DocType: OAuth Bearer Token,Refresh Token,รีเฟรช Token
apps/frappe/frappe/public/js/frappe/misc/user.js +61,You,คุณ
DocType: Website Theme,lowercase,ตัวพิมพ์เล็ก
DocType: Print Format,Helvetica,Helvetica
apps/frappe/frappe/email/doctype/newsletter/newsletter.py +35,Newsletter has already been sent,จดหมายข่าว ได้ถูกส่งไป แล้ว
DocType: Unhandled Email,Reason,เหตุผล
apps/frappe/frappe/core/report/permitted_documents_for_user/permitted_documents_for_user.py +33,Please specify user,โปรดระบุผู้ใช้
DocType: Email Unsubscribe,Email Unsubscribe,อีเมล์ยกเลิก
DocType: Website Settings,Select an image of approx width 150px with a transparent background for best results.,เลือกภาพจาก 150px ความกว้างประมาณกับพื้นหลังโปร่งใสเพื่อให้ได้ผลลัพธ์ที่ดีที่สุด
apps/frappe/frappe/public/js/frappe/form/templates/grid_body.html +15,Add multiple rows,เพิ่มหลายแถว
apps/frappe/frappe/desk/page/setup_wizard/setup_wizard.js +560,The first user will become the System Manager (you can change this later).,ผู้ใช้คนแรกจะกลายเป็นตัวจัดการระบบ (คุณสามารถเปลี่ยนภายหลัง)
,App Installer,การติดตั้งแอพพลิเค
DocType: Workflow State,circle-arrow-up,วงกลมลูกศรขึ้น
apps/frappe/frappe/public/js/frappe/upload.js +156,Uploading...,อัพโหลด ...
DocType: Workflow State,italic,ตัวเอียง
apps/frappe/frappe/core/page/modules_setup/modules_setup.html +7,For Everyone,สำหรับทุกคน
apps/frappe/frappe/core/doctype/doctype/doctype.py +627,{0}: Cannot set Import without Create,{0}: ไม่สามารถตั้งค่านำเข้าได้โดยไม่ได้ สร้าง
apps/frappe/frappe/config/desk.py +36,Event and other calendars.,เหตุการณ์และปฏิทินอื่น ๆ
apps/frappe/frappe/public/js/frappe/views/reports/reportview.js +840,Drag to sort columns,ลากเพื่อเรียงลำดับคอลัมน์
apps/frappe/frappe/print/page/print_format_builder/print_format_builder_column_selector.html +2,Widths can be set in px or %.,ความกว้างสามารถตั้งค่าในพิกเซลหรือ%
apps/frappe/frappe/public/js/frappe/form/print.js +98,Start,เริ่มต้น
DocType: User,First Name,ชื่อแรก
DocType: Portal Settings,Standard Sidebar Menu,เมนูด้านข้างมาตรฐาน
apps/frappe/frappe/core/doctype/file/file.py +167,Cannot delete Home and Attachments folders,ไม่สามารถลบหน้าแรกและโฟลเดอร์ไฟล์แนบ
apps/frappe/frappe/config/desk.py +29,Files,ไฟล์
apps/frappe/frappe/core/page/permission_manager/permission_manager_help.html +6,Permissions get applied on Users based on what Roles they are assigned.,สิทธิ์ ที่ได้รับ นำไปใช้ กับ ผู้ใช้ที่ อยู่บนพื้นฐานของ สิ่งที่ พวกเขา บทบาท ที่ได้รับมอบหมาย
apps/frappe/frappe/public/js/frappe/views/communication.js +448,You are not allowed to send emails related to this document,คุณยังไม่ได้ รับอนุญาตให้ส่ง อีเมล ที่เกี่ยวข้องกับ เอกสารฉบับนี้
DocType: PayPal Settings,Check this if you are testing your payment using the Sandbox API,ตรวจสอบเรื่องนี้ถ้าคุณกำลังทดสอบการชำระเงินของคุณโดยใช้ API แซนด์
apps/frappe/frappe/website/doctype/website_theme/website_theme.py +30,You are not allowed to delete a standard Website Theme,คุณยังไม่ได้รับอนุญาตให้ลบรูปแบบมาตรฐานเว็บไซต์
DocType: Feedback Trigger,Example,ตัวอย่าง
DocType: Workflow State,gift,ของขวัญ
apps/frappe/frappe/custom/doctype/customize_form/customize_form.js +237,Reqd,reqd
apps/frappe/frappe/core/doctype/communication/email.py +260,Unable to find attachment {0},ไม่สามารถที่จะ หา สิ่งที่แนบมา {0}
apps/frappe/frappe/custom/doctype/customize_form/customize_form.js +225,Assign a permission level to the field.,การกำหนดระดับการอนุญาตให้ข้อมูล
apps/frappe/frappe/public/js/frappe/request.js +75,The resource you are looking for is not available,ทรัพยากรที่คุณกำลังมองหาไม่สามารถใช้ได้
apps/frappe/frappe/config/setup.py +44,Show / Hide Modules,แสดง / ซ่อน โมดูล
apps/frappe/frappe/core/doctype/report/report.js +37,Disable Report,ปิดการใช้งานรายงาน
DocType: Website Theme,Apply Text Styles,ใช้ลักษณะข้อความ
DocType: PayPal Settings,Redirect To,เปลี่ยนเส้นทางไปยัง
DocType: Report,JavaScript Format: frappe.query_reports['REPORTNAME'] = {},รูปแบบ JavaScript : frappe.query_reports [ 'ชื่อรายงาน' ] = { }
DocType: Bulk Update,Bulk Update,อัปเดต
DocType: Workflow State,chevron-up,บั้งขึ้น
apps/frappe/frappe/public/js/frappe/ui/toolbar/navbar.html +57,Documentation,เอกสาร
apps/frappe/frappe/templates/includes/login/login.js +177,Not Allowed,ไม่อนุญาต
DocType: DocShare,Internal record of document shares,บันทึกของหุ้นเอกสารภายใน
DocType: Workflow State,Comment,ความเห็น
apps/frappe/frappe/core/page/permission_manager/permission_manager_help.html +17,"You can change Submitted documents by cancelling them and then, amending them.",คุณสามารถเปลี่ยน เอกสารที่ เขียนโดย ยกเลิก พวกเขาและ จากนั้น พวกเขา แก้
DocType: DocField,Display,แสดงผล
DocType: Email Group,Total Subscribers,สมาชิกทั้งหมด
apps/frappe/frappe/core/page/permission_manager/permission_manager_help.html +25,"If a Role does not have access at Level 0, then higher levels are meaningless.",หาก บทบาทไม่สามารถเข้าถึง ที่ ระดับ 0 แล้ว ระดับที่สูงขึ้น มีความหมาย
apps/frappe/frappe/public/js/frappe/views/reports/reportview.js +724,Save As,บันทึกเป็น
DocType: Communication,Seen,การกระทำ
apps/frappe/frappe/public/js/frappe/form/layout.js +97,Show more details,แสดงรายละเอียดเพิ่มเติม
DocType: System Settings,Run scheduled jobs only if checked,เรียกใช้งานที่กำหนดเฉพาะในกรณีที่มีการตรวจสอบ
apps/frappe/frappe/print/page/print_format_builder/print_format_builder.js +408,Will only be shown if section headings are enabled,จะแสดงเฉพาะส่วนหัวถ้ามีการใช้งาน
DocType: User,"Enter default value fields (keys) and values. If you add multiple values for a field, the first one will be picked. These defaults are also used to set ""match"" permission rules. To see list of fields, go to ""Customize Form"".",สาขาใส่ค่าเริ่มต้น (ปุ่ม) และค่านิยม ถ้าคุณเพิ่มค่าหลายสนามคนแรกที่จะได้รับเลือก เริ่มต้นเหล่านี้ยังใช้ในการตั้งค่า &quot;การแข่งขัน&quot; กฎได้รับอนุญาต เพื่อดูรายชื่อสาขาที่ให้ไปที่ &quot;การปรับแต่งรูปแบบ&quot;
DocType: Communication,Message,ข้อความ
DocType: Customize Form Field,"Print Width of the field, if the field is a column in a table",พิมพ์หน้ากว้างของข้อมูลหากข้อมูลเป็นคอลัมน์ในตาราง
DocType: Dropbox Settings,Dropbox Access Key,ที่สำคัญในการเข้าถึง Dropbox
DocType: Workflow State,headphones,หูฟัง
DocType: Email Account,e.g. replies@yourcomany.com. All replies will come to this inbox.,เช่น replies@yourcomany.com คำตอบทั้งหมดจะมาถึงกล่องจดหมายนี้
apps/frappe/frappe/templates/includes/login/login.js +36,Valid email and name required,อีเมลที่ถูกต้องและชื่อที่ต้องการ
DocType: DocType,Hide Heading,ซ่อนหัวเรื่อง
apps/frappe/frappe/config/core.py +17,Groups of DocTypes,กลุ่ม DocTypes
DocType: Workflow State,remove-circle,ลบวงกลม
