,Document Share Report,แบ่งปันเอกสารรายงาน
DocType: User,Last Login,เข้าสู่ระบบล่าสุด
apps/frappe/frappe/core/doctype/doctype/doctype.py +447,Fieldname is required in row {0},fieldname จะต้อง อยู่ในแถว {0}
apps/frappe/frappe/print/page/print_format_builder/print_format_builder_column_selector.html +4,Column,คอลัมน์
DocType: Custom Field,Adds a custom field to a DocType,เพิ่มฟิลด์ที่กำหนดเองเพื่อ DocType
DocType: File,Is Home Folder,เป็นโฟลเดอร์แรก
apps/frappe/frappe/public/js/frappe/ui/editor.html +6,Bold (Ctrl/Cmd+B),หนา (Ctrl / Cmd + B)
apps/frappe/frappe/core/page/user_permissions/user_permissions.js +140,Upload and Sync,อัปโหลดและซิงค์
apps/frappe/frappe/public/js/frappe/form/share.js +35,Shared with {0},ร่วมกับ {0}
DocType: Communication,Reference Name,ชื่ออ้างอิง
DocType: Error Snapshot,Exception,ข้อยกเว้น
DocType: Email Account,Use IMAP,ใช้ IMAP
DocType: DocType,Single Types have only one record no tables associated. Values are stored in tabSingles,ประเภท เดียว มีเพียง หนึ่งระเบียน ในตาราง ที่เกี่ยวข้อง ค่าที่ เก็บไว้ใน tabSingles
DocType: Workflow,Rules defining transition of state in the workflow.,กฎการกำหนดเปลี่ยนแปลงของรัฐในเวิร์กโฟลว์
DocType: File,Folder,โฟลเดอร์
DocType: DocField,Index,ดัชนี
DocType: Email Group,Newsletter Manager,ผู้จัดการจดหมายข่าว
apps/frappe/frappe/custom/doctype/custom_field/custom_field.js +55,Option 1,ตัวเลือกที่ 1
apps/frappe/frappe/public/js/frappe/ui/editor.html +12,Number list,รายการจำนวน
apps/frappe/frappe/config/setup.py +84,Log of error during requests.,เข้าสู่ระบบของข้อผิดพลาดระหว่างการร้องขอ
apps/frappe/frappe/email/doctype/newsletter/newsletter.py +27,Scheduled to send to {0},กำหนดให้ ส่งไปที่ {0}
DocType: DocShare,Everyone,ทุกคน
DocType: Workflow State,backward,ย้อนกลับ
apps/frappe/frappe/core/doctype/doctype/doctype.py +511,"{0}: Only one rule allowed with the same Role, Level and {1}",{0}: เพียงคนเดียวที่ได้รับอนุญาตให้มีกฎบทบาทเดียวกันและระดับ {1}
DocType: Workflow State,share,หุ้น
apps/frappe/frappe/config/setup.py +102,Set numbering series for transactions.,ตั้ง จำนวน ชุด สำหรับการทำธุรกรรม
apps/frappe/frappe/desk/like.py +38,You cannot like something that you created,คุณไม่สามารถชอบสิ่งที่คุณสร้างขึ้น
DocType: User,Last IP,IP สุดท้าย
DocType: DocPerm,Filter records based on User Permissions defined for a user,การกรองระเบียน ตาม สิทธิ์ของผู้ใช้ ที่กำหนดไว้ สำหรับผู้ใช้
apps/frappe/frappe/public/js/frappe/ui/editor.html +45,Insert picture (or just drag & drop),แทรกรูปภาพ (หรือเพียงแค่ลากและวาง)
apps/frappe/frappe/custom/doctype/custom_field/custom_field.py +37,Fieldname not set for Custom Field,fieldname ไม่ได้ ตั้งไว้สำหรับ ฟิลด์ที่กำหนดเอง
apps/frappe/frappe/public/js/frappe/model/model.js +22,Last Updated By,แก้ไขล่าสุดโดย
apps/frappe/frappe/public/js/frappe/form/workflow.js +117,is not allowed.,ไม่ได้รับอนุญาต
apps/frappe/frappe/email/doctype/email_group/email_group.js +6,View Subscribers,ดูสมาชิก
DocType: Website Theme,Background Color,สีพื้นหลัง
apps/frappe/frappe/public/js/frappe/views/communication.js +420,There were errors while sending email. Please try again.,มีข้อผิดพลาด ในขณะที่ มี การส่งอีเมล์ โปรดลองอีกครั้ง
DocType: Web Page,0 is highest,สูงสุดคือ 0
apps/frappe/frappe/www/login.html +81,Send Password,ส่งรหัสผ่าน
apps/frappe/frappe/public/js/frappe/form/templates/form_sidebar.html +38,Attachments,สิ่งที่แนบมา
apps/frappe/frappe/website/doctype/web_form/web_form.py +119,You don't have the permissions to access this document,คุณไม่มีสิทธิ์ในการเข้าถึงเอกสารนี้
DocType: Email Alert,Value Changed,ค่าเปลี่ยน
apps/frappe/frappe/model/base_document.py +295,Duplicate name {0} {1},ซ้ำ ชื่อ {0} {1}
DocType: Web Form Field,Web Form Field,เขตข้อมูลฟอร์มเว็บ
apps/frappe/frappe/custom/doctype/customize_form/customize_form.js +220,Hide field in Report Builder,ข้อมูลที่ซ่อนไว้ในรายงานการสร้าง
apps/frappe/frappe/print/page/print_format_builder/print_format_builder_field.html +14,Edit HTML,แก้ไข HTML
apps/frappe/frappe/core/page/permission_manager/permission_manager.js +494,Restore Original Permissions,เรียกคืนสิทธิ์เดิม
DocType: DocField,Button,ปุ่ม
DocType: Email Account,Default Outgoing,เริ่มต้นที่ส่งออก
DocType: Workflow State,play,เล่น
apps/frappe/frappe/templates/emails/new_user.html +5,Click on the link below to complete your registration and set a new password,คลิกที่ลิงค์ด้านล่างนี้เพื่อดำเนินการลงทะเบียนของคุณและตั้งรหัสผ่านใหม่
apps/frappe/frappe/core/page/permission_manager/permission_manager.js +403,Did not add,ไม่ได้เพิ่ม
DocType: Contact Us Settings,Contact Us Settings,ติดต่อเราตั้งค่า
DocType: Workflow State,text-width,ข้อความความกว้าง
apps/frappe/frappe/public/js/legacy/form.js +142,Maximum Attachment Limit for this record reached.,วงเงินสูงสุดที่แนบมาสำหรับการบันทึกถึงนี้
DocType: Email Alert,View Properties (via Customize Form),ดูอสังหาริมทรัพย์ (ผ่านแบบฟอร์มที่กำหนดเอง)
apps/frappe/frappe/core/doctype/report/report.js +5,Report Builder reports are managed directly by the report builder. Nothing to do.,รายงานของตัวสร้างรายงาน จะถูกจัดการโดยตรงผ่านตัวสร้างรายงาน ไม่มีอะไรให้ดำเนินการ
apps/frappe/frappe/model/document.py +832,none of,ไม่มี
apps/frappe/frappe/public/js/frappe/views/communication.js +66,Send Me A Copy,ส่งสำเนา
apps/frappe/frappe/core/page/user_permissions/user_permissions.js +127,Upload User Permissions,อัปโหลดสิทธิ์ของผู้ใช้
apps/frappe/frappe/config/website.py +7,Web Site,เว็บไซต์
apps/frappe/frappe/core/page/desktop/all_applications_dialog.html +8,Checked items will be shown on desktop,รายการตรวจสอบจะแสดงบนเดสก์ทอป
apps/frappe/frappe/core/doctype/doctype/doctype.py +554,{0} cannot be set for Single types,{0} ไม่สามารถตั้งค่า สำหรับชนิด เดี่ยว
apps/frappe/frappe/public/js/frappe/form/form_viewers.js +48,{0} are currently viewing this document,{0} กำลังดูเอกสารนี้
apps/frappe/frappe/custom/doctype/customize_form/customize_form.py +108,{0} updated,{0} ได้รับการปรับปรุง
apps/frappe/frappe/core/doctype/doctype/doctype.py +544,Report cannot be set for Single types,รายงาน ไม่สามารถตั้งค่า สำหรับชนิด เดี่ยว
apps/frappe/frappe/public/js/frappe/views/test_runner.js +17,"To run a test add the module name in the route after '{0}'. For example, {1}",เมื่อต้องการเรียกใช้การทดสอบโมดูลเพิ่มชื่อในเส้นทางหลังจากที่ &#39;{0}&#39; ยกตัวอย่างเช่น {1}
apps/frappe/frappe/public/js/frappe/misc/pretty_date.js +46,{0} days ago,{0} วันที่ผ่านมา
DocType: Contact Us Settings,Address Line 1,ที่อยู่บรรทัดที่ 1
DocType: DocPerm,Role,บทบาท
apps/frappe/frappe/utils/data.py +418,Cent,Cent
apps/frappe/frappe/config/setup.py +198,"States for workflow (e.g. Draft, Approved, Cancelled).",สหรัฐอเมริกาเป็น ขั้นตอนการทำงาน (เช่น ร่าง อนุมัติ ยกเลิก )
apps/frappe/frappe/public/js/frappe/form/link_selector.js +136,Set Quantity,ระบุจำนวน
DocType: User,Unsubscribed,ยกเลิกการสมัคร
,Data Import Tool,นำเข้าข้อมูล เครื่องมือ
apps/frappe/frappe/core/doctype/user/user.py +535,Registration Details Emailed.,รายละเอียดการลงทะเบียนส่งอีเมล
apps/frappe/frappe/desk/page/setup_wizard/setup_wizard.js +525,Attach Your Picture,แนบ รูปของคุณ
DocType: Workflow State,Stop,หยุด
DocType: Footer Item,Link to the page you want to open. Leave blank if you want to make it a group parent.,เชื่อมโยงไปยังหน้าเว็บที่คุณต้องการที่จะเปิด ปล่อยว่างไว้ถ้าคุณต้องการที่จะให้มันผู้ปกครองกลุ่ม
DocType: DocType,Is Single,เป็นโสด
apps/frappe/frappe/email/queue.py +242,{0} has left the conversation in {1} {2},{0} ได้ออกจากการสนทนาใน {1} {2}
DocType: Blogger,User ID of a Blogger,ชื่อผู้ใช้ ID ของ Blogger
apps/frappe/frappe/core/doctype/user/user.py +239,There should remain at least one System Manager,ควรยังคงอยู่อย่างน้อยหนึ่งตัวจัดการระบบ
DocType: Workflow State,circle-arrow-right,วงกลมลูกศรขวา
apps/frappe/frappe/public/js/legacy/form.js +72,Cannot open instance when its {0} is open,ไม่สามารถเปิด เช่นเมื่อ มัน {0} เปิด
DocType: Scheduler Log,Method,วิธี
DocType: Report,Script Report,รายงานสคริปต์
DocType: About Us Settings,Company Introduction,แนะนำ บริษัท
DocType: DocField,Length,ระยะ
DocType: Email Alert,"To add dynamic subject, use jinja tags like

<div><pre><code>{{ doc.name }} Delivered</code></pre></div>",ในการเพิ่มเรื่องแบบไดนามิกที่ใช้แท็ก jinja เช่น <div><pre> <code>{{ doc.name }} Delivered</code> </pre> </div>
DocType: DocPerm,Apply User Permissions,สมัคร สิทธิ์ของผู้ใช้
DocType: User,Modules HTML,โมดูล HTML
apps/frappe/frappe/public/js/frappe/ui/field_group.js +75,Missing Values Required,ค่านิยม ที่จำเป็น ขาดหายไป
apps/frappe/frappe/public/js/frappe/list/list_permission_footer.html +12,{0} is not set,{0} ไม่ได้ตั้งค่า
apps/frappe/frappe/share.py +136,No permission to {0} {1} {2},ไม่มีสิทธิ์ในการ {0} {1} {2}
apps/frappe/frappe/public/js/frappe/form/workflow.js +42,Note: Other permission rules may also apply,หมายเหตุ: กฎอนุญาตอื่น ๆ ที่ยังอาจมี
apps/frappe/frappe/permissions.py +266,Not allowed to access {0} with {1} = {2},ไม่ได้รับอนุญาต ในการเข้าถึง {0} ด้วย {1} = {2}
apps/frappe/frappe/templates/emails/print_link.html +2,View this in your browser,ดูในเบราว์เซอร์ของคุณ
DocType: DocType,Search Fields,เขตข้อมูลการค้นหา
apps/frappe/frappe/public/js/legacy/print_format.js +124,No document selected,เอกสารไม่ได้เลือก
DocType: Event,Event,เหตุการณ์
apps/frappe/frappe/public/js/frappe/views/communication.js +457,"On {0}, {1} wrote:","เมื่อวันที่ {0}, {1} เขียน:"
apps/frappe/frappe/custom/doctype/customize_form/customize_form.js +99,Cannot delete standard field. You can hide it if you want,ไม่สามารถลบสนามมาตรฐาน คุณสามารถซ่อนได้ถ้าคุณต้องการ
DocType: Top Bar Item,For top bar,สำหรับ แถบด้านบน
DocType: Contact Us Settings,Address,ที่อยู่
DocType: Print Settings,In points. Default is 9.,ในจุดที่ เริ่มต้นคือ 9
apps/frappe/frappe/public/js/frappe/ui/editor.html +61,Reduce indent (Shift+Tab),ลดการเยื้อง (Shift + Tab)
DocType: Workflow State,heart,หัวใจ
DocType: Workflow State,minus,ลบ
apps/frappe/frappe/public/js/frappe/request.js +118,Server Error: Please check your server logs or contact tech support.,ข้อผิดพลาด ของเซิร์ฟเวอร์: กรุณาตรวจสอบ เซิร์ฟเวอร์ล็อก หรือติดต่อฝ่ายสนับสนุน ด้านเทคนิค ของคุณ
apps/frappe/frappe/core/doctype/user/user.py +152,Welcome email sent,ส่ง อีเมล์ต้อนรับ
apps/frappe/frappe/public/js/frappe/views/calendar.js +92,Select dates to create a new ,เลือกวันที่จะสร้างใหม่
apps/frappe/frappe/desk/page/setup_wizard/setup_wizard.js +336,Let's prepare the system for first use.,มาจัดเตรียมระบบสำหรับการใช้งานครั้งแรก
apps/frappe/frappe/desk/page/applications/applications.js +129,Featured,แนะนำ
apps/frappe/frappe/core/doctype/user/user.py +518,Already Registered,ลงทะเบียนเรียบร้อยแล้ว
DocType: System Settings,Float Precision,พรีซิชั่ลอย
apps/frappe/frappe/core/doctype/page/page.py +38,Only Administrator can edit,ผู้ดูแลระบบเท่านั้นที่สามารถแก้ไข
DocType: Property Setter,Property Setter,สถานที่ให้บริการ Setter
apps/frappe/frappe/core/page/user_permissions/user_permissions.js +222,Select User or DocType to start.,เลือก ผู้ใช้ หรือ DocType ที่จะเริ่มต้น
apps/frappe/frappe/desk/page/applications/applications.js +25,No Apps Installed,ปพลิเคชันที่ติดตั้ง
apps/frappe/frappe/custom/doctype/customize_form/customize_form.js +204,Mark the field as Mandatory,ทำเครื่องหมายฟิลด์เป็นข้อบังคับ
DocType: Communication,Clicked,คลิก
apps/frappe/frappe/public/js/legacy/form.js +927,No permission to '{0}' {1},ไม่ อนุญาตให้ ' {0} ' {1}
DocType: User,Google User ID,ID ผู้ใช้ Google
apps/frappe/frappe/desk/form/utils.py +55,This method can only be used to create a Comment,วิธีการนี้สามารถนำมาใช้เพียงเพื่อสร้างแสดงความคิดเห็น
apps/frappe/frappe/public/js/frappe/list/doclistview.js +442,No {0} found,ไม่มี {0} พบ
apps/frappe/frappe/config/setup.py +260,Add custom forms.,เพิ่มรูปแบบที่กำหนดเอง
apps/frappe/frappe/desk/like.py +84,{0}: {1} in {2},{0}: {1} ใน {2}
apps/frappe/frappe/core/page/permission_manager/permission_manager_help.html +9,The system provides many pre-defined roles. You can add new roles to set finer permissions.,ระบบให้ บทบาท ที่กำหนดไว้ล่วงหน้า หลาย คุณสามารถเพิ่ม บทบาทใหม่ เพื่อกำหนดสิทธิ์ ปลีกย่อย
DocType: Country,Geo,Geo
apps/frappe/frappe/desk/page/applications/applications.js +46,Domains,โดเมน
DocType: Blog Category,Blog Category,หมวดหมู่บล็อก
apps/frappe/frappe/model/mapper.py +82,Cannot map because following condition fails: ,ไม่สามารถ map เพราะเงื่อนไขดังต่อไปนี้ล้มเหลว:
DocType: User,Roles HTML,HTML บทบาท
apps/frappe/frappe/core/doctype/user/user_list.js +12,Active,ใช้งาน
apps/frappe/frappe/public/js/frappe/form/templates/grid_form.html +26,Insert Below,ใส่ด้านล่าง
apps/frappe/frappe/custom/doctype/customize_form/customize_form.js +132,All customizations will be removed. Please confirm.,การปรับแต่งทั้งหมดจะถูกลบออก กรุณายืนยัน
DocType: Page,Page HTML,HTML หน้า
apps/frappe/frappe/public/js/frappe/views/treeview.js +221,Further nodes can be only created under 'Group' type nodes,โหนด เพิ่มเติมสามารถ ถูกสร้างขึ้น ภายใต้ โหนด ' กลุ่ม ประเภท
DocType: Web Page,Header,ส่วนหัว
apps/frappe/frappe/public/js/frappe/model/model.js +80,Unknown Column: {0},ไม่ทราบ คอลัมน์ : {0}
DocType: Email Alert Recipient,Optional: Always send to these ids. Each email id on a new row,ตัวเลือก: ส่งไปให้รหัสเหล่านี้ อีเมล์แต่ละแถวใหม่
apps/frappe/frappe/core/page/permission_manager/permission_manager.js +299,Users with role {0}:,ผู้ใช้ที่มี บทบาท {0}:
apps/frappe/frappe/desk/page/applications/applications.py +76,Installing App {0},การติดตั้ง App {0}
DocType: Print Format,Custom Format,รูปแบบที่กำหนดเอง
DocType: Workflow State,random,สุ่ม
DocType: Dropbox Backup,Integrations,Integrations
DocType: DocField,Section Break,แบ่งส่วน
,Messages,ข้อความ
apps/frappe/frappe/desk/page/applications/applications.js +49,Portal,พอร์ทัล
apps/frappe/frappe/desk/query_report.py +76,Must specify a Query to run,ต้องระบุแบบสอบถามที่จะเรียกใช้
apps/frappe/frappe/config/setup.py +73,"Language, Date and Time settings",ภาษา วันที่ และ เวลาที่ การตั้งค่า
DocType: Event,Saturday,วันเสาร์
DocType: User,Represents a User in the system.,หมายถึงผู้ใช้งานในระบบ
DocType: Communication,Label,ฉลาก
apps/frappe/frappe/desk/form/assign_to.py +140,"The task {0}, that you assigned to {1}, has been closed.","งาน {0} ที่คุณได้รับมอบหมายให้ {1}, ถูกปิด"
DocType: User,Modules Access,การเข้าถึงโมดูล
DocType: Print Format,Print Format Type,พิมพ์รูปแบบประเภท
apps/frappe/frappe/public/js/frappe/ui/toolbar/about.js +7,Open Source Applications for the Web,เปิดโปรแกรมที่มาสำหรับเว็บ
DocType: Website Theme,"Add the name of a ""Google Web Font"" e.g. ""Open Sans""",เพิ่มชื่อของ &quot;Google เว็บอักษร&quot; เช่น &quot;เปิดซอง&quot;
apps/frappe/frappe/public/js/frappe/request.js +123,Request Timed Out,ร้องขอหมดเวลา
DocType: DocType,Hide Toolbar,ซ่อนแถบเครื่องมือ
DocType: User,Last Active,เคลื่อนไหวล่าสุด
DocType: Email Account,SMTP Settings for outgoing emails,การตั้งค่า SMTP สำหรับอีเมลขาออก
apps/frappe/frappe/core/page/data_import_tool/data_import_tool.js +160,Import Failed,นำเข้าล้มเหลว
apps/frappe/frappe/templates/emails/password_update.html +3,Your password has been updated. Here is your new password,รหัสผ่านของคุณได้รับการปรับปรุง นี่คือรหัสผ่านใหม่ของคุณ
DocType: Email Account,Auto Reply Message,ข้อความตอบกลับอัตโนมัติ
DocType: Bulk Update,Condition,สภาพ
DocType: Communication,Sent,ส่ง
DocType: File,Lft,ซ้าย
apps/frappe/frappe/public/js/frappe/ui/toolbar/awesome_bar.js +111,Open a module or tool,เปิดโมดูลหรือเครื่องมือ
DocType: Communication,Delivery Status,สถานะการจัดส่งสินค้า
DocType: Module Def,App Name,ชื่อ แอพพลิเคชั่น
DocType: Workflow,"Field that represents the Workflow State of the transaction (if field is not present, a new hidden Custom Field will be created)",สนามที่แสดงถึงรัฐเวิร์กโฟลว์ของการทำธุรกรรม (ถ้าเขตข้อมูลไม่ใช่ปัจจุบันฟิลด์ที่กำหนดเองใหม่ซ่อนจะถูกสร้างขึ้น)
apps/frappe/frappe/utils/oauth.py +171,Email not verified with {1},อีเมล์ ไม่ได้ ตรวจสอบกับ {1}
apps/frappe/frappe/print/page/print_format_builder/print_format_builder.js +556,Edit to add content,แก้ไขเพื่อเพิ่มเนื้อหา
apps/frappe/frappe/public/js/frappe/views/communication.js +78,Select Languages,เลือกภาษา
apps/frappe/frappe/__init__.py +485,No permission for {0},ไม่อนุญาตให้ {0}
DocType: Web Form,Advanced,ก้าวหน้า
apps/frappe/frappe/templates/emails/auto_reply.html +3,Reference: {0} {1},อ้างอิง: {0} {1}
DocType: File,Attached To Name,ที่แนบมากับชื่อ
apps/frappe/frappe/email/receive.py +91,Invalid User Name or Support Password. Please rectify and try again.,ชื่อผู้ใช้งาน ที่ไม่ถูกต้อง หรือ การสนับสนุน ผ่าน กรุณา แก้ไข และลองอีกครั้ง
DocType: Email Account,Login Id is Different,เข้าสู่ระบบที่แตกต่างกันคือ Id
DocType: Email Account,Yahoo Mail,จดหมาย Yahoo
apps/frappe/frappe/core/page/permission_manager/permission_manager.js +476,Saved!,ที่บันทึกไว้!
apps/frappe/frappe/desk/page/activity/activity_row.html +21,Updated {0}: {1},Updated {0}: {1}
DocType: DocType,User Cannot Create,ผู้ใช้ไม่สามารถสร้าง
apps/frappe/frappe/core/doctype/file/file.py +247,Folder {0} does not exist,โฟลเดอร์ {0} ไม่อยู่
apps/frappe/frappe/core/page/user_permissions/user_permissions.js +27,"These will also be set as default values for those links, if only one such permission record is defined.",เหล่านี้จะ ถูกกำหนดเป็น ค่าเริ่มต้น สำหรับการเชื่อมโยง เหล่านั้น ถ้า เพียงคนเดียวที่ ได้รับอนุญาต ดังกล่าว บันทึก ถูกกำหนดไว้
DocType: Customize Form,Enter Form Type,ป้อนประเภทแบบฟอร์ม
apps/frappe/frappe/public/js/frappe/list/list_sidebar_stat.html +5,No records tagged.,ระเบียนที่ไม่มีการติดแท็ก
DocType: User,Send Password Update Notification,ส่งแจ้งเตือนการปรับปรุงรหัสผ่าน
apps/frappe/frappe/public/js/legacy/form.js +62,"Allowing DocType, DocType. Be careful!","ช่วยให้ DocType , DocType ระวัง !"
apps/frappe/frappe/config/core.py +32,"Customized Formats for Printing, Email","รูปแบบที่กำหนดเองสำหรับการพิมพ์, อีเมล์"
apps/frappe/frappe/public/js/frappe/desk.js +335,Updated To New Version,การปรับปรุงเพื่อให้รุ่นใหม่
