apps/frappe/frappe/utils/change_log.py +242,New {} releases for the following apps are available,เปิดตัว {{@} ใหม่สำหรับแอปพลิเคชันต่อไปนี้
apps/frappe/frappe/website/doctype/web_form/web_form.py +59,Please select a Amount Field.,โปรดเลือกฟิลด์ยอดเงิน
apps/frappe/frappe/custom/doctype/customize_form/customize_form.js +284,Press Esc to close,กด Esc เพื่อปิด
apps/frappe/frappe/desk/form/assign_to.py +168,"A new task, {0}, has been assigned to you by {1}. {2}",งานใหม่ {0} ได้รับมอบหมายให้กับคุณโดย {1} {2}
DocType: Email Queue,Email Queue records.,บันทึกคิวอีเมล์
DocType: Post,Post,เสา
DocType: Address,Punjab,ปัญจาบ
apps/frappe/frappe/config/setup.py +126,Rename many items by uploading a .csv file.,เปลี่ยนชื่อ หลายรายการ โดยการอัปโหลดไฟล์ CSV .
DocType: Workflow State,pause,หยุด
apps/frappe/frappe/www/desk.py +18,You are not permitted to access this page.,คุณยังไม่ได้รับอนุญาตให้เข้าถึงหน้านี้
apps/frappe/frappe/integrations/doctype/ldap_settings/ldap_settings.py +33,Seems ldap is not installed on system.<br>Guidelines to install ldap dependancies and python package,ดูเหมือน ldap ไม่ได้ถูกติดตั้งในระบบ <br> แนวทางในการติดตั้ง dependant ldap และแพคเกจ python
DocType: About Us Settings,Website,เว็บไซต์
apps/frappe/frappe/www/me.py +14,You need to be logged in to access this page,คุณต้องเข้าสู่ระบบเพื่อเข้าถึงหน้านี้
DocType: System Settings,Note: Multiple sessions will be allowed in case of mobile device,หมายเหตุ: หลายครั้งจะได้รับอนุญาตในกรณีของโทรศัพท์มือถือ
apps/frappe/frappe/email/queue.py +259,Cannot send this email. You have crossed the sending limit of {0} emails for this month.,ไม่สามารถส่งอีเมล์นี้ คุณได้ข้ามขีด จำกัด การส่ง {0} อีเมลสำหรับเดือนนี้
apps/frappe/frappe/public/js/legacy/form.js +775,Permanently Submit {0}?,อย่างถาวร ส่ง {0}?
apps/frappe/frappe/desk/page/backups/backups.js +12,Download Files Backup,ดาวน์โหลดไฟล์สำรอง
DocType: Address,County,เขต/อำเภอ
DocType: Workflow,If Checked workflow status will not override status in list view,ถ้าสถานะเวิร์กโฟลว์การยืมจะไม่แทนที่สถานะในมุมมองรายการ
apps/frappe/frappe/client.py +302,Invalid file path: {0},เส้นทางของไฟล์ไม่ถูกต้อง: {0}
DocType: Workflow State,eye-open,ตาเปิด
DocType: Email Queue,Send After,หลังจากที่ส่ง
apps/frappe/frappe/core/doctype/file/file.py +327,Please select a file or url,โปรดเลือกไฟล์หรือพิมพ์ URL
apps/frappe/frappe/public/js/frappe/views/treeview.js +89,{0} Tree,{0} ทรี
DocType: User,User Emails,อีเมล์ของผู้ใช้
DocType: User,Username,ชื่อผู้ใช้
apps/frappe/frappe/public/js/frappe/views/file/file_view.js +90,Import Zip,นำเข้า Zip
apps/frappe/frappe/model/base_document.py +565,Value too big,ค่ามีขนาดใหญ่เกินไป
DocType: DocField,DocField,DocField
DocType: GSuite Settings,Run Script Test,เรียกใช้การทดสอบสคริปต์
DocType: Data Import,Total Rows,แถวรวม
DocType: Contact,Department,แผนก
DocType: DocField,Options,ตัวเลือก
apps/frappe/frappe/client.py +106,Cannot edit standard fields,ไม่สามารถแก้ไข เขตข้อมูลมาตรฐาน
DocType: Print Format,Print Format Builder,พิมพ์รูปแบบสร้าง
DocType: GCalendar Account,Calendar Name,ชื่อปฏิทิน
DocType: Report,Report Manager,จัดการรายงาน
DocType: Workflow,Document States,เอกสารสหรัฐอเมริกา
apps/frappe/frappe/public/js/frappe/views/pageview.js +104,Sorry! I could not find what you were looking for.,ขออภัย! ฉันไม่สามารถหาสิ่งที่คุณกำลังมองหา
DocType: Data Migration Run,Logs,บันทึก
apps/frappe/frappe/templates/emails/recurring_document_failed.html +8,It is necessary to take this action today itself for the above mentioned recurring,มันเป็นสิ่งที่จำเป็นที่จะดำเนินการในวันนี้เองสำหรับที่กล่าวมาข้างต้นที่เกิดขึ้น
DocType: Custom DocPerm,This role update User Permissions for a user,บทบาทนี้ สิทธิ์ การปรับปรุง ผู้ใช้งานของ ผู้ใช้
apps/frappe/frappe/public/js/frappe/model/model.js +538,Rename {0},เปลี่ยนชื่อ {0}
DocType: Workflow State,zoom-out,ซูมออก
apps/frappe/frappe/public/js/legacy/form.js +66,Cannot open {0} when its instance is open,ไม่สามารถเปิด {0} เมื่อ ตัวอย่าง ที่ เปิดให้บริการ
apps/frappe/frappe/model/document.py +1101,Table {0} cannot be empty,ตารางที่ {0} ไม่ว่างเปล่า
DocType: SMS Parameter,Parameter,พารามิเตอร์
apps/frappe/frappe/public/js/frappe/views/reports/grid_report.js +823,With Ledgers,ด้วย Ledgers
apps/frappe/frappe/public/js/frappe/views/image/image_view.js +13,Images,ภาพ
DocType: Activity Log,Reference Owner,เจ้าของอ้างอิง
DocType: User,"If enabled, user can login from any IP Address using Two Factor Auth, this can also be set for all users in System Settings",หากเปิดใช้งานผู้ใช้สามารถเข้าสู่ระบบจากที่อยู่ IP ใดก็ได้โดยใช้ Two Factor Auth การตั้งค่านี้ยังสามารถตั้งค่าสำหรับผู้ใช้ทั้งหมดใน System Settings
DocType: Currency,Smallest circulating fraction unit (coin). For e.g. 1 cent for USD and it should be entered as 0.01,หน่วยที่เล็กที่สุดส่วนการไหลเวียน (เหรียญ) สำหรับเช่นร้อยละ 1 เหรียญสหรัฐและมันควรจะป้อนเป็น 0.01
DocType: Social Login Key,GitHub,GitHub
apps/frappe/frappe/model/base_document.py +559,"{0}, Row {1}",{0} แถว {1}
apps/frappe/frappe/www/feedback.html +93,Please give a fullname.,โปรดให้ชื่อเต็ม
apps/frappe/frappe/model/document.py +1075,Beginning with,เริ่มต้นด้วย
apps/frappe/frappe/core/doctype/data_import/exporter.py +53,Data Import Template,ข้อมูลนำเข้าแม่แบบ
apps/frappe/frappe/public/js/frappe/model/model.js +33,Parent,ผู้ปกครอง
DocType: System Settings,"If enabled, the password strength will be enforced based on the Minimum Password Score value. A value of 2 being medium strong and 4 being very strong.",หากเปิดใช้งานความแรงของรหัสผ่านจะถูกบังคับใช้ตามค่าคะแนนรหัสผ่านขั้นต่ำ ค่าเฉลี่ย 2 มีความแข็งแรงปานกลางและ 4 มีความแข็งแรงมาก
DocType: System Settings,"If enabled, the password strength will be enforced based on the Minimum Password Score value. A value of 2 being medium strong and 4 being very strong.",หากเปิดใช้งานความแรงของรหัสผ่านจะถูกบังคับใช้ตามค่าคะแนนรหัสผ่านขั้นต่ำ ค่าเฉลี่ย 2 มีความแข็งแรงปานกลางและ 4 มีความแข็งแรงมาก
DocType: About Us Settings,"""Team Members"" or ""Management""","“สมาชิกในทีม"" หรือ ""ผู้บริหาร"""
apps/frappe/frappe/core/doctype/doctype/doctype.py +560,Default for 'Check' type of field must be either '0' or '1',เริ่มต้นสำหรับ 'ตรวจสอบ' ประเภทของข้อมูลต้องเป็น '0' หรือ '1'
apps/frappe/frappe/public/js/frappe/misc/pretty_date.js +51,Yesterday,เมื่อวาน
DocType: Contact,Designation,การแต่งตั้ง
DocType: Test Runner,Test Runner,วิ่งทดสอบ
DocType: Auto Repeat,Monthly,รายเดือน
DocType: Address,Uttarakhand,ตราขั ณ ฑ์
DocType: Email Account,Enable Incoming,เปิดใช้งานเข้ามา
apps/frappe/frappe/core/doctype/version/version_view.html +47,Danger,อันตราย
apps/frappe/frappe/www/login.html +21,Email Address,ที่อยู่อีเมล
DocType: Workflow State,th-large,-th ใหญ่
DocType: Communication,Unread Notification Sent,แจ้งส่งยังไม่ได้อ่าน
apps/frappe/frappe/public/js/frappe/misc/tools.js +10,Export not allowed. You need {0} role to export.,ส่งออก ไม่ได้รับอนุญาต คุณต้อง {0} บทบาท ในการส่งออก
DocType: System Settings,In seconds,ภายในไม่กี่วินาที
apps/frappe/frappe/public/js/frappe/list/list_view.js +1079,Cancel {0} documents?,ยกเลิกเอกสาร {0} หรือไม่?
DocType: DocType,Is Published Field,มีการเผยแพร่สนาม
DocType: GCalendar Settings,GCalendar Settings,การตั้งค่า GCalendar
DocType: Email Group,Email Group,กลุ่มอีเมล์
DocType: Note,Seen By,เห็นโดย
apps/frappe/frappe/public/js/frappe/form/grid.js +69,Add Multiple,เพิ่มหลายรายการ
apps/frappe/frappe/core/doctype/user/user.py +87,Not a valid User Image.,ไม่ใช่รูปภาพผู้ใช้ที่ถูกต้อง
DocType: Success Action,First Success Message,ข้อความแสดงความสำเร็จเป็นครั้งแรก
apps/frappe/frappe/public/js/frappe/ui/filters/filters.js +512,Not Like,ไม่ชอบ
apps/frappe/frappe/custom/doctype/customize_form/customize_form.js +214,Set the display label for the field,ตั้งป้ายแสดงผลสำหรับฟิลด์
apps/frappe/frappe/model/document.py +1092,Incorrect value: {0} must be {1} {2},ค่าไม่ถูกต้อง: {0} จะต้อง {1} {2}
apps/frappe/frappe/config/setup.py +242,"Change field properties (hide, readonly, permission etc.)","เปลี่ยนคุณสมบัติ เขตข้อมูล (ซ่อน , อ่านได้อย่างเดียว ได้รับอนุญาต ฯลฯ )"
DocType: Workflow State,lock,ล็อค
apps/frappe/frappe/config/website.py +78,Settings for Contact Us Page.,การตั้งค่าสำหรับหน้าติดต่อเรา
apps/frappe/frappe/core/doctype/user/user.py +918,Administrator Logged In,ผู้ดูแลระบบเข้าสู่ระบบ
DocType: Contact Us Settings,"Contact options, like ""Sales Query, Support Query"" etc each on a new line or separated by commas.",ตัวเลือกการติดต่อเช่น &quot;แบบสอบถามขายการสนับสนุนแบบสอบถาม&quot; ฯลฯ แต่ละบรรทัดใหม่หรือคั่นด้วยเครื่องหมายจุลภาค
apps/frappe/frappe/public/js/frappe/ui/tag_editor.js +34,Add a tag ...,เพิ่มแท็ก ...
apps/frappe/frappe/desk/doctype/auto_repeat/auto_repeat.py +285,New {0}: #{1},ใหม่ {0}: # {1}
DocType: Data Migration Run,Insert,แทรก
apps/frappe/frappe/public/js/frappe/form/link_selector.js +22,Select {0},เลือก {0}
apps/frappe/frappe/integrations/doctype/social_login_key/social_login_key.py +24,Please enter Base URL,โปรดป้อน URL พื้นฐาน
DocType: Auto Repeat,Repeat on Day,ทำซ้ำในวัน
DocType: DocField,Color,สี
DocType: Data Migration Run,Log,เข้าสู่ระบบ
DocType: Workflow State,indent-right,เยื้องขวา
DocType: Has Role,Has Role,มีบทบาท
DocType: System Settings,Time in seconds to retain QR code image on server. Min:<strong>240</strong>,เวลาเป็นวินาทีเพื่อเก็บภาพโค้ด QR บนเซิร์ฟเวอร์ ต่ำสุด: <strong>240</strong>
apps/frappe/frappe/public/js/frappe/views/inbox/inbox_view.js +20,Invalid Email Account,บัญชีอีเมลไม่ถูกต้อง
apps/frappe/frappe/public/js/frappe/ui/upload.html +12,Web Link,เว็บลิงค์
DocType: Deleted Document,Restored,การบูรณะ
apps/frappe/frappe/public/js/frappe/misc/pretty_date.js +47,1 minute ago,1 นาทีที่ผ่านมา
apps/frappe/frappe/core/page/permission_manager/permission_manager_help.html +36,"Apart from System Manager, roles with Set User Permissions right can set permissions for other users for that Document Type.",นอกเหนือจากการจัดการระบบบทบาทกับการตั้งค่าสิทธิ์ของผู้ใช้ที่เหมาะสมสามารถกำหนดสิทธิ์สำหรับผู้ใช้อื่น ๆ สำหรับประเภทเอกสารที่
DocType: Company History,Company History,ประวัติ บริษัท
apps/frappe/frappe/website/doctype/portal_settings/portal_settings.js +19,Reset,รีเซ็ต
DocType: Workflow State,volume-up,ปริมาณขึ้น
apps/frappe/frappe/config/integrations.py +78,Webhooks calling API requests into web apps,Webhooks เรียก API คำขอไปยังเว็บแอ็พพลิเคชัน
DocType: DocType,Default Print Format,รูปแบบการพิมพ์เริ่มต้น
DocType: Workflow State,Tags,แท็ก
apps/frappe/frappe/public/js/frappe/form/workflow.js +35,None: End of Workflow,: ไม่มีสิ้นสุดเวิร์กโฟลว์
apps/frappe/frappe/model/db_schema.py +359,"{0} field cannot be set as unique in {1}, as there are non-unique existing values",{0} เขตข้อมูลไม่สามารถกำหนดให้เป็นเอกลักษณ์ใน {1} เนื่องจากมีค่าที่ซ้ำกันอยู่
apps/frappe/frappe/core/page/permission_manager/permission_manager.js +48,Document Types,ประเภทเอกสาร
DocType: Address,Jammu and Kashmir,ชัมมูและแคชเมียร์
DocType: Workflow,Workflow State Field,ฟิลด์สถานะของเวิร์กโฟลว์
apps/frappe/frappe/website/doctype/web_form/templates/web_form.html +59,Please sign-up or login to begin,กรุณาลงทะเบียนหรือเข้าสู่ระบบที่จะเริ่มต้น
DocType: Blog Post,Guest,ผู้เยี่ยมชม
DocType: DocType,Title Field,ชื่อ ฟิลด์
DocType: Error Log,Error Log,บันทึกข้อผิดพลาด
apps/frappe/frappe/utils/password_strength.py +108,"Repeats like ""abcabcabc"" are only slightly harder to guess than ""abc""",ซ้ำเช่น &quot;abcabcabc&quot; เป็นเพียงเล็กน้อยยากที่จะคาดเดามากกว่า &quot;ABC&quot;
DocType: Notification,Channel,ช่อง
apps/frappe/frappe/templates/emails/administrator_logged_in.html +3,"If you think this is unauthorized, please change the Administrator password.",หากคุณคิดว่านี่คือไม่ได้รับอนุญาตโปรดเปลี่ยนรหัสผ่านของผู้ดูแลระบบ
apps/frappe/frappe/email/doctype/email_account/email_account.py +80,{0} is mandatory,ต้องระบุ {0}
DocType: Workflow State,eject,ขับ
apps/frappe/frappe/public/js/legacy/client_script_helpers.js +300,Field {0} not found.,ฟิลด์ {0} ไม่พบ
DocType: Chat Room,Owner,เจ้าของ
DocType: Communication,Visit,เยี่ยม
DocType: LDAP Settings,LDAP Search String,ค้นหา LDAP สตริง
DocType: Translation,Translation,การแปล
apps/frappe/frappe/desk/page/setup_wizard/install_fixtures.py +16,Mr,นาย
DocType: Custom Script,Client,ลูกค้า
apps/frappe/frappe/public/js/frappe/views/reports/report_view.js +261,Select Column,เลือกคอลัมน์
apps/frappe/frappe/public/js/legacy/form.js +476,This form has been modified after you have loaded it,รูปแบบนี้ได้รับการแก้ไขหลังจากที่คุณได้โหลด
DocType: User Permission for Page and Report,User Permission for Page and Report,อนุญาตผู้ใช้งานของหน้าและรายงาน
DocType: Address,Himachal Pradesh,รัฐหิมาจัลประเทศ
DocType: System Settings,"If not set, the currency precision will depend on number format",หากไม่ได้ตั้งค่าความแม่นยำของสกุลเงินจะขึ้นอยู่กับรูปแบบตัวเลข
DocType: System Settings,"If not set, the currency precision will depend on number format",หากไม่ได้ตั้งค่าความแม่นยำของสกุลเงินจะขึ้นอยู่กับรูปแบบตัวเลข
apps/frappe/frappe/integrations/doctype/stripe_settings/stripe_settings.py +72,"It seems that there is an issue with the server's stripe configuration. In case of failure, the amount will get refunded to your account.",ดูเหมือนว่ามีปัญหากับการกำหนดค่าแถบของเซิร์ฟเวอร์ ในกรณีที่เกิดความล้มเหลวจำนวนเงินจะได้รับคืนไปยังบัญชีของคุณ
DocType: Data Import,Import Log,บันทึกข้อมูลการนำเข้า
apps/frappe/frappe/config/website.py +27,Embed image slideshows in website pages.,ฝังภาพสไลด์ภาพในหน้าเว็บไซต์
apps/frappe/frappe/email/doctype/newsletter/newsletter.js +9,Send,ส่ง
DocType: Workflow Action Master,Workflow Action Name,ชื่อการกระทำ ใน กระบวนการทำงาน
apps/frappe/frappe/core/doctype/doctype/doctype.py +355,DocType can not be merged,DocType ไม่สามารถ รวม
DocType: Web Form Field,Fieldtype,fieldtype
apps/frappe/frappe/core/doctype/file/file.py +285,Not a zip file,ไม่ได้เป็นไฟล์ซิป
DocType: Auto Repeat,"To add dynamic subject, use jinja tags like

<div><pre><code>New {{ doc.doctype }} #{{ doc.name }}</code></pre></div>",ในการเพิ่มเรื่องแบบไดนามิกให้ใช้แท็ก jinja เช่น <div><pre> <code>New {{ doc.doctype }} #{{ doc.name }}</code> </pre> </div>
apps/frappe/frappe/public/js/frappe/form/save.js +147,"Mandatory fields required in table {0}, Row {1}",ข้อมูลที่จำเป็นต้องใช้ในตาราง {0} แถว {1}
apps/frappe/frappe/utils/password_strength.py +196,Capitalization doesn't help very much.,โครงสร้างเงินทุนไม่ได้ช่วยมาก
DocType: Error Snapshot,Friendly Title,ชื่อเรื่องที่เป็นมิตร
DocType: Newsletter,Email Sent?,อีเมลที่ส่ง?
apps/frappe/frappe/public/js/frappe/views/reports/report_view.js +1036,Toggle Chart,สลับแผนภูมิ
apps/frappe/frappe/desk/form/save.py +50,Did not cancel,ไม่ได้ยกเลิก
DocType: Social Login Key,Client Information,ข้อมูลลูกค้า
DocType: Workflow State,plus,บวก
apps/frappe/frappe/integrations/oauth2.py +118,Logged in as Guest or Administrator,เข้าสู่ระบบในฐานะแขกหรือผู้ดูแลระบบ
DocType: Email Account,UNSEEN,UNSEEN
apps/frappe/frappe/public/js/frappe/views/file/file_view.js +38,File Manager,ตัวจัดการไฟล์
DocType: GCalendar Account,Refresh Token,รีเฟรช Token
DocType: Address,Goa,กัว
DocType: Webhook,Doc Event,เหตุการณ์หมอ
apps/frappe/frappe/public/js/frappe/misc/user.js +58,You,คุณ
DocType: Braintree Settings,Braintree Settings,การตั้งค่า Braintree
DocType: Website Theme,lowercase,ตัวพิมพ์เล็ก
apps/frappe/frappe/public/js/frappe/list/list_filter.js +22,Save Filter,บันทึกตัวกรอง
DocType: Print Format,Helvetica,Helvetica
apps/frappe/frappe/public/js/frappe/list/bulk_operations.js +82,Cannot delete {0},ไม่สามารถลบ {0}
apps/frappe/frappe/public/js/frappe/ui/filters/edit_filter.html +20,Not Ancestors Of,ไม่ใช่บรรพบุรุษของ
DocType: Address,Jharkhand,จาร์ก
apps/frappe/frappe/email/doctype/newsletter/newsletter.py +40,Newsletter has already been sent,จดหมายข่าว ได้ถูกส่งไป แล้ว
apps/frappe/frappe/twofactor.py +133,"Login session expired, refresh page to retry",เซสชันการเข้าสู่ระบบหมดอายุแล้วรีเฟรชเพจเพื่อลองอีกครั้ง
DocType: Communication,BCC,BCC
DocType: Unhandled Email,Reason,เหตุผล
DocType: Email Unsubscribe,Email Unsubscribe,อีเมล์ยกเลิก
DocType: Website Settings,Select an image of approx width 150px with a transparent background for best results.,เลือกภาพจาก 150px ความกว้างประมาณกับพื้นหลังโปร่งใสเพื่อให้ได้ผลลัพธ์ที่ดีที่สุด
apps/frappe/frappe/www/third_party_apps.html +3,Third Party Apps,แอปของบุคคลที่สาม
apps/frappe/frappe/desk/page/setup_wizard/setup_wizard.js +426,The first user will become the System Manager (you can change this later).,ผู้ใช้คนแรกจะกลายเป็นตัวจัดการระบบ (คุณสามารถเปลี่ยนภายหลัง)
apps/frappe/frappe/integrations/doctype/webhook/webhook.py +29,DocType must be Submittable for the selected Doc Event,DocType ต้องถูกส่งต่อสำหรับเหตุการณ์ Doc ที่เลือกไว้
,App Installer,การติดตั้งแอพพลิเค
DocType: Workflow State,circle-arrow-up,วงกลมลูกศรขึ้น
DocType: Email Domain,Email Domain,โดเมนอีเมล์
DocType: Workflow State,italic,ตัวเอียง
apps/frappe/frappe/core/doctype/doctype/doctype.py +810,{0}: Cannot set Import without Create,{0}: ไม่สามารถตั้งค่านำเข้าได้โดยไม่ได้ สร้าง
DocType: SMS Settings,Enter url parameter for message,ป้อนพารามิเตอร์ URL สำหรับข้อความ
apps/frappe/frappe/templates/emails/auto_email_report.html +50,View report in your browser,ดูรายงานในเบราเซอร์ของคุณ
apps/frappe/frappe/config/desk.py +26,Event and other calendars.,เหตุการณ์และปฏิทินอื่น ๆ
apps/frappe/frappe/templates/includes/comments/comments.html +96,All fields are necessary to submit the comment.,ทุกช่องจำเป็นต้องส่งความคิดเห็น
DocType: Print Settings,Printer Name,ชื่อเครื่องพิมพ์
apps/frappe/frappe/public/js/frappe/views/reports/reportview.js +865,Drag to sort columns,ลากเพื่อเรียงลำดับคอลัมน์
