apps/frappe/frappe/public/js/frappe/form/footer/attachments.js +244,Select template,เลือกเทมเพลต
apps/frappe/frappe/www/third_party_apps.html +47,Logged in,เข้าสู่ระบบแล้ว
apps/frappe/frappe/integrations/doctype/ldap_settings/ldap_settings.py +41,Incorrect UserId or Password,หมายเลขผู้ใช้หรือรหัสผ่านไม่ถูกต้อง
apps/frappe/frappe/core/page/desktop/desktop.js +38,Explore,สำรวจ
apps/frappe/frappe/email/doctype/email_account/email_account_list.js +6,Default Sending and Inbox,เริ่มต้นการส่งและกล่องขาเข้า
DocType: System Settings,OTP App,OTP App
DocType: Dropbox Settings,Send Email for Successful Backup,ส่งอีเมลสำหรับการสำรองข้อมูลที่ประสบความสำเร็จ
apps/frappe/frappe/core/report/feedback_ratings/feedback_ratings.js +21,Document ID,หมายเลขเอกสาร
DocType: Print Settings,Letter,จดหมาย
DocType: DocType,"Naming Options:
<ol><li><b>field:[fieldname]</b> - By Field</li><li><b>naming_series:</b> - By Naming Series (field called naming_series must be present</li><li><b>Prompt</b> - Prompt user for a name</li><li><b>[series]</b> - Series by prefix (separated by a dot); for example PRE.#####</li>
<li><b>format:EXAMPLE-{MM}morewords{fieldname1}-{fieldname2}-{#####}</b> - Replace all braced words (fieldnames, date words (DD, MM, YY), series) with their value. Outside braces, any characters can be used.</li></ol>","ตัวเลือกการตั้งชื่อ: <ol><li> <b>ฟิลด์: [fieldname]</b> - ตามฟิลด์ </li><li> <b>naming_series:</b> - โดยการตั้งชื่อชุด (ฟิลด์ที่เรียกว่า naming_series ต้องมีอยู่ </li><li> <b>Prompt</b> - พร้อมท์ให้ผู้ใช้ระบุชื่อ </li><li> <b>[ชุดข้อมูล]</b> - ชุดข้อมูลตามคำนำหน้า (คั่นด้วยจุด); เช่น PRE. ##### </li><li> <b>รูปแบบ: EXAMPLE- {MM} morewords {fieldname1} - {fieldname2} - {#####}</b> - แทนที่คำที่มีเครื่องหมาย (fieldnames, date words (DD, MM, YY), series) ด้วยค่าของพวกเขา วงเล็บปีกกาภายนอกสามารถใช้อักขระใดก็ได้ </li></ol>"
apps/frappe/frappe/public/js/frappe/views/interaction.js +261,There were errors while creating the document. Please try again.,เกิดข้อผิดพลาดขณะสร้างเอกสาร กรุณาลองอีกครั้ง.
apps/frappe/frappe/core/doctype/doctype/doctype.py +654,Image field must be of type Attach Image,ข้อมูลภาพจะต้องเป็นชนิดแนบรูปภาพ
DocType: DocField,Columns,คอลัมน์
apps/frappe/frappe/desk/form/assign_to.py +81,Shared with user {0} with read access,แชร์กับผู้ใช้ {0} พร้อมสิทธิ์การอ่าน
DocType: GCalendar Account,Next Sync Token,รหัสการซิงค์ถัดไป
DocType: Async Task,Succeeded,ประสบความสำเร็จ
apps/frappe/frappe/public/js/frappe/form/save.js +150,Mandatory fields required in {0},เขตข้อมูล ที่จำเป็นในการ บังคับ {0}
apps/frappe/frappe/core/page/permission_manager/permission_manager.js +102,Reset Permissions for {0}?,ตั้งค่า สิทธิ์สำหรับ {0}?
DocType: S3 Backup Settings,S3 Backup Settings,S3 Backup Settings
apps/frappe/frappe/core/doctype/version/version_view.html +32,Rows Removed,แถวลบออก
apps/frappe/frappe/permissions.py +359,{0} {1} not found,{0} {1} ไม่พบ
apps/frappe/frappe/www/login.py +48,Mobile Number,เบอร์มือถือ
DocType: Communication,Attachment Removed,ไฟล์แนบถูกลบ
apps/frappe/frappe/utils/password_strength.py +132,Recent years are easy to guess.,ปีที่ผ่านมาเป็นเรื่องง่ายที่จะคาดเดา
DocType: Calendar View,Subject Field,ฟิลด์หัวเรื่อง
apps/frappe/frappe/public/js/frappe/views/interaction.js +281,The document has been assigned to {0},เอกสารถูกกำหนดให้กับ {0} แล้ว
DocType: System Settings,Show Full Error and Allow Reporting of Issues to the Developer,แสดงข้อผิดพลาดทั้งหมดและอนุญาตให้มีการรายงานปัญหาแก่นักพัฒนาซอฟต์แวร์
apps/frappe/frappe/www/third_party_apps.html +38,Active Sessions,เซสชันที่ใช้งานอยู่
apps/frappe/frappe/custom/doctype/customize_form/customize_form.js +274,Show a description below the field,แสดงข้อมูลรายละเอียดด้านล่าง
DocType: DocType,ASC,ASC
DocType: Workflow State,align-left,จัดซ้าย
DocType: User,Defaults,เริ่มต้น
DocType: Feedback Request,Feedback Submitted,ผลตอบรับส่ง
apps/frappe/frappe/public/js/frappe/model/model.js +541,Merge with existing,รวมกับที่มีอยู่
DocType: User,Birth Date,วันเกิด
DocType: Dynamic Link,Link Title,ลิงค์ติเติล
DocType: Workflow State,fast-backward,ย้อนกลับอย่างรวดเร็ว
DocType: Address,Chandigarh,Chandigarh
DocType: DocShare,DocShare,DocShare
DocType: Event,Friday,วันศุกร์
apps/frappe/frappe/public/js/frappe/form/quick_entry.js +216,Edit in full page,แก้ไขในเต็มหน้า
DocType: Report,Add Total Row,เพิ่มแถวผลรวม
apps/frappe/frappe/twofactor.py +210,Please check your registered email address for instructions on how to proceed. Do not close this window as you will have to return to it.,โปรดตรวจสอบที่อยู่อีเมลที่ลงทะเบียนของคุณสำหรับคำแนะนำในการดำเนินการ อย่าปิดหน้าต่างนี้เนื่องจากคุณจะต้องกลับไปที่หน้านี้
apps/frappe/frappe/core/page/permission_manager/permission_manager_help.html +19,For example if you cancel and amend INV004 it will become a new document INV004-1. This helps you to keep track of each amendment.,ตัวอย่างเช่นถ้าคุณยกเลิกและแก้ไข INV004 มันจะกลายเป็นเอกสารใหม่ INV004-1 นี้จะช่วยให้คุณสามารถติดตามของแต่ละการแก้ไข
apps/frappe/frappe/core/doctype/data_export/data_export.js +40,Atleast one field of Parent Document Type is mandatory,ประเภทเอกสารหลักของ Atleast หนึ่งประเภทเป็นเอกสารบังคับ
apps/frappe/frappe/config/setup.py +178,Setup Reports to be emailed at regular intervals,รายงานการตั้งค่าที่จะถูกส่งในช่วงเวลาปกติ
DocType: Workflow Document State,0 - Draft; 1 - Submitted; 2 - Cancelled,0 - ร่าง; 1 - ส่ง; 2 - ยกเลิก
DocType: File,Attached To DocType,แนบกับ DocType แล้ว
apps/frappe/frappe/integrations/doctype/ldap_settings/ldap_settings.py +27,StartTLS is not supported,ไม่สนับสนุน StartTLS
DocType: DocField,Int,int
DocType: Error Log,Title,ชื่อเรื่อง
apps/frappe/frappe/integrations/doctype/razorpay_settings/razorpay_settings.py +192,"Seems issue with server's razorpay config. Don't worry, in case of failure amount will get refunded to your account.",ดูเหมือนว่าปัญหาเกี่ยวกับการตั้งค่าเซิร์ฟเวอร์ razorpay ไม่ต้องกังวลในกรณีของความล้มเหลวของจำนวนเงินที่จะได้รับการคืนเงินในบัญชีของคุณ
apps/frappe/frappe/public/js/frappe/form/toolbar.js +171,Customize,ปรับแต่ง
apps/frappe/frappe/core/doctype/user/user.js +87,View Permitted Documents,ดูเอกสารที่ได้รับอนุญาต
apps/frappe/frappe/templates/pages/integrations/gcalendar-success.html +11,Your connection request to Google Calendar was successfully accepted,คำขอเชื่อมต่อของคุณไปยัง Google ปฏิทินได้รับการยอมรับแล้ว
apps/frappe/frappe/core/report/transaction_log_report/transaction_log_report.py +53,Chain Integrity,ความถูกต้องของ Chain Integrity
DocType: Data Export,CSV,CSV
apps/frappe/frappe/www/feedback.html +96,Please give a detailed feebdack.,โปรดให้รายละเอียด feebdack
DocType: Currency,"1 Currency = [?] Fraction
For e.g. 1 USD = 100 Cent","1 สกุลเงิน = [?] ส่วน
ตัวอย่างเช่น 1 USD = 100 Cent."
DocType: Data Import,Partially Successful,ประสบความสำเร็จบางส่วน
apps/frappe/frappe/core/doctype/user/user.py +771,"Too many users signed up recently, so the registration is disabled. Please try back in an hour",ผู้ใช้จำนวนมากเกินไปลงนามเมื่อเร็ว ๆ นี้เพื่อลงทะเบียนเป็นคนพิการ โปรดลองกลับมาในอีกหนึ่งชั่วโมง
apps/frappe/frappe/core/page/permission_manager/permission_manager.js +368,Add New Permission Rule,เพิ่มกฎการอนุญาตใหม่
apps/frappe/frappe/public/js/frappe/form/link_selector.js +26,You can use wildcard %,คุณสามารถใช้สัญลักษณ์แทน%
DocType: Chat Message Attachment,Chat Message Attachment,ข้อความในข้อความแชท
apps/frappe/frappe/public/js/frappe/upload.js +299,"Only image extensions (.gif, .jpg, .jpeg, .tiff, .png, .svg) allowed","เฉพาะส่วนขยายของภาพ (.gif, .jpg, .jpeg, .tiff, .png, SVG) ผู้ที่ได้รับอนุญาต"
DocType: Address,Manipur,มณีปุระ
DocType: Web Form Field,Allow Read On All Link Options,อนุญาตให้อ่านในตัวเลือกลิงก์ทั้งหมด
DocType: DocType,Database Engine,โปรแกรมฐานข้อมูล
DocType: Customize Form,"Fields separated by comma (,) will be included in the ""Search By"" list of Search dialog box","ทุ่งคั่นด้วยเครื่องหมายจุลภาค (,) จะรวมอยู่ใน &quot;ค้นหาโดย&quot; รายการการค้นหากล่องโต้ตอบ"
apps/frappe/frappe/website/doctype/website_theme/website_theme.py +35,Please Duplicate this Website Theme to customize.,กรุณาซ้ำธีมเว็บไซต์นี้เพื่อปรับแต่ง
apps/frappe/frappe/core/page/usage_info/usage_info.html +47,Space,ช่องว่าง
DocType: Address,Meghalaya,เมฆาลัย
DocType: DocField,Text Editor,แก้ไขข้อความ
apps/frappe/frappe/config/website.py +73,Settings for About Us Page.,การตั้งค่าสำหรับหน้าเกี่ยวกับเรา
apps/frappe/frappe/templates/emails/recurring_document_failed.html +1,Recurring,การคืน
apps/frappe/frappe/printing/page/print_format_builder/print_format_builder.js +679,Edit Custom HTML,แก้ไข HTML ที่กำหนดเอง
DocType: Error Snapshot,Error Snapshot,ภาพรวมข้อผิดพลาด
DocType: Data Migration Mapping,Remote Primary Key,คีย์รีโมตคีย์
apps/frappe/frappe/public/js/frappe/ui/filters/filters.js +512,In,ใน
DocType: Notification,Value Change,เปลี่ยนแปลงค่า
apps/frappe/frappe/public/js/frappe/views/reports/report_view.js +409,Showing only Numeric fields from Report,แสดงเฉพาะฟิลด์ตัวเลขจากรายงาน
apps/frappe/frappe/custom/doctype/customize_form/customize_form.js +235,Width of the input box,ความกว้างของกล่องใส่
DocType: Address,Subsidiary,บริษัท สาขา
DocType: System Settings,In Hours,ในชั่วโมง
apps/frappe/frappe/public/js/frappe/list/bulk_operations.js +32,With Letterhead,ด้วยจดหมาย
apps/frappe/frappe/email/smtp.py +224,Invalid Outgoing Mail Server or Port,เซิร์ฟเวอร์ อีเมลขาออก ที่ไม่ถูกต้อง หรือ พอร์ต
DocType: Custom DocPerm,Write,เขียน
apps/frappe/frappe/core/doctype/report/report.py +37,Only Administrator allowed to create Query / Script Reports,เฉพาะผู้ดูแลระบบอนุญาตให้สร้างรายงานคำ / Script
apps/frappe/frappe/public/js/frappe/form/save.js +13,Updating,อัปเดต
DocType: File,Preview,แสดงตัวอย่าง
apps/frappe/frappe/desk/doctype/bulk_update/bulk_update.js +8,"Field ""value"" is mandatory. Please specify value to be updated",ฟิลด์ &quot;ค่า&quot; มีผลบังคับใช้ กรุณาระบุค่าได้รับการปรับปรุง
DocType: Customize Form,Use this fieldname to generate title,ใช้ fieldname นี้เพื่อสร้างชื่อ
apps/frappe/frappe/email/doctype/email_group/email_group.js +13,Import Email From,นำเข้าอีเมล์จาก
apps/frappe/frappe/contacts/doctype/contact/contact.js +20,Invite as User,เชิญผู้ใช้
apps/frappe/frappe/integrations/doctype/google_maps_settings/google_maps_settings.py +18,Home Address is required,ต้องระบุที่อยู่บ้าน
DocType: Data Migration Run,Started,เริ่มต้น
DocType: Data Migration Run,End Time,เวลาสิ้นสุด
apps/frappe/frappe/public/js/frappe/views/interaction.js +83,Select Attachments,เลือกสิ่งที่แนบ
apps/frappe/frappe/model/naming.py +113, for {0},สำหรับ {0}
apps/frappe/frappe/website/js/web_form.js +140,There were errors. Please report this.,มีข้อผิดพลาดอยู่ กรุณารายงาน
apps/frappe/frappe/public/js/legacy/form.js +173,You are not allowed to print this document,คุณยังไม่ได้ รับอนุญาตให้ พิมพ์เอกสาร นี้
apps/frappe/frappe/data_migration/doctype/data_migration_run/data_migration_run.js +11,Currently updating {0},ขณะนี้กำลังอัปเดต {0}
apps/frappe/frappe/email/doctype/auto_email_report/auto_email_report.py +124,Please set filters value in Report Filter table.,กรุณาตั้งค่าฟิลเตอร์กรองในตารางรายงาน
apps/frappe/frappe/public/js/frappe/views/reports/grid_report.js +284,Loading Report,โหลดรายงาน
apps/frappe/frappe/limits.py +74,Your subscription will expire today.,การสมัครของคุณจะหมดอายุในวันนี้
apps/frappe/frappe/public/js/frappe/views/reports/report_view.js +1100,Export All {0} rows?,ส่งออกทั้งหมด {0} แถว?
DocType: Page,Standard,มาตรฐาน
apps/frappe/frappe/core/doctype/data_import/data_import.js +43,Attach File,แนบไฟล์
DocType: Data Migration Plan,Preprocess Method,วิธี Preprocess
apps/frappe/frappe/desk/page/backups/backups.html +13,Size,ขนาด
apps/frappe/frappe/public/js/frappe/form/footer/assign_to.js +59,Assignment Complete,ที่ได้รับมอบหมายให้เสร็จสมบูรณ์
DocType: Desktop Icon,Idx,IDX
DocType: Address,Madhya Pradesh,มัธยประเทศ
DocType: Deleted Document,New Name,ชื่อใหม่
DocType: System Settings,Is First Startup,เริ่มต้นใช้งานครั้งแรก
DocType: Communication,Email Status,สถานะอีเมล์
apps/frappe/frappe/public/js/frappe/form/footer/assign_to.js +111,Please save the document before removing assignment,กรุณาบันทึกเอกสารก่อนที่จะลบที่ได้รับมอบหมาย
apps/frappe/frappe/public/js/frappe/form/grid_row_form.js +49,Insert Above,แทรกเหนือ
apps/frappe/frappe/desk/form/utils.py +79,Comment can only be edited by the owner,เจ้าของสามารถแก้ไขได้เฉพาะความคิดเห็นเท่านั้น
DocType: Data Import,Do not send Emails,อย่าส่งอีเมล
apps/frappe/frappe/utils/password_strength.py +191,Common names and surnames are easy to guess.,ชื่อสามัญชื่อและนามสกุลเป็นเรื่องง่ายที่จะคาดเดา
DocType: Auto Repeat,Draft,ร่าง
apps/frappe/frappe/utils/password_strength.py +179,This is similar to a commonly used password.,นี้จะคล้ายกับรหัสผ่านที่ใช้กันทั่วไป
apps/frappe/frappe/desk/page/setup_wizard/install_fixtures.py +15,Female,หญิง
DocType: Auto Repeat,Reference Party Doctype,เอกสาร Doctype ของพรรคการเมืองอ้างอิง
DocType: Success Action,Success Action,การดำเนินการสำเร็จ
apps/frappe/frappe/public/js/frappe/model/indicator.js +19,Not Saved,ยังไม่ได้บันทึก
apps/frappe/frappe/www/third_party_apps.html +51,Revoke,ถอน
DocType: Contact,Replied,Replied
DocType: Newsletter,Test,ทดสอบ
DocType: Custom Field,Default Value,ค่าเริ่มต้น
apps/frappe/frappe/public/js/frappe/ui/messages.js +230,Verify,ตรวจสอบ
DocType: Workflow Document State,Update Field,ปรับปรุงเขต
DocType: Chat Profile,Enable Chat,เปิดใช้การแชท
DocType: LDAP Settings,Base Distinguished Name (DN),ฐานชื่อ (DN)
apps/frappe/frappe/integrations/doctype/google_maps_settings/google_maps_settings.py +22,Google Maps integration is not enabled,การรวมระบบ Google แผนที่ไม่ได้เปิดใช้งาน
apps/frappe/frappe/core/doctype/communication/email.py +151,Leave this conversation,ออกจากการสนทนานี้
apps/frappe/frappe/model/base_document.py +444,Options not set for link field {0},ไม่ได้ตั้งค่า ตัวเลือก สำหรับฟิลด์ ลิงค์ {0}
DocType: Customize Form,"Must be of type ""Attach Image""",ต้องเป็นชนิด &quot;แนบรูปภาพ&quot;
apps/frappe/frappe/core/doctype/data_import/data_import.js +220,Unselect All,ไม่เลือกทั้งหมด
apps/frappe/frappe/custom/doctype/customize_form/customize_form.py +208,You cannot unset 'Read Only' for field {0},คุณไม่สามารถล้าง &#39;อ่านอย่างเดียว&#39; สำหรับเขตข้อมูล {0}
DocType: Auto Email Report,Zero means send records updated at anytime,ศูนย์หมายถึงการส่งบันทึกการปรับปรุงตลอดเวลา
DocType: Auto Email Report,Zero means send records updated at anytime,ศูนย์หมายถึงการส่งบันทึกการปรับปรุงตลอดเวลา
apps/frappe/frappe/desk/page/setup_wizard/setup_wizard.js +55,Complete Setup,การติดตั้ง เสร็จสมบูรณ์
DocType: Workflow State,asterisk,เครื่องหมายดอกจัน
DocType: Data Import,Successful,ที่ประสบความสำเร็จ
apps/frappe/frappe/core/doctype/data_import/exporter.py +63,Please do not change the template headings.,กรุณาอย่าเปลี่ยนหัวแม่แบบ
DocType: Activity Log,Linked,ลิงค์แล้ว
apps/frappe/frappe/config/desk.py +44,Activity log of all users.,บันทึกกิจกรรมของผู้ใช้ทั้งหมด
DocType: Workflow State,shopping-cart,ช้อปปิ้งรถเข็น
apps/frappe/frappe/public/js/frappe/views/gantt/gantt_view.js +144,Week,สัปดาห์
apps/frappe/frappe/templates/includes/login/login.js +191,Not Allowed: Disabled User,ไม่อนุญาต: Disabled User
DocType: Social Login Key,Google,Google
DocType: Email Domain,Example Email Address,ตัวอย่างเช่นที่อยู่อีเมล
apps/frappe/frappe/public/js/frappe/ui/sort_selector.js +182,Most Used,ใช้มากที่สุด
apps/frappe/frappe/www/login.html +84,Forgot Password,ลืมรหัสผ่าน
DocType: Dropbox Settings,Backup Frequency,ความถี่ในการสำรองข้อมูล
DocType: Workflow State,Inverse,ผกผัน
DocType: DocField,User permissions should not apply for this Link,สิทธิ์ผู้ใช้ ไม่ควร ใช้สำหรับ การเชื่อมโยง นี้
apps/frappe/frappe/model/naming.py +113,Invalid naming series (. missing),ชุดการตั้งชื่อไม่ถูกต้อง (. หายไป)
DocType: Web Form,Show Attachments,แสดงเอกสารแนบ
DocType: Language,Language,ภาษา
apps/frappe/frappe/public/js/frappe/desk.js +17,Browser not supported,ไม่รองรับเบราเซอร์
apps/frappe/frappe/public/js/frappe/desk.js +17,Browser not supported,ไม่รองรับเบราเซอร์
DocType: Social Login Key,Client URLs,URL ของไคลเอ็นต์
apps/frappe/frappe/templates/pages/integrations/braintree_checkout.py +32,Some information is missing,ข้อมูลบางอย่างจะหายไป
apps/frappe/frappe/public/js/frappe/views/interaction.js +245,{0} created successfully,{0} สร้างเรียบร้อยแล้ว
DocType: Custom DocPerm,Cancel,ยกเลิก
apps/frappe/frappe/public/js/frappe/views/treeview.js +378,Add to Desktop,เพิ่มในเดสก์ท็อป
apps/frappe/frappe/core/doctype/file/file.py +180,File {0} does not exist,ไฟล์ {0} ไม่อยู่
apps/frappe/frappe/core/doctype/data_import/exporter.py +100,Leave blank for new records,เว้นว่างไว้สำหรับบันทึกใหม่
apps/frappe/frappe/config/website.py +63,List of themes for Website.,รายชื่อของรูปแบบสำหรับเว็บไซต์
apps/frappe/frappe/core/doctype/role_permission_for_page_and_report/role_permission_for_page_and_report.js +84,Successfully Updated,ปรับปรุงเรียบร้อยแล้ว
DocType: Activity Log,Logout,ออกจากระบบ
apps/frappe/frappe/core/page/permission_manager/permission_manager_help.html +26,Permissions at higher levels are Field Level permissions. All Fields have a Permission Level set against them and the rules defined at that permissions apply to the field. This is useful in case you want to hide or make certain field read-only for certain Roles.,สิทธิ์ในระดับที่สูงมีสิทธิ์ในระดับเขต ฟิลด์ทั้งหมดมีชุดการระดับสิทธิ์กับพวกเขาและกฎระเบียบที่กำหนดไว้ว่าสิทธิ์นำไปใช้กับข้อมูล นี้จะเป็นประโยชน์ในกรณีที่คุณต้องการที่จะซ่อนหรือทำให้ข้อมูลบางอย่างอ่านอย่างเดียวสำหรับบทบาทบางอย่าง
DocType: SMS Settings,"Enter static url parameters here (Eg. sender=ERPNext, username=ERPNext, password=1234 etc.)",ป้อนพารามิเตอร์คงที่ URL ที่นี่ (เช่นผู้ส่ง = ERPNext ชื่อผู้ใช้ = ERPNext รหัสผ่าน = 1234 ฯลฯ )
