apps/frappe/frappe/public/js/frappe/views/communication.js +455,There were errors while sending email. Please try again.,มีข้อผิดพลาด ในขณะที่ มี การส่งอีเมล์ โปรดลองอีกครั้ง
DocType: Web Page,0 is highest,สูงสุดคือ 0
apps/frappe/frappe/public/js/frappe/form/form_sidebar.html +24,Attachments,สิ่งที่แนบมา
apps/frappe/frappe/website/doctype/web_form/web_form.py +58,You don't have the permissions to access this document,คุณไม่มีสิทธิ์ในการเข้าถึงเอกสารนี้
DocType: Email Alert,Value Changed,ค่าเปลี่ยน
apps/frappe/frappe/model/base_document.py +282,Duplicate name {0} {1},ซ้ำ ชื่อ {0} {1}
DocType: Web Form Field,Web Form Field,เขตข้อมูลฟอร์มเว็บ
apps/frappe/frappe/custom/doctype/customize_form/customize_form.js +198,Hide field in Report Builder,ข้อมูลที่ซ่อนไว้ในรายงานการสร้าง
apps/frappe/frappe/print/page/print_format_builder/print_format_builder_field.html +14,Edit HTML,แก้ไข HTML
apps/frappe/frappe/core/page/permission_manager/permission_manager.js +494,Restore Original Permissions,เรียกคืนสิทธิ์เดิม
DocType: DocField,Button,ปุ่ม
DocType: Email Account,Default Outgoing,เริ่มต้นที่ส่งออก
DocType: Workflow State,play,เล่น
apps/frappe/frappe/templates/emails/new_user.html +5,Click on the link below to complete your registration and set a new password,คลิกที่ลิงค์ด้านล่างนี้เพื่อดำเนินการลงทะเบียนของคุณและตั้งรหัสผ่านใหม่
apps/frappe/frappe/core/page/permission_manager/permission_manager.js +403,Did not add,ไม่ได้เพิ่ม
DocType: Contact Us Settings,Contact Us Settings,ติดต่อเราตั้งค่า
DocType: Workflow State,text-width,ข้อความความกว้าง
apps/frappe/frappe/public/js/legacy/form.js +139,Maximum Attachment Limit for this record reached.,วงเงินสูงสุดที่แนบมาสำหรับการบันทึกถึงนี้
DocType: Email Alert,View Properties (via Customize Form),ดูอสังหาริมทรัพย์ (ผ่านแบบฟอร์มที่กำหนดเอง)
DocType: Website Settings,Sidebar,แถบด้านข้าง
apps/frappe/frappe/core/doctype/report/report.js +5,Report Builder reports are managed directly by the report builder. Nothing to do.,รายงานของตัวสร้างรายงาน จะถูกจัดการโดยตรงผ่านตัวสร้างรายงาน ไม่มีอะไรให้ดำเนินการ
apps/frappe/frappe/website/doctype/web_page/web_page.py +29,Cannot edit templated page,ไม่สามารถแก้ไขหน้า templated
apps/frappe/frappe/model/document.py +722,none of,ไม่มี
apps/frappe/frappe/public/js/frappe/views/communication.js +72,Send Me A Copy,ส่งสำเนา
apps/frappe/frappe/core/page/user_permissions/user_permissions.js +127,Upload User Permissions,อัปโหลดสิทธิ์ของผู้ใช้
apps/frappe/frappe/core/page/desktop/all_applications_dialog.html +3,Checked items will be shown on desktop,รายการตรวจสอบจะแสดงบนเดสก์ทอป
apps/frappe/frappe/core/doctype/doctype/doctype.py +462,{0} cannot be set for Single types,{0} ไม่สามารถตั้งค่า สำหรับชนิด เดี่ยว
apps/frappe/frappe/public/js/frappe/form/form_viewers.js +46,{0} are currently viewing this document,{0} กำลังดูเอกสารนี้
apps/frappe/frappe/custom/doctype/customize_form/customize_form.py +102,{0} updated,{0} ได้รับการปรับปรุง
apps/frappe/frappe/core/doctype/doctype/doctype.py +452,Report cannot be set for Single types,รายงาน ไม่สามารถตั้งค่า สำหรับชนิด เดี่ยว
apps/frappe/frappe/public/js/frappe/views/test_runner.js +17,"To run a test add the module name in the route after '{0}'. For example, {1}",เมื่อต้องการเรียกใช้การทดสอบโมดูลเพิ่มชื่อในเส้นทางหลังจากที่ &#39;{0}&#39; ยกตัวอย่างเช่น {1}
apps/frappe/frappe/desk/page/activity/activity.js +152,Feb,กุมภาพันธ์
DocType: DocPerm,Role,บทบาท
apps/frappe/frappe/utils/data.py +385,Cent,Cent
apps/frappe/frappe/config/setup.py +104,Manage uploaded files.,จัดการไฟล์ ที่อัปโหลด
apps/frappe/frappe/config/setup.py +163,"States for workflow (e.g. Draft, Approved, Cancelled).",สหรัฐอเมริกาเป็น ขั้นตอนการทำงาน (เช่น ร่าง อนุมัติ ยกเลิก )
apps/frappe/frappe/public/js/frappe/form/link_selector.js +136,Set Quantity,ระบุจำนวน
,Data Import Tool,นำเข้าข้อมูล เครื่องมือ
apps/frappe/frappe/core/doctype/user/user.py +378,Registration Details Emailed.,รายละเอียดการลงทะเบียนส่งอีเมล
DocType: Top Bar Item,Link to the page you want to open. Leave blank if you want to make it a group parent.,เชื่อมโยงไปยังหน้าเว็บที่คุณต้องการที่จะเปิด ปล่อยว่างไว้ถ้าคุณต้องการที่จะให้มันผู้ปกครองกลุ่ม
DocType: DocType,Is Single,เป็นโสด
apps/frappe/frappe/email/bulk.py +231,{0} has left the conversation in {1} {2},{0} ได้ออกจากการสนทนาใน {1} {2}
DocType: Blogger,User ID of a Blogger,ชื่อผู้ใช้ ID ของ Blogger
apps/frappe/frappe/core/doctype/user/user.py +198,There should remain at least one System Manager,ควรยังคงอยู่อย่างน้อยหนึ่งตัวจัดการระบบ
DocType: Workflow State,circle-arrow-right,วงกลมลูกศรขวา
apps/frappe/frappe/public/js/legacy/form.js +70,Cannot open instance when its {0} is open,ไม่สามารถเปิด เช่นเมื่อ มัน {0} เปิด
DocType: Scheduler Log,Method,วิธี
DocType: Report,Script Report,รายงานสคริปต์
DocType: About Us Settings,Company Introduction,แนะนำ บริษัท
DocType: DocField,Length,ระยะเวลา
DocType: Email Alert,"To add dynamic subject, use jinja tags like

<div><pre><code>{{ doc.name }} Delivered</code></pre></div>",ในการเพิ่มเรื่องแบบไดนามิกที่ใช้แท็ก jinja เช่น <div><pre> <code>{{ doc.name }} Delivered</code> </pre> </div>
DocType: DocPerm,Apply User Permissions,สมัคร สิทธิ์ของผู้ใช้
DocType: User,Modules HTML,โมดูล HTML
apps/frappe/frappe/public/js/frappe/ui/field_group.js +64,Missing Values Required,ค่านิยม ที่จำเป็น ขาดหายไป
apps/frappe/frappe/public/js/frappe/list/list_permission_footer.html +12,{0} is not set,{0} ไม่ได้ตั้งค่า
apps/frappe/frappe/share.py +136,No permission to {0} {1} {2},ไม่มีสิทธิ์ในการ {0} {1} {2}
apps/frappe/frappe/public/js/frappe/form/workflow.js +42,Note: Other permission rules may also apply,หมายเหตุ: กฎอนุญาตอื่น ๆ ที่ยังอาจมี
apps/frappe/frappe/permissions.py +266,Not allowed to access {0} with {1} = {2},ไม่ได้รับอนุญาต ในการเข้าถึง {0} ด้วย {1} = {2}
apps/frappe/frappe/templates/emails/print_link.html +2,View this in your browser,ดูในเบราว์เซอร์ของคุณ
DocType: DocType,Search Fields,เขตข้อมูลการค้นหา
apps/frappe/frappe/public/js/legacy/print_format.js +120,No document selected,เอกสารไม่ได้เลือก
DocType: Event,Event,เหตุการณ์
apps/frappe/frappe/public/js/frappe/views/communication.js +492,"On {0}, {1} wrote:","เมื่อวันที่ {0}, {1} เขียน:"
apps/frappe/frappe/custom/doctype/customize_form/customize_form.js +81,Cannot delete standard field. You can hide it if you want,ไม่สามารถลบสนามมาตรฐาน คุณสามารถซ่อนได้ถ้าคุณต้องการ
DocType: Top Bar Item,For top bar,สำหรับ แถบด้านบน
DocType: Print Settings,In points. Default is 9.,ในจุดที่ เริ่มต้นคือ 9
apps/frappe/frappe/public/js/frappe/ui/editor.html +62,Reduce indent (Shift+Tab),ลดการเยื้อง (Shift + Tab)
DocType: Print Settings,"Print with Letterhead, unless unchecked in a particular Document",พิมพ์ด้วยจดหมายเว้นแต่ไม่ถูกตรวจสอบในเอกสารโดยเฉพาะอย่างยิ่ง
DocType: Workflow State,heart,หัวใจ
DocType: Workflow State,minus,ลบ
apps/frappe/frappe/public/js/frappe/request.js +116,Server Error: Please check your server logs or contact tech support.,ข้อผิดพลาด ของเซิร์ฟเวอร์: กรุณาตรวจสอบ เซิร์ฟเวอร์ล็อก หรือติดต่อฝ่ายสนับสนุน ด้านเทคนิค ของคุณ
apps/frappe/frappe/core/doctype/user/user.py +116,Welcome email sent,ส่ง อีเมล์ต้อนรับ
apps/frappe/frappe/public/js/frappe/views/calendar.js +92,Select dates to create a new ,เลือกวันที่จะสร้างใหม่
apps/frappe/frappe/core/doctype/user/user.py +361,Already Registered,ลงทะเบียนเรียบร้อยแล้ว
DocType: System Settings,Float Precision,พรีซิชั่ลอย
DocType: Property Setter,Property Setter,สถานที่ให้บริการ Setter
apps/frappe/frappe/core/page/user_permissions/user_permissions.js +217,Select User or DocType to start.,เลือก ผู้ใช้ หรือ DocType ที่จะเริ่มต้น
apps/frappe/frappe/desk/page/applications/applications.js +24,No Apps Installed,ปพลิเคชันที่ติดตั้ง
apps/frappe/frappe/custom/doctype/customize_form/customize_form.js +182,Mark the field as Mandatory,ทำเครื่องหมายฟิลด์เป็นข้อบังคับ
DocType: Communication,Clicked,คลิก
apps/frappe/frappe/public/js/legacy/form.js +864,No permission to '{0}' {1},ไม่ อนุญาตให้ ' {0} ' {1}
DocType: User,Google User ID,ID ผู้ใช้ Google
apps/frappe/frappe/desk/form/utils.py +50,This method can only be used to create a Comment,วิธีการนี​​้สามารถนำมาใช้เพียงเพื่อสร้างแสดงความคิดเห็น
apps/frappe/frappe/public/js/frappe/list/doclistview.js +343,No {0} found,ไม่มี {0} พบ
apps/frappe/frappe/config/setup.py +212,Add custom forms.,เพิ่มรูปแบบที่กำหนดเอง
apps/frappe/frappe/core/page/permission_manager/permission_manager_help.html +9,The system provides many pre-defined roles. You can add new roles to set finer permissions.,ระบบให้ บทบาท ที่กำหนดไว้ล่วงหน้า หลาย คุณสามารถเพิ่ม บทบาทใหม่ เพื่อกำหนดสิทธิ์ ปลีกย่อย
DocType: Country,Geo,Geo
DocType: Blog Category,Blog Category,หมวดหมู่บล็อก
apps/frappe/frappe/model/mapper.py +81,Cannot map because following condition fails: ,ไม่สามารถ map เพราะเงื่อนไขดังต่อไปนี้ล้มเหลว:
DocType: User,Roles HTML,HTML บทบาท
apps/frappe/frappe/public/js/frappe/form/grid_form.html +26,Insert Below,ใส่ด้านล่าง
apps/frappe/frappe/custom/doctype/customize_form/customize_form.js +110,All customizations will be removed. Please confirm.,การปรับแต่งทั้งหมดจะถูกลบออก กรุณายืนยัน
DocType: Page,Page HTML,HTML หน้า
DocType: Web Page,Header,ส่วนหัว
apps/frappe/frappe/public/js/frappe/model/model.js +79,Unknown Column: {0},ไม่ทราบ คอลัมน์ : {0}
DocType: Email Alert Recipient,Optional: Always send to these ids. Each email id on a new row,ตัวเลือก: ส่งไปให้รหัสเหล่านี้ อีเมล์แต่ละแถวใหม่
apps/frappe/frappe/core/page/permission_manager/permission_manager.js +299,Users with role {0}:,ผู้ใช้ที่มี บทบาท {0}:
DocType: Print Format,Custom Format,รูปแบบที่กำหนดเอง
DocType: Workflow State,random,สุ่ม
DocType: Dropbox Backup,Integrations,Integrations
DocType: DocField,Section Break,แบ่งส่วน
DocType: Communication,Sender Full Name,ส่งชื่อเต็ม
,Messages,ข้อความ
apps/frappe/frappe/desk/query_report.py +76,Must specify a Query to run,ต้องระบุแบบสอบถามที่จะเรียกใช้
apps/frappe/frappe/config/setup.py +66,"Language, Date and Time settings",ภาษา วันที่ และ เวลาที่ การตั้งค่า
DocType: User,Represents a User in the system.,หมายถึงผู้ใช้งานในระบบ
apps/frappe/frappe/desk/form/assign_to.py +140,"The task {0}, that you assigned to {1}, has been closed.","งาน {0} ที่คุณได้รับมอบหมายให้ {1}, ถูกปิด"
DocType: User,Modules Access,โมดูลการเข้าถึง
DocType: Print Format,Print Format Type,พิมพ์รูปแบบประเภท
apps/frappe/frappe/public/js/frappe/ui/toolbar/about.js +7,Open Source Applications for the Web,เปิดโปรแกรมที่มาสำหรับเว็บ
DocType: Website Theme,"Add the name of a ""Google Web Font"" e.g. ""Open Sans""",เพิ่มชื่อของ &quot;Google เว็บอักษร&quot; เช่น &quot;เปิดซอง&quot;
apps/frappe/frappe/public/js/frappe/request.js +121,Request Timed Out,ร้องขอหมดเวลา
DocType: DocType,Hide Toolbar,ซ่อนแถบเครื่องมือ
DocType: User,Last Active,ความเคลื่อนไหวล่าสุด
DocType: Email Account,SMTP Settings for outgoing emails,การตั้งค่า SMTP สำหรับอีเมลขาออก
apps/frappe/frappe/core/page/data_import_tool/data_import_tool.js +159,Import Failed,นำเข้าล้มเหลว
apps/frappe/frappe/templates/emails/password_update.html +3,Your password has been updated. Here is your new password,รหัสผ่านของคุณได้รับการปรับปรุง นี่คือรหัสผ่านใหม่ของคุณ
DocType: Email Account,Auto Reply Message,ข้อความตอบกลับอัตโนมัติ
DocType: Email Alert,Condition,สภาพ
apps/frappe/frappe/public/js/frappe/ui/toolbar/awesome_bar.js +91,Open a module or tool,เปิดโมดูลหรือเครื่องมือ
DocType: Module Def,App Name,ชื่อ แอพพลิเคชั่น
DocType: Workflow,"Field that represents the Workflow State of the transaction (if field is not present, a new hidden Custom Field will be created)",สนามที่แสดงถึงรัฐเวิร์กโฟลว์ของการทำธุรกรรม (ถ้าเขตข้อมูลไม่ใช่ปัจจุบันฟิลด์ที่กำหนดเองใหม่ซ่อนจะถูกสร้างขึ้น)
apps/frappe/frappe/templates/pages/login.py +162,Email not verified with {1},อีเมล์ ไม่ได้ ตรวจสอบกับ {1}
DocType: Email Account,e.g. pop.gmail.com,เช่น pop.gmail.com
apps/frappe/frappe/print/page/print_format_builder/print_format_builder.js +533,Edit to add content,แก้ไขเพื่อเพิ่มเนื้อหา
DocType: Web Form,Advanced,ก้าวหน้า
apps/frappe/frappe/templates/emails/auto_reply.html +3,Reference: {0} {1},อ้างอิง: {0} {1}
DocType: User,"User Type ""System User"" can access Desktop. ""Website User"" can only be logged into the website and portal pages.","ประเภทผู้ใช้ ""ผู้ใช้ระบบ"" สามารถเข้าถึงสก์ท็อป ""ผู้ใช้เว็บไซต์"" เท่านั้นสามารถเข้าสู่เว็บไซต์และเพจพอร์ทัล"
DocType: Customize Form Field,"This field will appear only if the fieldname defined here has value OR the rules are true (examples): 
myfield
eval:doc.myfield=='My Value'
eval:doc.age>18",ข้อมูลนี้จะปรากฏเฉพาะในกรณีที่ fieldname กำหนดไว้ที่นี่มีค่าหรือกฎระเบียบที่เป็นจริง (ตัวอย่าง): myfield EVAL: doc.myfield == &#39;ค่าของฉัน&#39; EVAL: doc.age&gt; 18
DocType: File,Attached To Name,ที่แนบมากับชื่อ
apps/frappe/frappe/email/receive.py +61,Invalid User Name or Support Password. Please rectify and try again.,ชื่อผู้ใช้งาน ที่ไม่ถูกต้อง หรือ การสนับสนุน ผ่าน กรุณา แก้ไข และลองอีกครั้ง
DocType: Email Account,Login Id is Different,เข้าสู่ระบบที่แตกต่างกันคือ Id
DocType: Email Account,Yahoo Mail,จดหมาย yahoo
apps/frappe/frappe/core/page/permission_manager/permission_manager.js +476,Saved!,ที่บันทึกไว้!
apps/frappe/frappe/desk/page/activity/activity_row.html +17,Updated {0}: {1},Updated {0}: {1}
DocType: DocType,User Cannot Create,ผู้ใช้ไม่สามารถสร้าง
apps/frappe/frappe/core/page/user_permissions/user_permissions.js +27,"These will also be set as default values for those links, if only one such permission record is defined.",เหล่านี้จะ ถูกกำหนดเป็น ค่าเริ่มต้น สำหรับการเชื่อมโยง เหล่านั้น ถ้า เพียงคนเดียวที่ ได้รับอนุญาต ดังกล่าว บันทึก ถูกกำหนดไว้
apps/frappe/frappe/desk/page/activity/activity.js +196,{0} on {1},{0} บน  {1}
DocType: Customize Form,Enter Form Type,ป้อนประเภทแบบฟอร์ม
apps/frappe/frappe/public/js/frappe/list/list_sidebar_stat.html +5,No records tagged.,ระเบียนที่ไม่มีการติดแท็ก
DocType: User,Send Password Update Notification,ส่งแจ้งเตือนการปรับปรุงรหัสผ่าน
apps/frappe/frappe/public/js/legacy/form.js +62,"Allowing DocType, DocType. Be careful!","ช่วยให้ DocType , DocType ระวัง !"
apps/frappe/frappe/public/js/frappe/desk.js +300,Updated To New Version,การปรับปรุงเพื่อให้รุ่นใหม่
DocType: DocField,Depends On,ขึ้นอยู่กับ
DocType: DocPerm,Additional Permissions,สิทธิ์ เพิ่มเติม
apps/frappe/frappe/public/js/frappe/form/footer/timeline.js +33,Compose,แต่ง
apps/frappe/frappe/core/page/data_import_tool/data_import_tool.py +13,Start entering data below this line,เริ่มป้อนข้อมูลด้านล่างบรรทัดนี้
DocType: Workflow State,retweet,retweet
apps/frappe/frappe/core/page/data_import_tool/data_import_main.html +40,Update the template and save in CSV (Comma Separate Values) format before attaching.,อัพเดทแม่แบบและบันทึกในรูปแบบ CSV (Comma เฉพาะกิจค่า) รูปแบบก่อนที่จะแนบ
apps/frappe/frappe/custom/doctype/customize_form/customize_form.js +164,Specify the value of the field,ระบุค่าของฟิลด์
apps/frappe/frappe/desk/page/activity/activity.js +152,May,พฤษภาคม
apps/frappe/frappe/desk/page/activity/activity.js +152,Jan,ม.ค.
DocType: Email Account,Always use Account's Email ID as Sender,มักจะใช้อีเมล์ ID ของบัญชีเป็นผู้ส่ง
DocType: Workflow State,eye-close,ตาใกล้
,Applications,การประยุกต์ใช้
apps/frappe/frappe/public/js/frappe/request.js +295,Report this issue,รายงานปัญหานี้
DocType: Custom Script,Adds a custom script (client or server) to a DocType,เพิ่มสคริปต์ที่กำหนดเอง (ไคลเอนต์หรือเซิร์ฟเวอร์) เพื่อ DocType
apps/frappe/frappe/email/doctype/email_alert/email_alert.py +20,Cannot set Email Alert on Document Type {0},ไม่สามารถตั้งค่าอีเมล์แจ้งเตือนเกี่ยวกับชนิดเอกสาร {0}
apps/frappe/frappe/config/website.py +49,Setup of fonts and background.,การติดตั้งแบบอักษรและพื้นหลัง
apps/frappe/frappe/public/js/frappe/form/grid_form.html +4,Editing Row,แก้ไขแถว
DocType: Workflow Action,Workflow Action Master,เวิร์กโฟลว์การกระทำโท
DocType: Custom Field,Field Type,ฟิลด์ชนิด
apps/frappe/frappe/utils/data.py +402,only.,เท่านั้น
DocType: Feed,Doc Type,ประเภท Doc
apps/frappe/frappe/public/js/frappe/views/reports/reportview.js +452,Descending,น้อย
apps/frappe/frappe/email/receive.py +53,Invalid Mail Server. Please rectify and try again.,เซิร์ฟเวอร์ของจดหมายที่ ไม่ถูกต้อง กรุณา แก้ไข และลองอีกครั้ง
DocType: Dropbox Backup,Dropbox Backup,การสำรองข้อมูล Dropbox
DocType: DocField,"For Links, enter the DocType as range.
For Select, enter list of Options, each on a new line.",สำหรับลิงค์ป้อน DocType เป็นช่วง สำหรับการเลือกใส่รายชื่อของตัวเลือกในแต่ละบรรทัดใหม่
DocType: Workflow State,film,ฟิล์ม
apps/frappe/frappe/model/db_query.py +330,No permission to read {0},ไม่อนุญาตให้อ่าน {0}
apps/frappe/frappe/utils/nestedset.py +229,Multiple root nodes not allowed.,โหนด ราก หลาย ไม่ได้รับอนุญาต
apps/frappe/frappe/public/js/frappe/model/create_new.js +280,Get,ได้รับ
apps/frappe/frappe/public/js/frappe/views/reports/reportview.js +363,ID field is required to edit values using Report. Please select the ID field using the Column Picker,ข้อมูล ID จะต้องแก้ไขค่าใช้รายงาน กรุณาเลือกฟิลด์ ID ใช้ Picker คอลัมน์
apps/frappe/frappe/public/js/frappe/ui/messages.js +23,Confirm,ยืนยัน
DocType: System Settings,yyyy-mm-dd,ปปปป-ดด-วว
apps/frappe/frappe/email/doctype/email_account/email_account.py +39,Login Id is required,Id จะต้องเข้าสู่ระบบ
DocType: Website Slideshow,Website Slideshow,สไลด์โชว์เว็บไซต์
DocType: Website Settings,"Link that is the website home page. Standard Links (index, login, products, blog, about, contact)",เชื่อมโยง ที่เป็นหน้าแรกของเว็บไซต์ ลิงค์ มาตรฐาน ( ดัชนี เข้าสู่ระบบ ผลิตภัณฑ์ บล็อก เกี่ยวกับการ ติดต่อ)
apps/frappe/frappe/public/js/frappe/ui/editor.html +8,Bullet list,รายการกระสุน
