apps/frappe/frappe/public/js/frappe/views/inbox/inbox_view.js +188,No Email Accounts Assigned,ไม่มีบัญชีผู้ใช้อีเมล์ที่ได้รับมอบหมาย
DocType: Contact Us Settings,Contact Us Settings,ติดต่อเราตั้งค่า
apps/frappe/frappe/public/js/frappe/ui/toolbar/search.js +176,Searching ...,กำลังค้นหา ...
apps/frappe/frappe/public/js/frappe/ui/toolbar/search.js +176,Searching ...,กำลังค้นหา ...
DocType: Workflow State,text-width,ข้อความความกว้าง
apps/frappe/frappe/public/js/legacy/form.js +141,Maximum Attachment Limit for this record reached.,วงเงินสูงสุดที่แนบมาสำหรับการบันทึกถึงนี้
DocType: Notification,View Properties (via Customize Form),ดูอสังหาริมทรัพย์ (ผ่านแบบฟอร์มที่กำหนดเอง)
DocType: Note Seen By,Note Seen By,หมายเหตุมองเห็นได้ด้วย
apps/frappe/frappe/utils/password_strength.py +100,Try to use a longer keyboard pattern with more turns,พยายามที่จะใช้รูปแบบแป้นพิมพ์อีกต่อไปกับผลัดกันมากขึ้น
DocType: Feedback Trigger,Check Communication,ตรวจสอบการสื่อสาร
DocType: Address,Rajasthan,รัฐราชสถาน
DocType: Email Template,Email Reply Help,ตอบกลับอีเมล
apps/frappe/frappe/core/doctype/report/report.js +5,Report Builder reports are managed directly by the report builder. Nothing to do.,รายงานของตัวสร้างรายงาน จะถูกจัดการโดยตรงผ่านตัวสร้างรายงาน ไม่มีอะไรให้ดำเนินการ
apps/frappe/frappe/email/doctype/newsletter/newsletter.py +169,Please verify your Email Address,โปรดตรวจสอบที่อยู่อีเมลของคุณ
apps/frappe/frappe/model/document.py +1074,none of,ไม่มี
apps/frappe/frappe/public/js/frappe/views/communication.js +91,Send Me A Copy,ส่งสำเนา
DocType: Dropbox Settings,App Secret Key,App คีย์ลับ
DocType: Webhook,on_submit,on_submit
apps/frappe/frappe/config/website.py +7,Web Site,เว็บไซต์
apps/frappe/frappe/core/page/desktop/all_applications_dialog.html +8,Checked items will be shown on desktop,รายการตรวจสอบจะแสดงบนเดสก์ทอป
apps/frappe/frappe/core/doctype/doctype/doctype.py +825,{0} cannot be set for Single types,{0} ไม่สามารถกำหนดค่าสำหรับประเภทเดี่ยว
DocType: Data Import,Data Import,การนำเข้าข้อมูล
apps/frappe/frappe/public/js/frappe/views/reports/report_view.js +395,Configure Chart,กำหนดค่าแผนภูมิ
apps/frappe/frappe/public/js/frappe/form/form_viewers.js +55,{0} are currently viewing this document,{0} กำลังดูเอกสารนี้
DocType: ToDo,Assigned By Full Name,ได้รับมอบหมายจากชื่อเต็ม
apps/frappe/frappe/custom/doctype/customize_form/customize_form.py +155,{0} updated,{0} ได้รับการแก้ไขแล้ว
apps/frappe/frappe/core/doctype/doctype/doctype.py +817,Report cannot be set for Single types,รายงาน ไม่สามารถตั้งค่า สำหรับชนิด เดี่ยว
apps/frappe/frappe/public/js/frappe/list/list_view.js +939,Share URL,แชร์ URL
DocType: System Settings,Allow Consecutive Login Attempts ,อนุญาตให้มีการเข้าสู่ระบบที่ต่อเนื่อง
apps/frappe/frappe/templates/pages/integrations/stripe_checkout.html +50,An error occured during the payment process. Please contact us.,เกิดข้อผิดพลาดระหว่างการชำระเงิน กรุณาติดต่อเรา.
apps/frappe/frappe/public/js/frappe/misc/pretty_date.js +52,{0} days ago,{0} วันที่ผ่านมา
DocType: Email Account,Awaiting Password,รอรหัสผ่าน
DocType: Address,Address Line 1,ที่อยู่บรรทัดที่ 1
apps/frappe/frappe/public/js/frappe/ui/filters/edit_filter.html +18,Not Descendants Of,ไม่ใช่ลูกหลานของ
DocType: Custom DocPerm,Role,บทบาท
apps/frappe/frappe/public/js/frappe/form/templates/print_layout.html +21,Settings...,การตั้งค่า ...
apps/frappe/frappe/utils/data.py +521,Cent,Cent
apps/frappe/frappe/public/js/frappe/views/inbox/inbox_view.js +176,Compose Email,เขียนอีเมล
apps/frappe/frappe/config/setup.py +226,"States for workflow (e.g. Draft, Approved, Cancelled).",สหรัฐอเมริกาเป็น ขั้นตอนการทำงาน (เช่น ร่าง อนุมัติ ยกเลิก )
DocType: Print Settings,Allow Print for Draft,อนุญาตให้พิมพ์ร่าง
apps/frappe/frappe/public/js/frappe/form/link_selector.js +142,Set Quantity,ระบุจำนวน
apps/frappe/frappe/public/js/legacy/form.js +348,Submit this document to confirm,ส่งเอกสารนี้เพื่อยืนยัน
DocType: Contact,Unsubscribed,ยกเลิกการสมัคร
apps/frappe/frappe/config/setup.py +49,Set custom roles for page and report,ตั้งบทบาทที่กำหนดเองสำหรับหน้าและรายงาน
DocType: Braintree Settings,Merchant ID,ID ผู้ขาย
apps/frappe/frappe/public/js/frappe/misc/rating_icons.html +2,Rating: ,การจัดอันดับ:
apps/frappe/frappe/email/receive.py +196,Can not find UIDVALIDITY in imap status response,ไม่สามารถหา UIDVALIDITY ในการตอบสนองสถานะ IMAP
DocType: Address,Dadra and Nagar Haveli,Dadra และ Nagar Haveli
apps/frappe/frappe/desk/page/setup_wizard/setup_wizard.js +419,Attach Your Picture,แนบ รูปของคุณ
apps/frappe/frappe/public/js/frappe/views/reports/query_report.js +562,Make ,สร้าง
apps/frappe/frappe/core/doctype/version/version_view.html +69,Row Values Changed,ค่าแถวเปลี่ยน
DocType: Workflow State,Stop,หยุด
DocType: Footer Item,Link to the page you want to open. Leave blank if you want to make it a group parent.,เชื่อมโยงไปยังหน้าเว็บที่คุณต้องการที่จะเปิด ปล่อยว่างไว้ถ้าคุณต้องการที่จะให้มันผู้ปกครองกลุ่ม
DocType: DocType,Is Single,เป็นโสด
apps/frappe/frappe/core/doctype/user/user.py +758,Sign Up is disabled,Sign Up ถูกปิดใช้งาน
apps/frappe/frappe/email/queue.py +335,{0} has left the conversation in {1} {2},{0} ได้ออกจากการสนทนาใน {1} {2}
DocType: Blogger,User ID of a Blogger,ชื่อผู้ใช้ ID ของ Blogger
apps/frappe/frappe/core/doctype/user/user.py +299,There should remain at least one System Manager,ควรยังคงอยู่อย่างน้อยหนึ่งตัวจัดการระบบ
DocType: GCalendar Account,Authorization Code,รหัสอนุมัติ
DocType: PayPal Settings,Mention transaction completion page URL,กล่าวถึงการทำธุรกรรม URL ของหน้าเสร็จสิ้น
DocType: Help Article,Expert,ผู้เชี่ยวชาญ
DocType: Workflow State,circle-arrow-right,วงกลมลูกศรขวา
DocType: Role Profile,Role Profile,โปรไฟล์บทบาท
DocType: LDAP Settings,LDAP Server Url,เซิร์ฟเวอร์ LDAP Url
apps/frappe/frappe/public/js/legacy/form.js +72,Cannot open instance when its {0} is open,ไม่สามารถเปิด เช่นเมื่อ มัน {0} เปิด
,Transaction Log Report,รายงานบันทึกธุรกรรม
DocType: Custom DocPerm,Custom DocPerm,DocPerm กำหนดเอง
DocType: Newsletter,Send Unsubscribe Link,ส่งลิงค์ยกเลิกการรับข่าวสาร
DocType: Notification,Method,วิธี
DocType: Report,Script Report,รายงานสคริปต์
DocType: OAuth Authorization Code,Scopes,ขอบเขต
DocType: About Us Settings,Company Introduction,แนะนำ บริษัท
DocType: DocField,Length,ระยะ
apps/frappe/frappe/config/setup.py +147,Restore or permanently delete a document.,คืนค่าหรือลบเอกสารอย่างถาวร
apps/frappe/frappe/chat/doctype/chat_profile/chat_profile.py +87,Chat Profile for User {0} exists.,มีโปรไฟล์แชทสำหรับผู้ใช้ {0} อยู่แล้ว
apps/frappe/frappe/integrations/doctype/gsuite_settings/gsuite_settings.js +32,GSuite test executed with success. GSuite integration is correctly configured,ทดสอบ GSuite ด้วยความสำเร็จ มีการกำหนดค่า GSuite อย่างถูกต้อง
DocType: Feedback Trigger,"To add dynamic subject, use jinja tags like

<div><pre><code>{{ doc.name }} Delivered</code></pre></div>",ในการเพิ่มเรื่องแบบไดนามิกที่ใช้แท็ก jinja เช่น <div><pre> <code>{{ doc.name }} Delivered</code> </pre> </div>
apps/frappe/frappe/desk/search.py +19,Invalid Search Field {0},ช่องค้นหาไม่ถูกต้อง {0}
DocType: User,Modules HTML,โมดูล HTML
DocType: Email Account,"Track if your email has been opened by the recipient.
<br>
Note: If you're sending to multiple recipients, even if 1 recipient reads the email, it'll be considered ""Opened""",ติดตามว่าอีเมล์ของคุณถูกเปิดโดยผู้รับหรือไม่ <br> หมายเหตุ: หากคุณกำลังส่งไปยังผู้รับหลายรายแม้ว่าผู้รับจะอ่านอีเมลแล้วก็ตามผู้รับก็จะถือว่าเป็น &quot;เปิด&quot;
apps/frappe/frappe/public/js/frappe/ui/field_group.js +97,Missing Values Required,ค่านิยม ที่จำเป็น ขาดหายไป
DocType: DocType,Other Settings,ตั้งค่าอื่น ๆ
DocType: Data Migration Connector,Frappe,เย็นเป็นวุ้น
apps/frappe/frappe/core/doctype/communication/communication_list.js +17,Mark as Unread,ทำเครื่องหมายว่ายังไม่ได้อ่าน
DocType: Activity Log,Operation,การทำงาน
DocType: Customize Form,Change Label (via Custom Translation),เปลี่ยนชื่อ (ชื่อกำหนดเอง)
apps/frappe/frappe/share.py +143,No permission to {0} {1} {2},ไม่มีสิทธิ์ในการ {0} {1} {2}
DocType: Address,Permanent,ถาวร
DocType: Address,Permanent,ถาวร
apps/frappe/frappe/public/js/frappe/form/workflow.js +44,Note: Other permission rules may also apply,หมายเหตุ: กฎอนุญาตอื่น ๆ ที่ยังอาจมี
apps/frappe/frappe/templates/emails/print_link.html +2,View this in your browser,ดูในเบราว์เซอร์ของคุณ
DocType: DocType,Search Fields,เขตข้อมูลการค้นหา
DocType: System Settings,OTP Issuer Name,OTP Issuer Name
DocType: OAuth Bearer Token,OAuth Bearer Token,OAuth ถือ Token
apps/frappe/frappe/public/js/legacy/print_format.js +124,No document selected,เอกสารไม่ได้เลือก
apps/frappe/frappe/desk/page/setup_wizard/install_fixtures.py +16,Dr,ดร
apps/frappe/frappe/public/js/frappe/dom.js +322,You are connected to internet.,คุณเชื่อมต่อกับอินเทอร์เน็ต
DocType: Social Login Key,Enable Social Login,เปิดใช้การลงชื่อเข้าใช้ทางสังคม
DocType: Communication,Event,เหตุการณ์
apps/frappe/frappe/public/js/frappe/views/communication.js +677,"On {0}, {1} wrote:","เมื่อวันที่ {0}, {1} เขียน:"
apps/frappe/frappe/custom/doctype/customize_form/customize_form.js +133,Cannot delete standard field. You can hide it if you want,ไม่สามารถลบสนามมาตรฐาน คุณสามารถซ่อนได้ถ้าคุณต้องการ
DocType: Top Bar Item,For top bar,สำหรับ แถบด้านบน
DocType: Social Login Key,Auth URL Data,ข้อมูล URL Auth Authentication
apps/frappe/frappe/desk/page/backups/backups.py +70,Queued for backup. You will receive an email with the download link,จัดคิวแล้วสำหรับการสำรองข้อมูล คุณจะได้รับอีเมลพร้อมลิงก์ดาวน์โหลด
apps/frappe/frappe/utils/bot.py +148,Could not identify {0},ไม่สามารถระบุ {0}
DocType: Address,Address,ที่อยู่
apps/frappe/frappe/templates/pages/integrations/payment-failed.html +3,Payment Failed,การชำระเงินล้มเหลว
DocType: Print Settings,In points. Default is 9.,ในจุดที่ เริ่มต้นคือ 9
DocType: OAuth Client,Redirect URIs,เปลี่ยนเส้นทางยูริ
apps/frappe/frappe/desk/doctype/bulk_update/bulk_update.py +47,Submiting {0},การส่ง {0}
DocType: Workflow State,heart,หัวใจ
apps/frappe/frappe/www/update-password.html +56,Old Password Required.,ต้องการรหัสผ่านเดิม
DocType: Role,Desk Access,โต๊ะเขียนหนังสือ
DocType: Workflow State,minus,ลบ
DocType: S3 Backup Settings,Bucket,ถัง
apps/frappe/frappe/public/js/frappe/request.js +169,Server Error: Please check your server logs or contact tech support.,ข้อผิดพลาด ของเซิร์ฟเวอร์: กรุณาตรวจสอบ เซิร์ฟเวอร์ล็อก หรือติดต่อฝ่ายสนับสนุน ด้านเทคนิค ของคุณ
apps/frappe/frappe/public/js/frappe/ui/capture.js +152,Unable to load camera.,ไม่สามารถโหลดกล้องได้
apps/frappe/frappe/core/doctype/user/user.py +206,Welcome email sent,ส่ง อีเมล์ต้อนรับ
apps/frappe/frappe/desk/page/setup_wizard/setup_wizard.js +354,Let's prepare the system for first use.,มาจัดเตรียมระบบสำหรับการใช้งานครั้งแรก
apps/frappe/frappe/core/doctype/user/user.py +765,Already Registered,ลงทะเบียนเรียบร้อยแล้ว
DocType: System Settings,Float Precision,พรีซิชั่ลอย
DocType: Notification,Sender Email,อีเมลผู้ส่ง
apps/frappe/frappe/core/doctype/page/page.py +41,Only Administrator can edit,ผู้ดูแลระบบเท่านั้นที่สามารถแก้ไข
apps/frappe/frappe/public/js/frappe/upload.js +92,Filename,ชื่อไฟล์
DocType: DocType,Editable Grid,ที่สามารถแก้ไขได้กริด
DocType: Property Setter,Property Setter,สถานที่ให้บริการ Setter
DocType: Web Form,Allow Print,อนุญาตให้พิมพ์
apps/frappe/frappe/custom/doctype/customize_form/customize_form.js +241,Mark the field as Mandatory,ทำเครื่องหมายฟิลด์เป็นข้อบังคับ
DocType: Communication,Clicked,คลิก
apps/frappe/frappe/public/js/legacy/form.js +991,No permission to '{0}' {1},ไม่ อนุญาตให้ ' {0} ' {1}
apps/frappe/frappe/email/doctype/auto_email_report/auto_email_report.js +38,Scheduled to send,การกำหนดตารางเวลาในการส่ง
DocType: DocType,Track Seen,ติดตามการกระทำ
DocType: Dropbox Settings,File Backup,การสำรองข้อมูลไฟล์
apps/frappe/frappe/desk/form/utils.py +67,This method can only be used to create a Comment,วิธีการนี้สามารถนำมาใช้เพียงเพื่อสร้างแสดงความคิดเห็น
DocType: Kanban Board Column,orange,ส้ม
apps/frappe/frappe/public/js/frappe/list/list_renderer.js +629,No {0} found,ไม่มี {0} พบ
apps/frappe/frappe/config/setup.py +264,Add custom forms.,เพิ่มรูปแบบที่กำหนดเอง
apps/frappe/frappe/desk/like.py +84,{0}: {1} in {2},{0}: {1} ใน {2}
apps/frappe/frappe/public/js/frappe/form/footer/timeline.js +518,submitted this document,ส่งเอกสารนี้
apps/frappe/frappe/core/page/permission_manager/permission_manager_help.html +9,The system provides many pre-defined roles. You can add new roles to set finer permissions.,ระบบให้ บทบาท ที่กำหนดไว้ล่วงหน้า หลาย คุณสามารถเพิ่ม บทบาทใหม่ เพื่อกำหนดสิทธิ์ ปลีกย่อย
DocType: Communication,CC,CC
DocType: Country,Geo,Geo
DocType: Data Migration Run,Trigger Name,ชื่อทริกเกอร์
DocType: Blog Category,Blog Category,หมวดหมู่บล็อก
apps/frappe/frappe/model/mapper.py +123,Cannot map because following condition fails: ,ไม่สามารถ map เพราะเงื่อนไขดังต่อไปนี้ล้มเหลว:
DocType: Role Permission for Page and Report,Roles HTML,HTML บทบาท
apps/frappe/frappe/website/doctype/website_settings/website_settings.js +10,Select a Brand Image first.,เลือกยี่ห้อภาพแรก
apps/frappe/frappe/core/doctype/user/user_list.js +12,Active,ใช้งาน
apps/frappe/frappe/public/js/frappe/form/grid_row_form.js +52,Insert Below,ใส่ด้านล่าง
DocType: Kanban Board Column,Blue,สีฟ้า
apps/frappe/frappe/custom/doctype/customize_form/customize_form.js +168,All customizations will be removed. Please confirm.,การปรับแต่งทั้งหมดจะถูกลบออก กรุณายืนยัน
DocType: Page,Page HTML,HTML หน้า
apps/frappe/frappe/chat/doctype/chat_room/chat_room.py +68,Group name cannot be empty.,ชื่อกลุ่มต้องไม่ว่างเปล่า
apps/frappe/frappe/public/js/frappe/views/treeview.js +295,Further nodes can be only created under 'Group' type nodes,โหนด เพิ่มเติมสามารถ ถูกสร้างขึ้น ภายใต้ โหนด ' กลุ่ม ประเภท
DocType: SMS Parameter,Header,ส่วนหัว
apps/frappe/frappe/public/js/frappe/model/model.js +90,Unknown Column: {0},ไม่ทราบ คอลัมน์ : {0}
DocType: Notification Recipient,Email By Role,อีเมล์ตามบทบาท
apps/frappe/frappe/core/page/permission_manager/permission_manager.js +291,Users with role {0}:,ผู้ใช้ที่มี บทบาท {0}:
DocType: Print Format,Custom Format,รูปแบบที่กำหนดเอง
DocType: Workflow State,random,สุ่ม
DocType: Newsletter Email Group,Newsletter Email Group,กลุ่มอีเมล์จดหมายข่าว
DocType: Braintree Settings,Integrations,Integrations
DocType: DocField,Section Break,แบ่งส่วน
DocType: Address,Warehouse,คลังสินค้า
DocType: Address,Other Territory,ดินแดนอื่น ๆ
,Messages,ข้อความ
apps/frappe/frappe/config/website.py +83,Portal,พอร์ทัล
DocType: Email Account,Use Different Email Login ID,ใช้รหัสเข้าสู่ระบบอีเมล์ที่แตกต่างกัน
DocType: Email Account,Use Different Email Login ID,ใช้รหัสเข้าสู่ระบบอีเมล์ที่แตกต่างกัน
apps/frappe/frappe/desk/query_report.py +48,Must specify a Query to run,ต้องระบุแบบสอบถามที่จะเรียกใช้
apps/frappe/frappe/integrations/doctype/braintree_settings/braintree_settings.py +65,"There seems to be an issue with the server's braintree configuration. Don't worry, in case of failure, the amount will get refunded to your account.",ดูเหมือนจะมีปัญหากับการกำหนดค่า Braintree ของเซิร์ฟเวอร์ ไม่ต้องกังวลในกรณีของความล้มเหลวจำนวนเงินจะได้รับคืนไปยังบัญชีของคุณ
apps/frappe/frappe/www/me.html +25,Manage Third Party Apps,จัดการแอปของบุคคลที่สาม
apps/frappe/frappe/config/setup.py +76,"Language, Date and Time settings",ภาษา วันที่ และ เวลาที่ การตั้งค่า
DocType: User Email,User Email,ผู้ใช้อีเมล์
DocType: Event,Saturday,วันเสาร์
DocType: User,Represents a User in the system.,หมายถึงผู้ใช้งานในระบบ
DocType: Communication,Label,ฉลาก
apps/frappe/frappe/desk/form/assign_to.py +155,"The task {0}, that you assigned to {1}, has been closed.","งาน {0} ที่คุณได้รับมอบหมายให้ {1}, ถูกปิด"
apps/frappe/frappe/integrations/doctype/dropbox_settings/dropbox_settings.py +316,Please close this window,โปรดปิดหน้าต่างนี้
DocType: Print Format,Print Format Type,พิมพ์รูปแบบประเภท
DocType: Newsletter,A Lead with this Email Address should exist,ตะกั่วที่อยู่อีเมลนี้ควรมีอยู่
apps/frappe/frappe/public/js/frappe/ui/toolbar/about.js +7,Open Source Applications for the Web,เปิดโปรแกรมที่มาสำหรับเว็บ
DocType: Event,Call,โทรศัพท์
DocType: Website Theme,"Add the name of a ""Google Web Font"" e.g. ""Open Sans""",เพิ่มชื่อของ &quot;Google เว็บอักษร&quot; เช่น &quot;เปิดซอง&quot;
apps/frappe/frappe/public/js/frappe/request.js +178,Request Timed Out,ร้องขอหมดเวลา
apps/frappe/frappe/config/setup.py +93,Enable / Disable Domains,เปิด / ปิดใช้งานโดเมน
DocType: Role Permission for Page and Report,Allow Roles,อนุญาตให้บทบาท
DocType: DocType,Hide Toolbar,ซ่อนแถบเครื่องมือ
DocType: User,Last Active,เคลื่อนไหวล่าสุด
DocType: Email Account,SMTP Settings for outgoing emails,การตั้งค่า SMTP สำหรับอีเมลขาออก
DocType: Data Export,Filter List,ตัวกรองรายการ
DocType: Data Export,Excel,สันทัด
apps/frappe/frappe/templates/emails/password_update.html +2,Your password has been updated. Here is your new password,รหัสผ่านของคุณได้รับการปรับปรุง นี่คือรหัสผ่านใหม่ของคุณ
DocType: Email Account,Auto Reply Message,ข้อความตอบกลับอัตโนมัติ
DocType: Feedback Trigger,Condition,สภาพ
apps/frappe/frappe/utils/data.py +635,{0} hours ago,{0} ชั่วโมงที่ผ่านมา
apps/frappe/frappe/utils/data.py +645,1 month ago,1 เดือนที่แล้ว
DocType: Contact,User ID,รหัสผู้ใช้
DocType: Communication,Sent,ส่ง
DocType: Address,Kerala,เกรละ
DocType: File,Lft,ซ้าย
DocType: User,Simultaneous Sessions,ประชุมพร้อมกัน
DocType: Social Login Key,Client Credentials,ข้อมูลประจำตัวของไคลเอ็นต์
apps/frappe/frappe/public/js/frappe/ui/toolbar/awesome_bar.js +138,Open a module or tool,เปิดโมดูลหรือเครื่องมือ
DocType: Communication,Delivery Status,สถานะการจัดส่งสินค้า
DocType: Module Def,App Name,ชื่อ แอพพลิเคชั่น
