apps/frappe/frappe/desk/page/applications/applications.py +74,You cannot install this app,คุณไม่สามารถ ติดตั้ง app นี้
DocType: Communication,Error,ความผิดพลาด
DocType: DocField,Column Break,ตัวแบ่งคอลัมน์
DocType: Event,Thursday,วันพฤหัสบดี
apps/frappe/frappe/utils/response.py +129,You don't have permission to access this file,คุณไม่ได้รับอนุญาตให้เข้าถึงไฟล์นี้
apps/frappe/frappe/model/document.py +611,Cannot link cancelled document: {0},ไม่สามารถเชื่อมโยงเอกสารยกเลิก: {0}
apps/frappe/frappe/print/page/print_format_builder/print_format_builder.js +579,"For example: If you want to include the document ID, use {0}",ตัวอย่างเช่นถ้าคุณต้องการที่จะรวม ID เอกสารใช้ {0}
apps/frappe/frappe/print/page/print_format_builder/print_format_builder.js +482,Select Table Columns for {0},เลือกคอลัมน์ตารางสำหรับ {0}
DocType: Custom Field,Options Help,ตัวเลือกความช่วยเหลือ
DocType: DocField,Report Hide,แจ้งซ่อน
DocType: Custom Field,Label Help,ช่วยเหลือฉลาก
DocType: Workflow State,star-empty,ดาวที่ว่างเปล่า
apps/frappe/frappe/public/js/frappe/form/workflow.js +39,Next actions,ดำเนินการต่อไป
apps/frappe/frappe/public/js/frappe/views/ganttview.js +79,Nothing to show for this selection,อะไรที่จะแสดง การเลือกนี้
DocType: Workflow State,ok,ok
DocType: User,These values will be automatically updated in transactions and also will be useful to restrict permissions for this user on transactions containing these values.,ค่าเหล่านี้จะถูกปรับปรุงโดยอัตโนมัติในการทำธุรกรรมและยังจะเป็นประโยชน์เพื่อ จำกัด สิทธิ์สำหรับผู้ใช้นี้ในการทำธุรกรรมที่มีค่าเหล่านี้
apps/frappe/frappe/desk/page/applications/application_row.html +24,Publisher,ผู้พิมพ์
apps/frappe/frappe/model/rename_doc.py +350,** Failed: {0} to {1}: {2},** ล้มเหลว: {0} เป็น {1}: {2}
apps/frappe/frappe/public/js/frappe/ui/upload.html +4,Browse,เรียกดู
DocType: DocField,Currency,เงินตรา
apps/frappe/frappe/templates/includes/comments/comments.py +50,View it in your browser,ดูในเบราว์เซอร์ของคุณ
DocType: Async Task,Running,วิ่ง
apps/frappe/frappe/www/update-password.html +3,Reset Password,ตั้งค่ารหัสผ่าน
DocType: Workflow State,hand-left,มือซ้าย
apps/frappe/frappe/core/doctype/doctype/doctype.py +341,Fieldtype {0} for {1} cannot be unique,fieldtype {0} สำหรับ {1} ไม่สามารถที่ไม่ซ้ำกัน
DocType: Email Account,Use SSL,ใช้ SSL
DocType: Workflow State,play-circle,เล่นวงกลม
apps/frappe/frappe/print/page/print_format_builder/print_format_builder.js +75,Select Print Format to Edit,เลือกรูปแบบการพิมพ์ที่จะแก้ไข
DocType: Workflow State,circle-arrow-down,วงกลมลูกศรลง
apps/frappe/frappe/config/desk.py +38,Private and public Notes.,หมายเหตุภาครัฐและเอกชน
DocType: DocField,Datetime,datetime
DocType: Workflow State,arrow-right,ลูกศรขวา
DocType: Workflow State,Workflow state represents the current state of a document.,รัฐ Workflow หมายถึงสถานะปัจจุบันของเอกสาร
apps/frappe/frappe/utils/oauth.py +198,Token is missing,Token จะหายไป
apps/frappe/frappe/public/js/frappe/ui/editor.js +443,Open Link in a new Window,ลิงค์เปิดในหน้าต่างใหม่
apps/frappe/frappe/utils/file_manager.py +257,Removed {0},ลบออก {0}
DocType: Company History,Highlight,เน้น
DocType: DocField,Fold,พับ
apps/frappe/frappe/public/js/frappe/views/reports/reportview.js +509,Ascending,Ascending
apps/frappe/frappe/print/doctype/print_format/print_format.py +18,Standard Print Format cannot be updated,พิมพ์รูปแบบ มาตรฐาน ไม่สามารถปรับปรุง
apps/frappe/frappe/integrations/doctype/dropbox_backup/dropbox_backup.js +14,Please specify,โปรดระบุ
DocType: Page,Page Name,ชื่อเพจ
apps/frappe/frappe/custom/doctype/customize_form/customize_form.js +169,Help: Field Properties,ช่วยเหลือ: คุณสมบัติเขตข้อมูล
apps/frappe/frappe/core/page/data_import_tool/data_import_tool.js +86,Importing...,กำลังนำเข้า...
apps/frappe/frappe/model/document.py +848,Incorrect value in row {0}: {1} must be {2} {3},ค่าไม่ถูกต้อง ในแถว {0}: {1} ต้อง {2} {3}
apps/frappe/frappe/workflow/doctype/workflow/workflow.py +67,Submitted Document cannot be converted back to draft. Transition row {0},ส่ง เอกสาร ไม่สามารถแปลง กลับไปที่ ร่าง
apps/frappe/frappe/print/page/print_format_builder/print_format_builder_start.html +2,Select an existing format to edit or start a new format.,เลือกรูปแบบที่มีอยู่เพื่อแก้ไขหรือเริ่มต้นรูปแบบใหม่
apps/frappe/frappe/workflow/doctype/workflow/workflow.py +38,Created Custom Field {0} in {1},สร้าง ฟิลด์ที่กำหนดเอง {0} ใน {1}
DocType: System Settings,Time Zone,โซนเวลา
DocType: Print Settings,Compact Item Print,ขนาดกะทัดรัดรายการพิมพ์
apps/frappe/frappe/core/page/user_permissions/user_permissions.js +31,A user can be permitted to multiple records of the same DocType.,ผู้ใช้สามารถ ได้รับอนุญาตให้ บันทึก หลายDocType เดียวกัน
DocType: Workflow State,Home,บ้าน
DocType: Workflow State,question-sign,คำถามการลงชื่อเข้าใช้
DocType: Email Account,Add Signature,เพิ่มลายเซ็น
apps/frappe/frappe/email/doctype/email_unsubscribe/email_unsubscribe.py +38,Left this conversation,ออกจากการสนทนานี้
apps/frappe/frappe/core/page/permission_manager/permission_manager.js +474,Did not set,ไม่ได้ระบุราคา
DocType: ToDo,ToDo,สิ่งที่ต้องทำ
DocType: DocField,No Copy,คัดลอกไม่มี
DocType: Workflow State,qrcode,QRCode
DocType: Web Form,Breadcrumbs,สวดมนต์
apps/frappe/frappe/core/doctype/doctype/doctype.py +506,If Owner,หากเจ้าของ
apps/frappe/frappe/website/doctype/web_form/web_form.py +116,You need to be logged in to access this {0}.,คุณจำเป็นต้องเข้าสู่ระบบเพื่อเข้าถึง {0}
apps/frappe/frappe/public/js/frappe/form/footer/assign_to.js +163,Complete By,เสร็จสมบูรณ์โดย
apps/frappe/frappe/templates/includes/comments/comments.py +48,{0} by {1},{0} โดย {1}
DocType: Website Settings,Top Bar Items,รายการ Bar สถานที่ยอด
DocType: Print Settings,Print Settings,ตั้งค่าการพิมพ์
DocType: Page,Yes,ใช่
DocType: DocType,Max Attachments,จำนวนสิ่งที่แนบสูงสุด
DocType: Desktop Icon,Page,หน้า
DocType: Workflow State,briefcase,กระเป๋าเอกสาร
apps/frappe/frappe/model/base_document.py +495,Value cannot be changed for {0},ค่า ไม่สามารถเปลี่ยนแปลงได้ เพื่อ {0}
apps/frappe/frappe/public/js/frappe/views/treeview.js +219,New {0} Name,ใหม่ {0} ชื่อ
apps/frappe/frappe/templates/includes/contact.js +17,"You seem to have written your name instead of your email. \
					Please enter a valid email address so that we can get back.","คุณดูเหมือนจะได้เขียนชื่อของคุณแทนของอีเมลของคุณ \
 โปรดป้อนที่อยู่อีเมลที่ถูกต้องเพื่อให้เราสามารถได้รับกลับมา"
DocType: Workflow State,"Style represents the button color: Success - Green, Danger - Red, Inverse - Black, Primary - Dark Blue, Info - Light Blue, Warning - Orange","สไตล์เป็นสีของปุ่ม: ความสำเร็จ - สีเขียว, อันตราย - แดง, Inverse - ดำ, ประถม - มืดข้อมูล, บลู - Light Blue, คำเตือน - ออเรนจ์"
apps/frappe/frappe/public/js/frappe/views/reports/query_report.js +136,No Report Loaded. Please use query-report/[Report Name] to run a report.,รายงาน Loaded ไม่มี กรุณาใช้แบบสอบถามรายงาน / [ชื่อรายงาน] เพื่อเรียกใช้รายงาน
DocType: Workflow Transition,Workflow Transition,เปลี่ยนเวิร์กโฟลว์
apps/frappe/frappe/public/js/frappe/misc/pretty_date.js +48,{0} months ago,{0} เดือนที่ผ่านมา
apps/frappe/frappe/public/js/frappe/model/model.js +18,Created By,สร้างโดย
DocType: Workflow State,resize-horizontal,ปรับขนาดในแนวนอน-
DocType: Note,Content,เนื้อหา
apps/frappe/frappe/public/js/frappe/views/treeview.js +220,Group Node,กลุ่มโหนด
DocType: Communication,Notification,การแจ้งเตือน
DocType: Web Form,Go to this url after completing the form.,หลังจากที่กรอกแบบฟอร์ม ไปที่ url นี้
DocType: DocType,Document,เอกสาร
apps/frappe/frappe/core/doctype/doctype/doctype.py +131,Series {0} already used in {1},ชุด {0} ใช้แล้ว ใน {1}
DocType: DocField,Code,รหัส
DocType: Workflow,"All possible Workflow States and roles of the workflow. Docstatus Options: 0 is""Saved"", 1 is ""Submitted"" and 2 is ""Cancelled""",เป็นไปได้ทั้งหมดสหรัฐอเมริกาเวิร์กโฟลว์และบทบาทของเวิร์กโฟลว์ ตัวเลือก Docstatus: 0 คือ &quot;บันทึก&quot; 1 &quot;ส่ง&quot; และ 2 &quot;ยกเลิก&quot;
DocType: Website Theme,Footer Text Color,ท้ายสีข้อความ
apps/frappe/frappe/core/page/permission_manager/permission_manager_help.html +24,"Permissions at level 0 are Document Level permissions, i.e. they are primary for access to the document.",สิทธิ์ที่ระดับ 0 มีเอกสารสิทธิ์ระดับคือพวกเขาเป็นหลักสำหรับการเข้าถึงเอกสาร
DocType: Print Format,Print Format,พิมพ์รูปแบบ
apps/frappe/frappe/config/setup.py +32,Set Permissions on Document Types and Roles,กำหนดสิทธิ์ ใน ประเภท เอกสาร และบทบาท
DocType: About Us Settings,"""Company History""","""ประวัติบริษัท"""
apps/frappe/frappe/permissions.py +332,Permission already set,ได้รับอนุญาตตั้งอยู่แล้ว
apps/frappe/frappe/core/doctype/docshare/docshare.py +49,{0} shared this document with everyone,{0} เอกสารนี้ใช้ร่วมกันกับทุกคน
apps/frappe/frappe/desk/page/activity/activity_row.html +17,Commented on {0}: {1},แสดงความคิดเห็นใน {0}: {1}
apps/frappe/frappe/core/page/user_permissions/user_permissions.js +248,These restrictions will apply for Document Types where 'Apply User Permissions' is checked for the permission rule and a field with this value is present.,ข้อ จำกัด เหล่านี้จะนำไปใช้สำหรับประเภทเอกสารที่ &#39;ใช้สิทธิ์ของผู้ใช้&#39; การตรวจสอบสำหรับการปกครองได้รับอนุญาตและเขตข้อมูลที่มีค่านี้เป็นปัจจุบัน
DocType: Email Alert,Send alert if this field's value changes,ส่งการแจ้งเตือนหากมีการเปลี่ยนแปลงค่าของเขตนี้
apps/frappe/frappe/print/page/print_format_builder/print_format_builder.js +102,Select a DocType to make a new format,เลือก DocType ที่จะทำให้รูปแบบใหม่
apps/frappe/frappe/public/js/frappe/misc/pretty_date.js +40,just now,เมื่อกี้
DocType: Module Def,Module Def,Def โมดูล
apps/frappe/frappe/print/doctype/print_format/print_format.py +79,Done,เสร็จสิ้น
apps/frappe/frappe/public/js/frappe/form/footer/timeline_item.html +67,Reply,ตอบ
apps/frappe/frappe/config/core.py +22,Pages in Desk (place holders),หน้าโต๊ะ (ผู้ถือสถานที่)
DocType: DocField,Collapsible Depends On,พับขึ้นอยู่กับ
DocType: Email Account,SMTP Server,SMTP เซิร์ฟเวอร์
DocType: Print Format,Print Format Help,พิมพ์รูปแบบความช่วยเหลือ
apps/frappe/frappe/public/js/frappe/views/reports/grid_report.js +849,With Groups,ด้วย กลุ่ม
apps/frappe/frappe/core/page/data_import_tool/exporter.py +70,"If you are updating, please select ""Overwrite"" else existing rows will not be deleted.","หากคุณกำลังปรับปรุงโปรดเลือก ""ทับ"" แถวอื่น ๆ ที่มีอยู่จะไม่ถูกลบ"
DocType: Event,Every Month,ทุกเดือน
DocType: Letter Head,Letter Head in HTML,หัวจดหมาย ในรูปแบบ HTML
DocType: Web Form,Web Form,ฟอร์มเว็บ
DocType: About Us Settings,Org History Heading,ประวัติ org หัวเรื่อง
DocType: Communication,Integrations can use this field to set email delivery status,Integrations สามารถใช้ข้อมูลนี้ในการตั้งค่าสถานะการส่งอีเมล
DocType: Web Form,Web Page Link Text,หน้าเว็บลิงค์ข้อความ
apps/frappe/frappe/config/setup.py +177,"Set default format, page size, print style etc.",รูปแบบการตั้งค่าเริ่มต้นขนาดหน้าลักษณะการพิมพ์ ฯลฯ
DocType: DocType,Naming,การตั้งชื่อ
DocType: Event,Every Year,ทุกปี
apps/frappe/frappe/public/js/frappe/list/header_select_all_like_filter.html +3,Select All,เลือกทั้งหมด
apps/frappe/frappe/config/setup.py +248,Custom Translations,คำที่กำหนดเอง
apps/frappe/frappe/public/js/frappe/form/linked_with.js +86,Not Linked to any record.,ไม่ได้เชื่อมโยงไปยังระเบียนใด ๆ
apps/frappe/frappe/public/js/frappe/form/workflow.js +32, by Role ,โดยบทบาท
apps/frappe/frappe/core/doctype/user/user.py +516,Registered but disabled.,สมาชิก แต่ปิดการใช้งาน
apps/frappe/frappe/public/js/frappe/list/doclistview.js +735,Delete permanently?,ลบอย่างถาวร?
apps/frappe/frappe/public/js/frappe/ui/toolbar/awesome_bar.js +109,Search in a document type,ค้นหาในรูปแบบเอกสาร
apps/frappe/frappe/custom/doctype/customize_form/customize_form.js +224,Allow field to remain editable even after submission,อนุญาตให้ข้อมูลที่จะยังคงสามารถแก้ไขได้แม้หลังจากที่ส่ง
DocType: DocPerm,Role and Level,บทบาท และ ระดับ
DocType: File,Thumbnail URL,URL รูปขนาดย่อ
apps/frappe/frappe/desk/moduleview.py +37,Custom Reports,รายงานที่กำหนดเอง
DocType: Website Script,Website Script,สคริปต์เว็บไซต์
apps/frappe/frappe/config/setup.py +182,Customized HTML Templates for printing transactions.,แม่แบบ HTML ที่กำหนดเองสำหรับการทำธุรกรรมการพิมพ์
DocType: Workflow,Is Active,มีการใช้งาน
apps/frappe/frappe/desk/form/utils.py +91,No further records,ไม่มีระเบียนใด
DocType: DocField,Long Text,ข้อความยาว
DocType: Workflow State,Primary,ประถม
apps/frappe/frappe/core/page/data_import_tool/importer.py +39,Please do not change the rows above {0},กรุณาอย่า เปลี่ยน แถว ด้านบน {0}
apps/frappe/frappe/public/js/frappe/ui/toolbar/navbar.html +76,(Ctrl + G),(Ctrl + G)
DocType: Communication,More Information,ข้อมูลมากกว่านี้
DocType: Desktop Icon,Desktop Icon,ไอคอนสก์ท็อป
apps/frappe/frappe/public/js/frappe/views/pageview.js +110,Sorry! You are not permitted to view this page.,ขออภัย! คุณยังไม่ได้รับอนุญาตให้ดูหน้านี้
DocType: Workflow State,bell,ระฆัง
apps/frappe/frappe/public/js/frappe/form/templates/set_sharing.html +39,Share this document with,แบ่งปันเอกสารกับเรื่องนี้
apps/frappe/frappe/utils/nestedset.py +235,{0} {1} cannot be a leaf node as it has children,{0} {1} ไม่สามารถเป็น โหนดใบที่มี เด็ก
DocType: Communication,Info,ข้อมูล
DocType: Communication,Email,อีเมล์
apps/frappe/frappe/templates/includes/contact.js +30,Thank you for your message,ขอบคุณสำหรับข้อความของคุณ
apps/frappe/frappe/www/login.py +56,Invalid Login Token,เข้าสู่ระบบ Token ไม่ถูกต้อง
apps/frappe/frappe/public/js/frappe/misc/pretty_date.js +43,1 hour ago,1 ชั่วโมงที่แล้ว
DocType: Website Settings,Home Page,หน้าแรก
DocType: Error Snapshot,Parent Error Snapshot,ภาพรวมข้อผิดพลาดของผู้ปกครอง
DocType: Email Alert,Filters,ตัวกรอง
DocType: Workflow State,share-alt,หุ้น Alt-
DocType: Role,Role Name,ชื่อบทบาท
apps/frappe/frappe/config/core.py +27,Script or Query reports,สคริปต์หรือรายงานคำ
DocType: Workflow Document State,Workflow Document State,รัฐเอกสารเวิร์กโฟลว์
apps/frappe/frappe/core/page/permission_manager/permission_manager_help.html +32,"To give acess to a role for only specific records, check the Apply User Permissions. User Permissions are used to limit users with such role to specific records.",เพื่อให้ Acess บทบาทสำหรับบันทึกเฉพาะตรวจสอบสิทธิ์ของผู้ใช้สมัคร สิทธิ์ของผู้ใช้จะใช้ในการ จำกัด ผู้ใช้ที่มีบทบาทดังกล่าวจะบันทึกเฉพาะ
apps/frappe/frappe/workflow/doctype/workflow/workflow.py +70,Cannot cancel before submitting. See Transition {0},ไม่สามารถยกเลิก ก่อนที่จะส่ง
apps/frappe/frappe/www/print.py +184,Print Format {0} is disabled,พิมพ์รูปแบบ {0} ถูกปิดใช้งาน
DocType: Email Alert,Send days before or after the reference date,ส่งวันก่อนหรือหลังวันที่อ้างอิง
DocType: User,Allow user to login only after this hour (0-24),อนุญาตให้ผู้ใช้เข้าสู่ระบบเท่านั้นหลังจากชั่วโมงนี้ (0-24)
apps/frappe/frappe/public/js/frappe/form/link_selector.js +20,Value,มูลค่า
apps/frappe/frappe/email/doctype/newsletter/newsletter.py +139,Click here to verify,คลิกที่นี่เพื่อตรวจสอบ
apps/frappe/frappe/desk/doctype/todo/todo_list.js +22,Assigned By Me,ได้รับมอบหมายจากฉัน
apps/frappe/frappe/core/doctype/doctype/doctype.py +69,Not in Developer Mode! Set in site_config.json or make 'Custom' DocType.,ไม่ได้อยู่ในโหมดนักพัฒนาซอฟต์แวร์! ตั้งอยู่ใน site_config.json หรือทำให้ DocType 'กำหนดเอง'
DocType: Workflow State,globe,โลก
DocType: System Settings,dd.mm.yyyy,dd.mm.yyyy
apps/frappe/frappe/custom/doctype/customize_form/customize_form.js +216,Hide field in Standard Print Format,ซ่อนข้อมูลในรูปแบบของการพิมพ์มาตรฐาน
DocType: ToDo,Priority,บุริมสิทธิ์
DocType: Dropbox Backup,Dropbox Access Allowed,Dropbox เข็น
DocType: Dropbox Backup,Weekly,รายสัปดาห์
DocType: Communication,In Reply To,ตอบกลับ
DocType: DocField,Float,ลอย
DocType: Module Def,Module Name,ชื่อโมดูล
DocType: DocType,DocType is a Table / Form in the application.,DocType เป็นตาราง / แบบฟอร์มในใบสมัคร
DocType: Email Account,GMail,GMail
apps/frappe/frappe/public/js/frappe/views/reports/reportview.js +117,{0} Report,{0} รายงาน
apps/frappe/frappe/public/js/frappe/form/print.js +167,Warning: This Print Format is in old style and cannot be generated via the API.,คำเตือน: พิมพ์รูปแบบนี้อยู่ในรูปแบบเก่าและไม่สามารถสร้างขึ้นผ่านทาง
DocType: DocField,Print Width,ความกว้างพิมพ์
,Setup Wizard,ตัวช่วยสร้าง การติดตั้ง
DocType: User,Allow user to login only before this hour (0-24),อนุญาตให้ผู้ใช้เข้าสู่ระบบก่อนที่จะชั่วโมงนี้ (0-24)
apps/frappe/frappe/core/doctype/file/file.py +106,Folder is mandatory,โฟลเดอร์มีผลบังคับใช้
DocType: Email Alert,Reference Date,วันที่อ้างอิง
DocType: DocType,Comments and Communications will be associated with this linked document,ความคิดเห็นและการสื่อสารจะเชื่อมโยงกับเอกสารที่เชื่อมโยงนี้
apps/frappe/frappe/print/page/print_format_builder/print_format_builder_sidebar.html +3,Filter...,กรอง ...
DocType: Workflow State,bold,กล้า
DocType: Async Task,Status,สถานะ
DocType: Company History,Year,ปี
apps/frappe/frappe/website/doctype/website_settings/website_settings.py +34,{0} does not exist in row {1},{0} ไม่อยู่ในแถว {1}
DocType: Event,Event Type,ชนิดเหตุการณ์
DocType: User,Last Known Versions,รุ่นสุดท้ายที่ทราบ
apps/frappe/frappe/config/setup.py +135,Add / Manage Email Accounts.,เพิ่ม / จัดการอีเมล
DocType: Blog Category,Published,เผยแพร่
apps/frappe/frappe/templates/emails/auto_reply.html +1,Thank you for your email,ขอบคุณสำหรับอีเมลของคุณ
DocType: DocField,Small Text,ข้อความขนาดเล็ก
apps/frappe/frappe/core/doctype/user/user.py +635,Administrator accessed {0} on {1} via IP Address {2}.,ผู้ดูแลระบบเข้าถึง {0} ใน {1} ผ่านอยู่ IP {2}
apps/frappe/frappe/public/js/frappe/ui/filters/edit_filter.html +6,Equals,เท่ากับ
apps/frappe/frappe/core/doctype/doctype/doctype.py +322,Options 'Dynamic Link' type of field must point to another Link Field with options as 'DocType',ตัวเลือก 'การเชื่อมโยงแบบไดนามิก' ชนิดของเขตข้อมูลต้องชี้ไปที่การเชื่อมโยงสนามอื่นที่มีตัวเลือกเป็น 'DocType'
DocType: About Us Settings,Team Members Heading,สมาชิกในทีมหัวเรื่อง
