DocType: Auto Email Report,Filters Display,ตัวกรองการแสดงผล
DocType: Website Theme,Top Bar Color,บาร์ด้านบนสี
DocType: Address,Plant,พืช
DocType: DocType,Setup,การติดตั้ง
DocType: DocType,Allow Import,อนุญาตให้นำเข้า
apps/frappe/frappe/templates/includes/comments/comments.py +55,New comment on {0} {1},ความคิดเห็นเกี่ยวกับ {0} {1}
DocType: Workflow State,glass,แก้ว
DocType: DocType,Timeline Field,ไทม์ไลน์ของสนาม
DocType: Country,Time Zones,เขตเวลา
DocType: DocField,Image,รูปภาพ
DocType: Workflow State,remove-sign,ลบเซ็น
apps/frappe/frappe/config/setup.py +188,Define workflows for forms.,กำหนด ขั้นตอนการทำงาน ในรูปแบบ
DocType: Communication,Other,อื่น ๆ
apps/frappe/frappe/print/page/print_format_builder/print_format_builder.js +162,Start new Format,เริ่มต้นรูปแบบใหม่
apps/frappe/frappe/core/page/user_permissions/user_permissions.js +144,Please attach a file,กรุณาแนบไฟล์
DocType: Workflow State,font,ตัวอักษร
apps/frappe/frappe/utils/password_strength.py +149,This is a top-100 common password.,นี่คือรหัสผ่านที่พบบ่อย TOP-100
apps/frappe/frappe/email/doctype/auto_email_report/auto_email_report.js +30,Please enable pop-ups,กรุณาเปิดใช้งาน ป๊อปอัพ
DocType: Contact,Mobile No,เบอร์มือถือ
DocType: Communication,Text Content,เนื้อหาข้อความ
DocType: Customize Form Field,Is Custom Field,เป็นฟิลด์ที่กำหนดเอง
DocType: Workflow,"If checked, all other workflows become inactive.",หากตรวจสอบทุกขั้นตอนการทำงานอื่น ๆ เป็นที่รอ
apps/frappe/frappe/core/doctype/report/report.js +10,[Label]:[Field Type]/[Options]:[Width],[Label] แล: [ฟิลด์ชนิด] / [ตัวเลือก]: [กว้าง]
DocType: Workflow State,folder-close,โฟลเดอร์ใกล้
apps/frappe/frappe/model/rename_doc.py +126,{0} not allowed to be renamed,{0} ไม่อนุญาตให้เปลี่ยนชื่อ
DocType: Custom Script,Custom Script,สคริปต์ที่กำหนดเอง
DocType: Address,Address Line 2,ที่อยู่บรรทัดที่ 2
DocType: Communication,Reference,การอ้างอิง
apps/frappe/frappe/public/js/frappe/model/model.js +26,Assigned To,มอบหมายให้
apps/frappe/frappe/core/doctype/user/user.py +238,Verify Your Account,ตรวจสอบบัญชีของคุณ
DocType: Email Flag Queue,Action,ดำเนินการ
apps/frappe/frappe/www/update-password.html +111,Please enter the password,โปรดป้อนรหัสผ่าน
apps/frappe/frappe/www/print.py +83,Not allowed to print cancelled documents,ไม่ได้รับอนุญาตในการพิมพ์เอกสารยกเลิก
apps/frappe/frappe/core/page/data_import_tool/exporter.py +268,Info:,ข้อมูล:
DocType: Custom Field,Permission Level,ระดับของสิทธิ์
DocType: User,Send Notifications for Transactions I Follow,ส่งการแจ้งเตือนสำหรับรายการที่ฉันติดตาม
apps/frappe/frappe/core/doctype/doctype/doctype.py +623,"{0}: Cannot set Submit, Cancel, Amend without Write",{0} : ไม่สามารถตั้งค่า การส่ง การยกเลิก และ การแก้ไข ได้โดยไม่ได้ เขียน
apps/frappe/frappe/public/js/frappe/form/footer/attachments.js +83,Are you sure you want to delete the attachment?,คุณแน่ใจหรือว่าต้องการลบสิ่งที่แนบมา?
apps/frappe/frappe/model/delete_doc.py +185,"Cannot delete or cancel because {0} <a href=""#Form/{0}/{1}"">{1}</a> is linked with {2} <a href=""#Form/{2}/{3}"">{3}</a>","ไม่สามารถลบหรือยกเลิกเนื่องจาก {0} <a href=""#Form/{0}/{1}"">{1}</a> การเชื่อมโยงกับ {2} <a href=""#Form/{2}/{3}"">{3}</a>"
apps/frappe/frappe/__init__.py +1051,Thank you,ขอบคุณ
apps/frappe/frappe/public/js/frappe/form/save.js +11,Saving,ประหยัด
DocType: Print Settings,Print Style Preview,ตัวอย่างรูปแบบการพิมพ์
apps/frappe/frappe/core/doctype/file/test_file.py +81,Test_Folder,Test_Folder
apps/frappe/frappe/website/doctype/web_form/web_form.py +359,You are not allowed to update this Web Form Document,คุณยังไม่ได้รับอนุญาตให้ปรับปรุงเอกสารเว็บฟอร์มนี้
DocType: About Us Settings,About Us Settings,การตั้งค่าข้อมูลเกี่ยวกับเรา
DocType: Website Settings,Website Theme,ธีมเว็บไซต์
DocType: DocField,In List View,ในมุมมองรายการ
DocType: Email Account,Use TLS,ใช้ TLS
apps/frappe/frappe/email/smtp.py +24,Invalid login or password,เข้าสู่ระบบ ที่ไม่ถูกต้อง หรือรหัสผ่าน
apps/frappe/frappe/config/setup.py +259,Add custom javascript to forms.,เพิ่ม javascript ที่กำหนดเอง ในรูปแบบ
apps/frappe/frappe/public/js/frappe/views/reports/query_report.js +457,Sr No,Sr ไม่มี
,Role Permissions Manager,ผู้จัดการ สิทธิ์ บทบาท
apps/frappe/frappe/print/page/print_format_builder/print_format_builder.js +117,Name of the new Print Format,ชื่อของรูปแบบพิมพ์ใหม่
apps/frappe/frappe/public/js/frappe/form/control.js +942,Clear Attachment,สิ่งที่ส่งมาชัดเจน
apps/frappe/frappe/core/page/data_import_tool/exporter.py +266,Mandatory:,บังคับ:
,User Permissions Manager,จัดการ สิทธิ์ของผู้ใช้
DocType: Property Setter,New value to be set,ค่าใหม่ที่จะตั้ง
DocType: Email Alert,Days Before or After,วันก่อนหรือหลัง
DocType: Email Alert,Email Alert,อีเมล์แจ้งเตือน
apps/frappe/frappe/core/page/permission_manager/permission_manager_help.html +34,Select Document Types to set which User Permissions are used to limit access.,เลือกประเภทของเอกสารที่จะกำหนดสิทธิ์ของผู้ใช้ที่จะใช้ในการ จำกัด การเข้าถึง
DocType: Website Settings,HTML Header & Robots,HTML ส่วนหัวและหุ่นยนต์
apps/frappe/frappe/config/website.py +32,Blog,บล็อก
apps/frappe/frappe/core/page/data_import_tool/data_import_main.html +43,Download with data,ดาวน์โหลดที่มีข้อมูล
DocType: Workflow State,hand-right,มือข้างขวา-
DocType: Website Settings,Subdomain,subdomain
apps/frappe/frappe/desk/page/setup_wizard/setup_wizard.js +437,Region,ภูมิภาค
apps/frappe/frappe/config/setup.py +231,Settings for OAuth Provider,การตั้งค่าสำหรับผู้ให้บริการ OAuth
apps/frappe/frappe/public/js/frappe/form/workflow.js +35,Current status,สถานะปัจจุบัน
DocType: Web Form,Allow Delete,อนุญาตให้ลบ
DocType: Email Alert,Message Examples,ตัวอย่างข้อความ
DocType: Web Form,Login Required,ต้องเข้าสู่ระบบ
apps/frappe/frappe/config/website.py +42,Write titles and introductions to your blog.,เขียนชื่อและที่จะแนะนำบล็อกของคุณ
apps/frappe/frappe/templates/pages/integrations/payment-cancel.html +3,Payment Cancelled,การชำระเงินที่ถูกยกเลิก
apps/frappe/frappe/core/doctype/error_log/error_log_list.js +12,Clear Error Logs,บันทึกข้อผิดพลาดที่ชัดเจน
DocType: Email Account,Notify if unreplied for (in mins),ถ้ายังไม่มีการตอบแจ้งสำหรับ (ในนาที)
apps/frappe/frappe/public/js/frappe/list/listview.js +385,2 days ago,2 วันที่ผ่านมา
apps/frappe/frappe/config/website.py +47,Categorize blog posts.,แบ่งหมวดหมู่ของบล็อกโพสต์
DocType: Workflow State,Time,เวลา
DocType: DocField,Attach,แนบ
apps/frappe/frappe/core/doctype/doctype/doctype.py +481,{{{0}}} is not a valid fieldname pattern. It should be {{field_name}}.,{{{0}}} ไม่ได้เป็นรูปแบบที่ถูกต้อง fieldname มันควรจะเป็น {{}} FIELD_NAME
DocType: DocType,Permission Rules,กฎการอนุญาต
DocType: Contact,Links,ลิงค์
apps/frappe/frappe/model/base_document.py +422,Value missing for,ค่าที่หายไปสำหรับ
apps/frappe/frappe/public/js/frappe/views/treeview.js +161,Add Child,เพิ่ม เด็ก
apps/frappe/frappe/model/delete_doc.py +165,{0} {1}: Submitted Record cannot be deleted.,{0} {1}: รายการที่ส่งแล้วไม่สามารถลบได้
apps/frappe/frappe/core/page/usage_info/usage_info.html +99,Backup Size,ขนาดการสำรองข้อมูล
apps/frappe/frappe/public/js/frappe/ui/toolbar/awesome_bar.js +164,new type of document,ชนิดใหม่ของเอกสาร
DocType: Custom DocPerm,Read,อ่าน
apps/frappe/frappe/print/page/print_format_builder/print_format_builder.js +460,Align Value,ตําแหน่งราคา
apps/frappe/frappe/www/update-password.html +14,Old Password,รหัสผ่านเก่า
apps/frappe/frappe/website/doctype/blog_post/blog_post.py +106,Posts by {0},โพสต์โดย {0}
apps/frappe/frappe/core/doctype/report/report.js +9,"To format columns, give column labels in the query.",การจัดรูปแบบคอลัมน์ให้ป้ายชื่อคอลัมน์ในแบบสอบถาม
apps/frappe/frappe/core/doctype/doctype/doctype.py +650,{0}: Cannot set Assign Amend if not Submittable,{0} : ไม่สามารถ ตั้งค่าการ กำหนด Amend ถ้าไม่ Submittable
apps/frappe/frappe/core/page/user_permissions/user_permissions.js +14,Edit Role Permissions,แก้ไขสิทธิ์บทบาท
DocType: Communication,Link DocType,การเชื่อมโยง DocType
DocType: Social Login Keys,Social Login Keys,เข้าสู่ระบบ สังคม คีย์
apps/frappe/frappe/custom/doctype/customize_form/customize_form.js +76,Remove all customizations?,ลบ การปรับแต่ง ทั้งหมดหรือไม่
DocType: Website Slideshow,Slideshow Name,ชื่อสไลด์โชว์
apps/frappe/frappe/public/js/frappe/form/save.js +15,Cancelling,กำลังยกเลิก
DocType: DocType,Allow Rename,อนุญาตให้เปลี่ยนชื่อ
DocType: Authentication Log,Full Name,ชื่อเต็ม
DocType: DocType,Child Tables are shown as a Grid in other DocTypes.,ตารางเด็กจะปรากฏเป็นเส้นตารางใน doctypes อื่น ๆ
DocType: Blog Post,"Description for listing page, in plain text, only a couple of lines. (max 140 characters)",คำอธิบายสำหรับหน้าแสดงรายการในข้อความธรรมดาเพียงคู่สาย (สูงสุด 140 ตัวอักษร)
apps/frappe/frappe/core/page/user_permissions/user_permissions.js +302,Add A User Restriction,เพิ่มข้อ จำกัด ผู้ใช้
DocType: DocType,Name Case,กรณีชื่อ
apps/frappe/frappe/public/js/frappe/form/share.js +27,Shared with everyone,ที่ใช้ร่วมกันกับทุกคน
apps/frappe/frappe/model/base_document.py +417,Data missing in table,ข้อมูลที่หายไปในตาราง
DocType: Web Form,Success URL,URL ที่ประสบความสำเร็จ
DocType: Email Account,Append To,ผนวกกับ
DocType: Workflow Document State,Only Allow Edit For,อนุญาตให้เฉพาะสำหรับแก้ไข
apps/frappe/frappe/templates/includes/comments/comments.html +35,Your Name,ชื่อของคุณ
DocType: DocType,InnoDB,InnoDB
DocType: File,Is Folder,เป็นโฟลเดอร์
DocType: DocType,DocType,DOCTYPE
apps/frappe/frappe/geo/report/addresses_and_contacts/addresses_and_contacts.js +9,Party Type,ประเภท บุคคล
DocType: Website Theme,"If image is selected, color will be ignored.",หากภาพเลือกสีจะถูกละเว้น
DocType: User,Mute Sounds,ปิดเสียง
DocType: Top Bar Item,Top Bar Item,รายการ Bar สถานที่ยอด
apps/frappe/frappe/utils/csvutils.py +51,"Unknown file encoding. Tried utf-8, windows-1250, windows-1252.","การเข้ารหัส ไฟล์ ที่ไม่รู้จัก พยายาม UTF -8 , Windows - 1250 1252 หน้าต่าง"
DocType: Website Settings,Robots.txt,robots.txt
apps/frappe/frappe/core/doctype/user/user.py +168,Sorry! Sharing with Website User is prohibited.,ขออภัย! ร่วมกับผู้ใช้เว็บไซต์เป็นสิ่งต้องห้าม
apps/frappe/frappe/core/doctype/user/user.js +203,Add all roles,เพิ่ม บทบาท ทั้งหมด
apps/frappe/frappe/templates/includes/contact.js +11,"Please enter both your email and message so that we \
				can get back to you. Thanks!","กรุณากรอกตัวอักษรทั้งอีเมล์และข้อความของคุณเพื่อให้เรา \
 จะได้รับกลับมาให้คุณ ขอบคุณ!"
apps/frappe/frappe/email/smtp.py +167,Could not connect to outgoing email server,ไม่สามารถ เชื่อมต่อกับเซิร์ฟเวอร์ อีเมลขาออก
apps/frappe/frappe/email/doctype/newsletter/newsletter.py +133,Thank you for your interest in subscribing to our updates,ขอบคุณที่ให้ความสนใจในการสมัครรับการปรับปรุงของเรา
DocType: Workflow State,resize-full,ปรับขนาดเต็ม
DocType: Workflow State,off,ปิด
apps/frappe/frappe/desk/query_report.py +26,Report {0} is disabled,รายงาน {0} เป็นคนพิการ
apps/frappe/frappe/core/page/data_import_tool/data_import_main.html +37,Recommended for inserting new records.,แนะนำสำหรับการแทรกระเบียนใหม่
DocType: Async Task,Core,แกน
DocType: DocField,Set non-standard precision for a Float or Currency field,ตั้งความแม่นยำที่ไม่ได้มาตรฐานสำหรับลอยหรือสาขาสกุลเงิน
DocType: Email Account,Ignore attachments over this size,ละเว้นสิ่งที่แนบมามากกว่าขนาดนี้
DocType: Address,Preferred Billing Address,ที่อยู่การเรียกเก็บเงินที่ต้องการ
apps/frappe/frappe/database.py +231,Too many writes in one request. Please send smaller requests,เขียน มากเกินไปใน หนึ่งขอ กรุณา ส่งคำขอ มีขนาดเล็ก
DocType: Workflow State,arrow-up,ลูกศรขึ้น
DocType: OAuth Bearer Token,Expires In,จะหมดอายุใน
DocType: DocField,Allow on Submit,อนุญาตให้ส่ง
DocType: DocField,HTML,HTML
DocType: Error Snapshot,Exception Type,ประเภทยกเว้น
apps/frappe/frappe/public/js/frappe/views/reports/reportview.js +588,Pick Columns,เลือกคอลัมน์
DocType: Web Page,Add code as &lt;script&gt;,เพิ่มรหัสเป็น &lt;script&gt;
apps/frappe/frappe/core/page/data_import_tool/data_import_main.html +7,Select Type,เลือกประเภท
apps/frappe/frappe/integration_broker/doctype/integration_service/integration_service.js +95,Please enter values for App Access Key and App Secret Key,กรุณาป้อนค่าสำหรับ App คีย์และ app คีย์ลับ
DocType: Web Form,Accept Payment,ยอมรับการชำระเงิน
apps/frappe/frappe/config/core.py +62,A log of request errors,บันทึกข้อผิดพลาดของการร้องขอ
DocType: Report,Letter Head,หัวจดหมาย
DocType: DocType,Quick Entry,รายการด่วน
apps/frappe/frappe/core/doctype/file/file.py +224,No permission to write / remove.,ได้รับอนุญาตให้เขียน / ลบไม่มี
DocType: Web Form,Button Label,ปุ่มฉลาก
DocType: Website Theme,UPPERCASE,พิมพ์ใหญ่
apps/frappe/frappe/public/js/frappe/list/doclistview.js +935,{0} items selected,{0} รายการที่เลือกแล้ว
apps/frappe/frappe/print/page/print_format_builder/print_format_builder_layout.html +3,Drag elements from the sidebar to add. Drag them back to trash.,องค์ประกอบลากจากแถบด้านข้างเพื่อเพิ่ม ลากพวกเขากลับไปยังถังขยะ
DocType: Workflow State,resize-small,ปรับขนาดเล็ก
DocType: Address,Postal Code,รหัสไปรษณีย์
DocType: Top Bar Item,Right,ขวา
DocType: User,User Type,ประเภทผู้ใช้
apps/frappe/frappe/email/doctype/auto_email_report/auto_email_report.js +65,Click table to edit,คลิกที่ตารางเพื่อแก้ไข
apps/frappe/frappe/core/page/user_permissions/user_permissions.js +68,Select User,เลือกผู้ใช้
DocType: Async Task,Reference Doc,อ้างอิงหมอ
DocType: Communication,Keep a track of all communications,ติดตามการสื่อสารทั้งหมด
apps/frappe/frappe/desk/form/save.py +34,Did not save,ไม่ได้บันทึก
DocType: Property Setter,Property,คุณสมบัติ
DocType: Email Account,Yandex.Mail,Yandex.Mail
DocType: Website Slideshow,"Note: For best results, images must be of the same size and width must be greater than height.",หมายเหตุ: สำหรับผลลัพธ์ที่ดีที่สุดภาพต้องมีขนาดเท่ากันและความกว้างต้องมากกว่าความสูง
DocType: DocType,Auto Name,ชื่ออัตโนมัติ
apps/frappe/frappe/utils/password_strength.py +104,Avoid sequences like abc or 6543 as they are easy to guess,หลีกเลี่ยงการลำดับเช่น ABC หรือ 6543 ที่พวกเขาเป็นเรื่องง่ายที่จะคาดเดา
apps/frappe/frappe/public/js/frappe/request.js +93,Please try again,กรุณาลองอีกครั้ง
apps/frappe/frappe/custom/doctype/custom_field/custom_field.js +61,Option 3,ตัวเลือกที่ 3
DocType: Workflow State,Edit,แก้ไข
apps/frappe/frappe/custom/doctype/customize_form/customize_form.js +226,Permissions can be managed via Setup &gt; Role Permissions Manager,สิทธิ์สามารถจัดการได้ผ่านการตั้งค่า & gt; บทบาทผู้จัดการสิทธิ์
DocType: Contact Us Settings,Pincode,Pincode
apps/frappe/frappe/core/page/data_import_tool/importer.py +78,Please make sure that there are no empty columns in the file.,กรุณาตรวจสอบให้แน่ใจว่าไม่มีคอลัมน์ที่ว่างเปล่าในแฟ้ม
apps/frappe/frappe/utils/oauth.py +232,Please ensure that your profile has an email address,โปรดตรวจสอบว่ารายละเอียดของคุณมีที่อยู่อีเมล
apps/frappe/frappe/public/js/frappe/model/create_new.js +270,You have unsaved changes in this form. Please save before you continue.,คุณมีการเปลี่ยนแปลงที่ไม่ได้บันทึกในฟอร์มนี้ กรุณาบันทึกเพื่อที่จะดำเนินการต่อ
apps/frappe/frappe/core/doctype/doctype/doctype.py +402,Default for {0} must be an option,เริ่มต้นสำหรับ {0} จะต้องเป็นตัวเลือก
DocType: Tag Doc Category,Tag Doc Category,แท็ก Doc หมวดหมู่
DocType: User,User Image,รูปภาพของผู้ใช้
apps/frappe/frappe/email/queue.py +280,Emails are muted,อีเมลเป็น เงียบ
apps/frappe/frappe/public/js/frappe/form/templates/grid_form.html +25,Ctrl + Up,Ctrl + ขึ้น
DocType: Website Theme,Heading Style,สไตล์มุ่งหน้าไป
apps/frappe/frappe/desk/page/applications/applications.py +75,You cannot install this app,คุณไม่สามารถ ติดตั้ง app นี้
DocType: Communication,Error,ความผิดพลาด
apps/frappe/frappe/core/page/data_import_tool/data_import_main.html +89,Do not send Emails.,อย่าส่งอีเมล
DocType: DocField,Column Break,ตัวแบ่งคอลัมน์
DocType: Event,Thursday,วันพฤหัสบดี
apps/frappe/frappe/utils/response.py +137,You don't have permission to access this file,คุณไม่ได้รับอนุญาตให้เข้าถึงไฟล์นี้
apps/frappe/frappe/model/document.py +636,Cannot link cancelled document: {0},ไม่สามารถเชื่อมโยงเอกสารยกเลิก: {0}
apps/frappe/frappe/core/doctype/report/report.py +26,Cannot edit a standard report. Please duplicate and create a new report,ไม่สามารถแก้ไขรายงานมาตรฐาน กรุณาซ้ำกันและสร้างรายงานใหม่
apps/frappe/frappe/geo/doctype/address/address.py +54,"Company is mandatory, as it is your company address",บริษัท มีผลบังคับใช้ตามที่มันเป็นอยู่ บริษัท ของคุณ
apps/frappe/frappe/print/page/print_format_builder/print_format_builder.js +698,"For example: If you want to include the document ID, use {0}",ตัวอย่างเช่นถ้าคุณต้องการที่จะรวม ID เอกสารใช้ {0}
apps/frappe/frappe/print/page/print_format_builder/print_format_builder.js +600,Select Table Columns for {0},เลือกคอลัมน์ตารางสำหรับ {0}
DocType: Custom Field,Options Help,ตัวเลือกความช่วยเหลือ
DocType: Footer Item,Group Label,กลุ่มป้ายกำกับ
DocType: DocField,Report Hide,แจ้งซ่อน
apps/frappe/frappe/public/js/frappe/views/treeview.js +17,Tree view not available for {0},มุมมองต้นไม้ไม่สามารถใช้ได้สำหรับ {0}
DocType: Email Account,Domain,โดเมน
DocType: Custom Field,Label Help,ช่วยเหลือฉลาก
DocType: Workflow State,star-empty,ดาวที่ว่างเปล่า
apps/frappe/frappe/utils/password_strength.py +118,Dates are often easy to guess.,วันนี้มักจะเป็นเรื่องง่ายที่จะคาดเดา
apps/frappe/frappe/public/js/frappe/form/workflow.js +39,Next actions,ดำเนินการต่อไป
DocType: Workflow State,ok,ok
DocType: User,These values will be automatically updated in transactions and also will be useful to restrict permissions for this user on transactions containing these values.,ค่าเหล่านี้จะถูกปรับปรุงโดยอัตโนมัติในการทำธุรกรรมและยังจะเป็นประโยชน์เพื่อ จำกัด สิทธิ์สำหรับผู้ใช้นี้ในการทำธุรกรรมที่มีค่าเหล่านี้
apps/frappe/frappe/desk/page/applications/application_row.html +26,Publisher,ผู้พิมพ์
