apps/frappe/frappe/utils/backups.py +141,Download link for your backup will be emailed on the following email address: {0},ดาวน์โหลดลิงค์สำหรับการสำรองข้อมูลของคุณจะถูกส่งไปที่ที่อยู่อีเมลต่อไปนี้: {0}
apps/frappe/frappe/core/page/permission_manager/permission_manager_help.html +14,"Meaning of Submit, Cancel, Amend","ความหมายของ Submit, ยกเลิกอัพเดท"
apps/frappe/frappe/desk/doctype/todo/todo_list.js +7,To Do,สิ่งที่ต้องทำ
apps/frappe/frappe/public/js/frappe/ui/editor.html +25,Paragraph,ย่อหน้า
apps/frappe/frappe/core/page/user_permissions/user_permissions.js +133,Any existing permission will be deleted / overwritten.,ใด ๆ ที่ได้รับอนุญาตที่มีอยู่จะถูกลบ / แทนที่
apps/frappe/frappe/public/js/frappe/views/reports/reportview.js +454,Then By (optional),แล้วโดย (ไม่จำเป็น)
DocType: File,Preview HTML,ดูตัวอย่าง HTM​​L
apps/frappe/frappe/desk/doctype/todo/todo.py +18,Assigned to {0}: {1},ได้รับมอบหมายให้ {0}: {1}
DocType: DocField,Percent,เปอร์เซ็นต์
apps/frappe/frappe/public/js/frappe/views/reports/query_report.js +255,Please set filters,กรุณาตั้งค่าตัวกรอง
apps/frappe/frappe/public/js/frappe/form/linked_with.js +25,Linked With,เชื่อมโยงกับ
DocType: Workflow State,book,หนังสือ
DocType: Website Settings,Landing Page,หน้า Landing Page
apps/frappe/frappe/core/page/data_import_tool/data_import_tool.js +81,"Import Request Queued. This may take a few moments, please be patient.",นำเข้าจัดคิวการร้องขอ ซึ่งอาจใช้เวลาสักครู่โปรดอดทน
apps/frappe/frappe/core/page/permission_manager/permission_manager.js +162,No Permissions set for this criteria.,ไม่มีสิทธิ์ที่กำหนดไว้สำหรับเกณฑ์นี้
apps/frappe/frappe/config/setup.py +120,Setup Email Alert based on various criteria.,การแจ้งเตือนการตั้งค่าอีเมล์ตามเกณฑ์ต่างๆ
apps/frappe/frappe/website/doctype/blog_post/blog_post.py +93,Posts filed under {0},กระทู้ยื่นภายใต้ {0}
DocType: Email Alert,Send alert if date matches this field's value,ส่งการแจ้งเตือนถ้าวันที่ตรงกับค่าของเขตนี้
DocType: Workflow,Transitions,เปลี่ยน
DocType: User,Login After,เข้าสู่ระบบหลังจากที่
DocType: Print Format,Monospace,monospace
DocType: Workflow State,thumbs-up,ยกนิ้วขึ้น
apps/frappe/frappe/public/js/frappe/views/communication.js +15,Add Reply,เพิ่มตอบ
DocType: DocPerm,DocPerm,DocPerm
apps/frappe/frappe/core/doctype/doctype/doctype.py +290,Precision should be between 1 and 6,Precision ควรอยู่ระหว่าง 1 และ 6
DocType: About Us Team Member,Image Link,ลิงก์รูปภาพ
DocType: Workflow State,step-backward,ขั้นตอนย้อนหลัง
apps/frappe/frappe/utils/boilerplate.py +231,{app_title},{app_title}
apps/frappe/frappe/email/doctype/email_unsubscribe/email_unsubscribe.py +16,Delete this record to allow sending to this email address,ลบบันทึกนี้จะอนุญาตให้ส่งไปยังที่อยู่อีเมลนี้
DocType: Email Account,Uses the Email ID mentioned in this Account as the Sender for all emails sent using this Account. ,ใช้อีเมล์ ID ที่ระบุไว้ในบัญชีนี้เป็นผู้ส่งอีเมลทั้งหมดที่ส่งโดยใช้บัญชีนี้
apps/frappe/frappe/core/page/data_import_tool/exporter.py +65,Only mandatory fields are necessary for new records. You can delete non-mandatory columns if you wish.,เฉพาะข้อมูลที่จำเป็นต้องมีความจำเป็นสำหรับระเบียนใหม่ คุณสามารถลบคอลัมน์ไม่ได้รับคำสั่งหากคุณต้องการ
apps/frappe/frappe/public/js/frappe/views/calendar.js +276,Unable to update event,ไม่สามารถปรับปรุงเหตุการณ์
DocType: Workflow State,text-height,ข้อความที่มีความสูง
DocType: Workflow State,map-marker,แผนที่เครื่องหมาย
apps/frappe/frappe/core/page/permission_manager/permission_manager_help.html +39,Submit an Issue,ส่ง ออก
DocType: Event,Repeat this Event,ทำซ้ำเหตุการณ์นี้
DocType: DocPerm,Amend,แก้ไข
DocType: File,Is Attachments Folder,เป็นโฟลเดอร์ไฟล์แนบ
apps/frappe/frappe/templates/includes/login/login.js +46,Valid Login id required.,เข้าสู่ระบบรหัสที่ถูกต้อง
apps/frappe/frappe/desk/doctype/todo/todo.js +30,Re-open,Re - เปิด
apps/frappe/frappe/core/doctype/docshare/docshare.py +53,{0} un-shared this document with {1},{0} ยกเลิกการแชร์เอกสารร่วมกับ{1}
apps/frappe/frappe/public/js/frappe/form/workflow.js +118,Document Status transition from {0} to {1} is not allowed,การเปลี่ยนแปลง สถานะ เอกสารจาก {0} เป็น {1} ไม่ได้รับอนุญาต
apps/frappe/frappe/templates/emails/auto_reply.html +5,This is an automatically generated reply,นี่คือการตอบกลับโดยอัตโนมัติ
apps/frappe/frappe/public/js/frappe/model/create_new.js +269,Get From,ได้รับจาก
apps/frappe/frappe/model/document.py +416,Record does not exist,บันทึก ไม่อยู่
apps/frappe/frappe/templates/pages/404.html +4,Page missing or moved,หน้าขาดหายไปหรือย้าย
apps/frappe/frappe/public/js/frappe/form/control.js +978,Open Link,เปิดการเชื่อมโยง
apps/frappe/frappe/desk/form/load.py +42,Did not load,ไม่ได้โหลด
apps/frappe/frappe/desk/query_report.py +80,Query must be a SELECT,แบบสอบถามจะต้องเลือก
DocType: Website Settings,Facebook Share,Facebook แบ่งปัน
apps/frappe/frappe/public/js/frappe/request.js +95,File size exceeded the maximum allowed size of {0} MB,ขนาดไฟล์ เกิน ขนาดสูงสุด ที่ได้รับอนุญาต ของ {0} MB
apps/frappe/frappe/core/doctype/doctype/doctype.py +390,Enter at least one permission row,เข้า แถว รับอนุญาต อย่างน้อยหนึ่ง
apps/frappe/frappe/public/js/frappe/model/model.js +20,Created On,สร้างเมื่อ
DocType: Workflow State,align-center,จัดศูนย์
apps/frappe/frappe/public/js/frappe/form/set_sharing.html +6,Can Write,สามารถเขียน
apps/frappe/frappe/core/page/permission_manager/permission_manager_help.html +16,"Certain documents, like an Invoice, should not be changed once final. The final state for such documents is called Submitted. You can restrict which roles can Submit.",เอกสาร บางอย่างเช่น ใบแจ้งหนี้ไม่ควร มีการเปลี่ยนแปลง ครั้ง สุดท้าย รัฐ สุดท้าย สำหรับเอกสาร ดังกล่าวเรียกว่า ส่ง คุณสามารถ จำกัด บทบาท ซึ่ง สามารถ ส่ง
apps/frappe/frappe/public/js/frappe/views/reports/query_report.js +612,You are not allowed to export this report,คุณยังไม่ได้ รับอนุญาต ในการส่งออก รายงานฉบับนี้
DocType: Communication,Sender,ผู้ส่ง
DocType: Web Page,Description for search engine optimization.,รายละเอียดสำหรับการเพิ่มประสิทธิภาพเครื่องมือค้นหา
apps/frappe/frappe/core/page/data_import_tool/data_import_main.html +21,Download Blank Template,ดาวน์โหลดแม่แบบที่ว่างเปล่า
apps/frappe/frappe/core/doctype/file/file_list.js +95,Copy,คัดลอก
apps/frappe/frappe/core/doctype/file/test_file.py +74,Home/Test Folder 1/Test Folder 3,หน้าแรก / โฟลเดอร์ทดสอบ 1 / โฟลเดอร์ทดสอบ 3
DocType: Website Settings,&lt;head&gt; HTML,&lt;head&gt; HTML
apps/frappe/frappe/public/js/frappe/views/calendar.js +88,Select or drag across time slots to create a new event.,เลือกหรือลากผ่านช่วงเวลาที่จะสร้างเหตุการณ์ใหม่
DocType: DocField,In Filter,กรอง
DocType: Website Theme,Footer Color,ท้ายกระดาษสี
DocType: Web Page,"Page to show on the website
",หน้าจะแสดงบนเว็บไซต์
apps/frappe/frappe/public/js/frappe/request.js +71,You have been logged out,คุณได้รับการออกจากระบบ
apps/frappe/frappe/core/page/user_permissions/user_permissions.py +58,Cannot remove permission for DocType: {0} and Name: {1},ไม่สามารถลบ สิทธิ์สำหรับ DocType : {0} และ ชื่อ: {1}
apps/frappe/frappe/public/js/frappe/ui/editor.html +51,Remove Link,เอาการเชื่อมโยง
apps/frappe/frappe/desk/page/activity/activity_row.html +11,Logged in,เข้าสู่ระบบ
apps/frappe/frappe/email/doctype/email_account/email_account_list.js +6,Default Sending and Inbox,เริ่มต้นการส่งและกล่องขาเข้า
DocType: Print Settings,Letter,จดหมาย
DocType: Async Task,Succeeded,ประสบความสำเร็จ
apps/frappe/frappe/public/js/frappe/form/save.js +137,Mandatory fields required in {0},เขตข้อมูล ที่จำเป็นในการ บังคับ {0}
apps/frappe/frappe/core/page/permission_manager/permission_manager.js +95,Reset Permissions for {0}?,ตั้งค่า สิทธิ์สำหรับ {0}?
apps/frappe/frappe/permissions.py +326,{0} {1} not found,{0} {1} ไม่พบ
apps/frappe/frappe/custom/doctype/customize_form/customize_form.js +215,Show a description below the field,แสดงข้อมูลรายละเอียดด้านล่าง
DocType: Workflow State,align-left,จัดซ้าย
DocType: User,Defaults,เริ่มต้น
apps/frappe/frappe/public/js/frappe/model/model.js +489,Merge with existing,ผสานกับที่มีอยู่
DocType: User,Birth Date,วันเกิด
DocType: Workflow State,fast-backward,ย้อนกลับอย่างรวดเร็ว
DocType: DocShare,DocShare,DocShare
DocType: Report,Add Total Row,เพิ่มแถวผลรวม
apps/frappe/frappe/core/page/permission_manager/permission_manager_help.html +19,For example if you cancel and amend INV004 it will become a new document INV004-1. This helps you to keep track of each amendment.,ตัวอย่างเช่นถ้าคุณยกเลิกและแก้ไข INV004 มันจะกลายเป็นเอกสารใหม่ INV004-1 นี้จะช่วยให้คุณสามารถติดตามของแต่ละการแก้ไข
DocType: Workflow Document State,0 - Draft; 1 - Submitted; 2 - Cancelled,0 - ร่าง; 1 - ส่ง; 2 - ยกเลิก
apps/frappe/frappe/core/page/modules_setup/modules_setup.js +5,Show or Hide Modules,การแสดงหรือซ่อนโมดูล
DocType: File,Attached To DocType,แนบกับ DocType แล้ว
apps/frappe/frappe/desk/page/activity/activity.js +153,Aug,สิงหาคม
DocType: DocField,Int,int
DocType: Currency,"1 Currency = [?] Fraction
For e.g. 1 USD = 100 Cent","1 สกุลเงิน = [?] ส่วน
ตัวอย่างเช่น 1 USD = 100 Cent."
apps/frappe/frappe/core/page/permission_manager/permission_manager.js +370,Add New Permission Rule,เพิ่มกฎการอนุญาตใหม่
apps/frappe/frappe/public/js/frappe/form/link_selector.js +25,You can use wildcard %,คุณสามารถใช้สัญลักษณ์แทน%
apps/frappe/frappe/desk/page/activity/activity.js +152,Mar,มี.ค.
apps/frappe/frappe/public/js/frappe/upload.js +127,"Only image extensions (.gif, .jpg, .jpeg, .tiff, .png, .svg) allowed","เฉพาะส่วนขยายของภาพ (.gif, .jpg, .jpeg, .tiff, .png, SVG) ผู้ที่ได้รับอนุญาต"
DocType: Customize Form,"Fields separated by comma (,) will be included in the ""Search By"" list of Search dialog box","ทุ่งคั่นด้วยเครื่องหมายจุลภาค (,) จะรวมอยู่ใน &quot;ค้นหาโดย&quot; รายการการค้นหากล่องโต้ตอบ"
apps/frappe/frappe/website/doctype/website_theme/website_theme.py +35,Please Duplicate this Website Theme to customize.,กรุณาซ้ำธีมเว็บไซต์นี้เพื่อปรับแต่ง
DocType: DocField,Text Editor,แก้ไขข้อความ
apps/frappe/frappe/config/website.py +69,Settings for About Us Page.,การตั้งค่าสำหรับหน้าเกี่ยวกับเรา
apps/frappe/frappe/print/page/print_format_builder/print_format_builder.js +538,Edit Custom HTML,แก้ไข HTML ที่กำหนดเอง
apps/frappe/frappe/public/js/frappe/ui/filters/edit_filter.html +8,In,ใน
DocType: Email Alert,Value Change,ค่าเปลี่ยน
DocType: Standard Reply,Standard Reply,ตอบดูมาตรฐาน
apps/frappe/frappe/custom/doctype/customize_form/customize_form.js +176,Width of the input box,ความกว้างของกล่องใส่
DocType: UserRole,UserRole,UserRole
DocType: Print Settings,With Letterhead,ด้วยจดหมาย
apps/frappe/frappe/email/smtp.py +173,Invalid Outgoing Mail Server or Port,เซิร์ฟเวอร์ อีเมลขาออก ที่ไม่ถูกต้อง หรือ พอร์ต
DocType: DocPerm,Write,เขียน
apps/frappe/frappe/core/doctype/report/report.py +29,Only Administrator allowed to create Query / Script Reports,เฉพาะผู้ดูแลระบบอนุญาตให้สร้างรายงานคำ / Script
apps/frappe/frappe/public/js/frappe/form/save.js +13,Updating,อัปเดต
DocType: File,Preview,แสดงตัวอย่าง
DocType: Customize Form,Use this fieldname to generate title,ใช้ fieldname นี้เพื่อสร้างชื่อ
apps/frappe/frappe/public/js/frappe/views/communication.js +85,Select Attachments,เลือกสิ่งที่แนบ
apps/frappe/frappe/model/naming.py +90, for {0},สำหรับ {0}
apps/frappe/frappe/public/js/legacy/print_format.js +125,You are not allowed to print this document,คุณยังไม่ได้ รับอนุญาตให้ พิมพ์เอกสาร นี้
apps/frappe/frappe/public/js/frappe/views/reports/grid_report.js +286,Loading Report,โหลดรายงาน
apps/frappe/frappe/public/js/frappe/form/form_sidebar.html +26,Attach File,แนบไฟล์
apps/frappe/frappe/templates/emails/password_update.html +1,Password Update Notification,รหัสผ่านปรับปรุงการแจ้งเตือน
apps/frappe/frappe/public/js/frappe/form/footer/assign_to.js +62,Assignment Complete,ที่ได้รับมอบหมายให้เสร็จสมบูรณ์
DocType: DocPerm,User Permission DocTypes,ผู้ใช้สิทธิ์ doctypes
apps/frappe/frappe/public/js/frappe/model/model.js +488,New Name,ชื่อใหม่
apps/frappe/frappe/public/js/frappe/form/footer/assign_to.js +136,Please save the document before removing assignment,กรุณาบันทึกเอกสารก่อนที่จะลบที่ได้รับมอบหมาย
apps/frappe/frappe/public/js/frappe/form/grid_form.html +10,Insert Above,แทรกเหนือ
apps/frappe/frappe/public/js/frappe/model/indicator.js +5,Not Saved,ที่บันทึกไว้ไม่ได้
DocType: Custom Field,Default Value,ค่าเริ่มต้น
apps/frappe/frappe/public/js/frappe/ui/messages.js +157,Verify,ตรวจสอบ
DocType: Workflow Document State,Update Field,ปรับปรุงเขต
apps/frappe/frappe/email/doctype/email_account/email_account.py +300,Leave this conversation,ออกจากการสนทนานี้
apps/frappe/frappe/model/base_document.py +393,Options not set for link field {0},ไม่ได้ตั้งค่า ตัวเลือก สำหรับฟิลด์ ลิงค์ {0}
apps/frappe/frappe/custom/doctype/customize_form/customize_form.py +149,You cannot unset 'Read Only' for field {0},คุณไม่สามารถล้าง &#39;อ่านอย่างเดียว&#39; สำหรับเขตข้อมูล {0}
DocType: Workflow State,asterisk,เครื่องหมายดอกจัน
apps/frappe/frappe/core/page/data_import_tool/exporter.py +61,Please do not change the template headings.,กรุณาอย่าเปลี่ยนหัวแม่แบบ
DocType: Communication,Linked,ที่เชื่อมโยง
apps/frappe/frappe/public/js/frappe/form/save.js +84,Enter the name of the new {0},ป้อนชื่อของใหม่ {0}
apps/frappe/frappe/config/desk.py +39,Activity log of all users.,บันทึกกิจกรรมของผู้ใช้ทั้งหมด
DocType: Workflow State,shopping-cart,ช้อปปิ้งรถเข็น
DocType: Social Login Keys,Google,Google
DocType: Workflow State,Inverse,ผกผัน
DocType: DocField,User permissions should not apply for this Link,สิทธิ์ผู้ใช้ ไม่ควร ใช้สำหรับ การเชื่อมโยง นี้
apps/frappe/frappe/model/naming.py +90,Invalid naming series (. missing),ชุดการตั้งชื่อไม่ถูกต้อง (. หายไป)
DocType: System Settings,Language,ภาษา
DocType: DocPerm,Cancel,ยกเลิก
DocType: Web Page,Page content,เนื้อหาของหน้า
apps/frappe/frappe/core/doctype/file/file.py +116,File {0} does not exist,ไฟล์ {0} ไม่อยู่
apps/frappe/frappe/core/page/data_import_tool/exporter.py +91,Leave blank for new records,เว้นว่างไว้สำหรับบันทึกใหม่
apps/frappe/frappe/config/website.py +79,List of themes for Website.,รายชื่อของรูปแบบสำหรับเว็บไซต์
apps/frappe/frappe/public/js/frappe/ui/toolbar/navbar.html +44,Logout,ออกจากระบบ
apps/frappe/frappe/core/page/permission_manager/permission_manager_help.html +26,Permissions at higher levels are Field Level permissions. All Fields have a Permission Level set against them and the rules defined at that permissions apply to the field. This is useful in case you want to hide or make certain field read-only for certain Roles.,สิทธิ์ในระดับที่สูงมีสิทธิ์ในระดับเขต ฟิลด์ทั้งหมดมีชุดการระดับสิทธิ์กับพวกเขาและกฎระเบียบที่กำหนดไว้ว่าสิทธิ์นำไปใช้กับข้อมูล นี้จะเป็นประโยชน์ในกรณีที่คุณต้องการที่จะซ่อนหรือทำให้ข้อมูลบางอย่างอ่านอย่างเดียวสำหรับบทบาทบางอย่าง
apps/frappe/frappe/core/page/permission_manager/permission_manager_help.html +38,"If these instructions where not helpful, please add in your suggestions on GitHub Issues.",ถ้า คำแนะนำเหล่านี้ ที่ ไม่เป็นประโยชน์ โปรดเพิ่ม ใน คำแนะนำของคุณ เกี่ยวกับ GitHub ปัญหา
DocType: Workflow State,bookmark,ที่คั่นหนังสือ
apps/frappe/frappe/email/bulk.py +96,This email was sent to you as CC,อีเมลนี้จะถูกส่งไปให้คุณเป็น CC
DocType: Currency,Symbol,สัญญลักษณ์
apps/frappe/frappe/model/base_document.py +434,Row #{0}:,แถว # {0}:
apps/frappe/frappe/core/doctype/user/user.py +81,New password emailed,ส่ง รหัสผ่านใหม่
apps/frappe/frappe/auth.py +222,Login not allowed at this time,เข้าสู่ระบบ ไม่ได้รับอนุญาต ในเวลานี้
DocType: Async Task,Runtime,Runtime
DocType: DocType,Permissions Settings,การตั้งค่าสิทธิ์
apps/frappe/frappe/public/js/frappe/ui/toolbar/awesome_bar.js +207,{0} List,{0} รายชื่อ
apps/frappe/frappe/desk/form/assign_to.py +39,Already in user's To Do list,อยู่ในรายการสิ่งที่ต้องทำของผู้ใช้แล้ว
DocType: Email Account,Enable Outgoing,เปิดใช้งานขาออก
DocType: System Settings,Email Footer Address,ที่อยู่อีเมล์ท้าย
DocType: DocField,Text,ข้อความ
apps/frappe/frappe/config/setup.py +125,Standard replies to common queries.,มาตรฐานตอบแบบสอบถามที่พบบ่อย
apps/frappe/frappe/public/js/frappe/ui/toolbar/offcanvas_left_sidebar.html +31,Report an Issue,รายงาน ฉบับ
apps/frappe/frappe/email/doctype/email_account/email_account_list.js +14,Default Sending,เริ่มต้นส่ง
DocType: Workflow State,volume-off,ปริมาณออก
DocType: Custom Field,Properties,สรรพคุณ
apps/frappe/frappe/core/doctype/file/test_file.py +43,Home/Test Folder 1,หน้าแรก / โฟลเดอร์ทดสอบ 1
apps/frappe/frappe/core/page/data_import_tool/data_import_main.html +47,"Do not update, but insert new records.",ไม่อัปเดต แต่แทรกระเบียนใหม่
apps/frappe/frappe/public/js/frappe/form/footer/assign_to.js +160,Assign to me,กำหนดให้ฉัน
apps/frappe/frappe/core/doctype/file/file_list.js +74,Edit Folder,แก้ไขโฟลเดอร์
DocType: DocField,Dynamic Link,การเชื่อมโยงแบบไดนามิก
DocType: Property Setter,DocType or Field,DocType หรือสาขา
DocType: Communication,Soft-Bounced,นุ่มเด้ง
apps/frappe/frappe/core/page/permission_manager/permission_manager_help.html +3,Quick Help for Setting Permissions,ความช่วยเหลือด่วนสำหรับการตั้งค่าสิทธิ์
DocType: Report,Report Builder,สร้างรายงาน
DocType: Async Task,Task Name,ชื่องาน
DocType: Workflow,Workflow,เวิร์กโฟลว์
DocType: Workflow State,Upload,อัปโหลด
DocType: System Settings,Date Format,รูปแบบวันที่
apps/frappe/frappe/website/doctype/blog_post/blog_post_list.js +7,Not Published,ไม่ได้เผยแพร่
apps/frappe/frappe/config/setup.py +168,"Actions for workflow (e.g. Approve, Cancel).","การดำเนินการสำหรับขั้นตอนการทำงานิ (เช่น อนุมัติ, ยกเลิก )"
DocType: Workflow State,flag,ธง
DocType: Web Page,Text Align,ข้อความตําแหน่ง
DocType: Contact Us Settings,Forward To Email Address,ไปข้างหน้า เพื่อ ที่อยู่อีเมล์
apps/frappe/frappe/core/doctype/doctype/doctype.py +332,Title field must be a valid fieldname,ฟิลด์ จะต้องfieldname ถูกต้อง
apps/frappe/frappe/templates/pages/me.html +19,Edit Profile,แก้ไขโปรไฟล์
DocType: System Settings,Session Expiry in Hours e.g. 06:00,หมดอายุในเซสชั่นชั่วโมงเช่น 06:00
