apps/frappe/frappe/templates/emails/password_update.html +1,Password Update Notification,รหัสผ่านปรับปรุงการแจ้งเตือน
apps/frappe/frappe/desk/page/backups/backups.html +13,Size,ขนาด
apps/frappe/frappe/public/js/frappe/form/footer/assign_to.js +58,Assignment Complete,ที่ได้รับมอบหมายให้เสร็จสมบูรณ์
DocType: DocPerm,User Permission DocTypes,ผู้ใช้สิทธิ์ doctypes
DocType: Desktop Icon,Idx,IDX
apps/frappe/frappe/public/js/frappe/model/model.js +481,New Name,ชื่อใหม่
apps/frappe/frappe/public/js/frappe/form/footer/assign_to.js +132,Please save the document before removing assignment,กรุณาบันทึกเอกสารก่อนที่จะลบที่ได้รับมอบหมาย
apps/frappe/frappe/public/js/frappe/form/templates/grid_form.html +10,Insert Above,แทรกเหนือ
apps/frappe/frappe/public/js/frappe/model/indicator.js +42,Draft,ร่าง
DocType: User,Female,หญิง
DocType: Print Settings,Modern,ทันสมัย
apps/frappe/frappe/desk/page/applications/applications.js +61,Search Results,ผลการค้นหา
apps/frappe/frappe/public/js/frappe/model/indicator.js +5,Not Saved,ที่บันทึกไว้ไม่ได้
DocType: Communication,Replied,Replied
DocType: Newsletter,Test,ทดสอบ
DocType: Custom Field,Default Value,ค่าเริ่มต้น
apps/frappe/frappe/public/js/frappe/ui/messages.js +213,Verify,ตรวจสอบ
DocType: Workflow Document State,Update Field,ปรับปรุงเขต
apps/frappe/frappe/desk/page/applications/applications.js +50,Regional Extensions,ส่วนขยายในภูมิภาค
apps/frappe/frappe/core/doctype/communication/email.py +135,Leave this conversation,ออกจากการสนทนานี้
apps/frappe/frappe/model/base_document.py +432,Options not set for link field {0},ไม่ได้ตั้งค่า ตัวเลือก สำหรับฟิลด์ ลิงค์ {0}
apps/frappe/frappe/custom/doctype/customize_form/customize_form.py +155,You cannot unset 'Read Only' for field {0},คุณไม่สามารถล้าง &#39;อ่านอย่างเดียว&#39; สำหรับเขตข้อมูล {0}
apps/frappe/frappe/desk/page/setup_wizard/setup_wizard_page.html +18,Complete Setup,การติดตั้ง เสร็จสมบูรณ์
DocType: Workflow State,asterisk,เครื่องหมายดอกจัน
apps/frappe/frappe/core/page/data_import_tool/exporter.py +61,Please do not change the template headings.,กรุณาอย่าเปลี่ยนหัวแม่แบบ
DocType: Communication,Linked,ลิงค์แล้ว
apps/frappe/frappe/public/js/frappe/form/save.js +84,Enter the name of the new {0},ป้อนชื่อของใหม่ {0}
apps/frappe/frappe/config/desk.py +44,Activity log of all users.,บันทึกกิจกรรมของผู้ใช้ทั้งหมด
DocType: Workflow State,shopping-cart,ช้อปปิ้งรถเข็น
DocType: Social Login Keys,Google,Google
DocType: Workflow State,Inverse,ผกผัน
DocType: DocField,User permissions should not apply for this Link,สิทธิ์ผู้ใช้ ไม่ควร ใช้สำหรับ การเชื่อมโยง นี้
apps/frappe/frappe/model/naming.py +95,Invalid naming series (. missing),ชุดการตั้งชื่อไม่ถูกต้อง (. หายไป)
DocType: System Settings,Language,ภาษา
DocType: DocPerm,Cancel,ยกเลิก
apps/frappe/frappe/public/js/frappe/views/reports/reportview.js +116,Add to Desktop,เพิ่มในสก์ท็อป
DocType: Web Page,Page content,เนื้อหาของหน้า
apps/frappe/frappe/core/doctype/file/file.py +117,File {0} does not exist,ไฟล์ {0} ไม่อยู่
apps/frappe/frappe/core/page/data_import_tool/exporter.py +91,Leave blank for new records,เว้นว่างไว้สำหรับบันทึกใหม่
apps/frappe/frappe/config/website.py +59,List of themes for Website.,รายชื่อของรูปแบบสำหรับเว็บไซต์
apps/frappe/frappe/public/js/frappe/ui/toolbar/navbar.html +44,Logout,ออกจากระบบ
apps/frappe/frappe/core/page/permission_manager/permission_manager_help.html +26,Permissions at higher levels are Field Level permissions. All Fields have a Permission Level set against them and the rules defined at that permissions apply to the field. This is useful in case you want to hide or make certain field read-only for certain Roles.,สิทธิ์ในระดับที่สูงมีสิทธิ์ในระดับเขต ฟิลด์ทั้งหมดมีชุดการระดับสิทธิ์กับพวกเขาและกฎระเบียบที่กำหนดไว้ว่าสิทธิ์นำไปใช้กับข้อมูล นี้จะเป็นประโยชน์ในกรณีที่คุณต้องการที่จะซ่อนหรือทำให้ข้อมูลบางอย่างอ่านอย่างเดียวสำหรับบทบาทบางอย่าง
apps/frappe/frappe/core/page/permission_manager/permission_manager_help.html +38,"If these instructions where not helpful, please add in your suggestions on GitHub Issues.",ถ้า คำแนะนำเหล่านี้ ที่ ไม่เป็นประโยชน์ โปรดเพิ่ม ใน คำแนะนำของคุณ เกี่ยวกับ GitHub ปัญหา
DocType: Workflow State,bookmark,คั่น
DocType: Note,Note,หมายเหตุ
apps/frappe/frappe/public/html/error_snapshot.html +32,Error Report,รายงานข้อผิดพลาด
apps/frappe/frappe/email/queue.py +100,This email was sent to you as CC,อีเมลนี้จะถูกส่งไปให้คุณเป็น CC
apps/frappe/frappe/core/doctype/doctype/doctype.py +437,Timeline field must be a valid fieldname,ข้อมูล Timeline จะต้องเป็น fieldname ที่ถูกต้อง
DocType: Email Account,Email Ids,อีเมล์หมายเลข
DocType: Currency,Symbol,สัญญลักษณ์
apps/frappe/frappe/model/base_document.py +478,Row #{0}:,แถว # {0}:
apps/frappe/frappe/core/doctype/user/user.py +111,New password emailed,ส่ง รหัสผ่านใหม่
apps/frappe/frappe/auth.py +233,Login not allowed at this time,เข้าสู่ระบบ ไม่ได้รับอนุญาต ในเวลานี้
DocType: Async Task,Runtime,Runtime
DocType: Contact Us Settings,Introduction,การแนะนำ
DocType: DocType,Permissions Settings,การตั้งค่าสิทธิ์
apps/frappe/frappe/public/js/frappe/ui/toolbar/awesome_bar.js +238,{0} List,{0} รายชื่อ
apps/frappe/frappe/desk/form/assign_to.py +41,Already in user's To Do list,อยู่ในรายการสิ่งที่ต้องทำของผู้ใช้แล้ว
DocType: Email Account,Enable Outgoing,เปิดใช้งานขาออก
apps/frappe/frappe/desk/page/applications/applications.js +147,No matching apps found,ไม่พบปพลิเคชันที่ตรงกัน
DocType: Communication,Submitted,Submitted
DocType: System Settings,Email Footer Address,ที่อยู่อีเมล์ท้าย
DocType: Communication,Timeline DocType,DocType Timeline
DocType: DocField,Text,ข้อความ
apps/frappe/frappe/config/setup.py +145,Standard replies to common queries.,มาตรฐานตอบแบบสอบถามที่พบบ่อย
apps/frappe/frappe/public/js/frappe/ui/toolbar/navbar.html +41,Report an Issue,รายงาน ฉบับ
apps/frappe/frappe/email/doctype/email_account/email_account_list.js +14,Default Sending,เริ่มต้นส่ง
DocType: Workflow State,volume-off,ปริมาณออก
apps/frappe/frappe/public/js/frappe/form/footer/timeline_item.html +114,Liked by {0},ชอบ {0}
,Download Backups,ดาวน์โหลดสำรอง
apps/frappe/frappe/core/doctype/file/test_file.py +43,Home/Test Folder 1,หน้าแรก / โฟลเดอร์ทดสอบ 1
apps/frappe/frappe/core/page/data_import_tool/data_import_main.html +47,"Do not update, but insert new records.",ไม่อัปเดต แต่แทรกระเบียนใหม่
apps/frappe/frappe/public/js/frappe/form/footer/assign_to.js +156,Assign to me,กำหนดให้ฉัน
apps/frappe/frappe/core/doctype/file/file_list.js +81,Edit Folder,แก้ไขโฟลเดอร์
DocType: DocField,Dynamic Link,การเชื่อมโยงแบบไดนามิก
apps/frappe/frappe/public/js/frappe/form/footer/timeline_item.html +57,Details,รายละเอียด
DocType: Property Setter,DocType or Field,DocType หรือสาขา
DocType: Communication,Soft-Bounced,นุ่มเด้ง
apps/frappe/frappe/core/page/permission_manager/permission_manager_help.html +3,Quick Help for Setting Permissions,ความช่วยเหลือด่วนสำหรับการตั้งค่าสิทธิ์
apps/frappe/frappe/core/doctype/error_snapshot/error_snapshot.js +9,Show Relapses,แสดงอาการกำเริบ
DocType: Report,Report Builder,สร้างรายงาน
DocType: Async Task,Task Name,ชื่องาน
DocType: Communication,Workflow,เวิร์กโฟลว์
DocType: Workflow State,Upload,อัปโหลด
DocType: System Settings,Date Format,รูปแบบวันที่
apps/frappe/frappe/website/doctype/blog_post/blog_post_list.js +7,Not Published,ไม่ได้เผยแพร่
apps/frappe/frappe/config/setup.py +203,"Actions for workflow (e.g. Approve, Cancel).","การดำเนินการสำหรับขั้นตอนการทำงานิ (เช่น อนุมัติ, ยกเลิก )"
DocType: Workflow State,flag,ธง
DocType: Web Page,Text Align,ข้อความตําแหน่ง
apps/frappe/frappe/model/naming.py +176,Name cannot contain special characters like {0},ชื่อไม่สามารถมีตัวอักษรพิเศษเช่น {0}
DocType: Contact Us Settings,Forward To Email Address,ไปข้างหน้า เพื่อ ที่อยู่อีเมล์
apps/frappe/frappe/core/doctype/doctype/doctype.py +398,Title field must be a valid fieldname,ฟิลด์ จะต้องfieldname ถูกต้อง
apps/frappe/frappe/config/core.py +7,Documents,เอกสาร
apps/frappe/frappe/www/me.html +22,Edit Profile,แก้ไขโปรไฟล์
DocType: System Settings,Session Expiry in Hours e.g. 06:00,หมดอายุในเซสชั่นชั่วโมงเช่น 06:00
DocType: Customize Form Field,"This field will appear only if the fieldname defined here has value OR the rules are true (examples): 
myfield
eval:doc.myfield=='My Value'
eval:doc.age&gt;18",ฟิลด์นี้จะปรากฏเฉพาะถ้า fieldname ที่กำหนดไว้ที่นี่มีค่าหรือกฎระเบียบที่เป็นจริง (ตัวอย่าง): myfield EVAL: doc.myfield == &#39;ค่าของฉัน&#39; EVAL: doc.age&gt; 18
apps/frappe/frappe/core/page/permission_manager/permission_manager_help.html +35,"Once you have set this, the users will only be able access documents (eg. Blog Post) where the link exists (eg. Blogger).",เมื่อคุณได้ตั้ง นี้ผู้ใช้ จะมีเพียง เอกสาร การเข้าถึง สามารถ ( เช่น โพสต์ บล็อก ) ที่ การเชื่อมโยง ที่มีอยู่ (เช่น Blogger )
DocType: Scheduler Log,Log of Scheduler Errors,เข้าสู่ระบบของข้อผิดพลาดจัดตารางเวลา
DocType: User,Bio,ไบโอ
apps/frappe/frappe/public/js/frappe/form/save.js +12,Submitting,ส่ง
apps/frappe/frappe/desk/page/activity/activity.js +75,Show Likes,แสดงที่ชอบ
apps/frappe/frappe/print/page/print_format_builder/print_format_builder.js +182,Custom HTML,ที่กำหนดเอง HTML
apps/frappe/frappe/core/doctype/file/file_list.js +78,Enter folder name,ป้อนชื่อโฟลเดอร์
apps/frappe/frappe/core/page/permission_manager/permission_manager.js +54,Select Role,เลือกบทบาท
DocType: Communication,Deleted,ที่ถูกลบ
DocType: Workflow State,adjust,ปรับ
DocType: Website Settings,Disable Customer Signup link in Login page,ปิดการใช้งานของลูกค้าที่ลิงค์สมัครสมาชิกในหน้าเข้าสู่ระบบ
apps/frappe/frappe/core/report/todo/todo.py +20,Assigned To/Owner,มอบหมายให้ / เจ้าของ
DocType: Workflow State,arrow-left,ลูกศรซ้าย
apps/frappe/frappe/desk/page/applications/applications.js +77,Installed,การติดตั้ง
apps/frappe/frappe/desk/page/applications/applications.js +47,Developer Tools,เครื่องมือสำหรับนักพัฒนา
DocType: Workflow State,fullscreen,เต็มจอ
apps/frappe/frappe/public/js/frappe/views/reports/query_report.js +175,You are not allowed to make PDF for this report,คุณยังไม่ได้รับอนุญาตให้ PDF สำหรับรายงานนี้
DocType: Event,Ref Name,ชื่อ Ref
DocType: Web Page,Center,ศูนย์
apps/frappe/frappe/core/doctype/error_snapshot/error_snapshot_list.js +11,First Level,ระดับแรก
DocType: Workflow Document State,Represents the states allowed in one document and role assigned to change the state.,ที่เป็นตัวแทนของรัฐที่ได้รับอนุญาตในเอกสารและบทบาทที่ได้รับมอบหมายในการเปลี่ยนสถานะ
apps/frappe/frappe/custom/doctype/customize_form/customize_form.js +67,Refresh Form,แบบฟอร์มรีเฟรช
DocType: DocField,Select,เลือก
apps/frappe/frappe/utils/csvutils.py +25,File not attached,ไฟล์ ที่แนบมา ไม่ได้
DocType: Top Bar Item,"If you set this, this Item will come in a drop-down under the selected parent.",ถ้าคุณตั้งค่า นี้ รายการ นี้ จะมาในแบบเลื่อนลง ภายใต้การ ปกครอง ที่เลือก
apps/frappe/frappe/model/db_query.py +474,Please select atleast 1 column from {0} to sort,กรุณาเลือก atleast 1 คอลัมน์ จาก {0} การจัดเรียง
apps/frappe/frappe/www/print.py +198,No template found at path: {0},พบได้ที่เส้นทางแม่ไม่มี: {0}
apps/frappe/frappe/core/page/data_import_tool/data_import_main.html +53,Submit after importing.,ส่งหลังจากการนำเข้า
DocType: Communication,Cancelled,ยกเลิก
DocType: Blogger,Avatar,รูปส่วนตัว
DocType: Blogger,Posts,กระทู้
apps/frappe/frappe/core/doctype/doctype/doctype.py +255,"DocType's name should start with a letter and it can only consist of letters, numbers, spaces and underscores",ชื่อ DocType ควรเริ่มต้นด้วยตัวอักษรและมันอาจประกอบด้วยตัวอักษรตัวเลขและขีดช่องว่าง
apps/frappe/frappe/public/js/frappe/views/communication.js +444,Dear,น่ารัก
apps/frappe/frappe/public/js/frappe/views/reports/reportview.js +57,Tip: Double click cell to edit,เคล็ดลับ: เซลล์ดับเบิลคลิกเพื่อแก้ไข
DocType: Web Page,HTML for header section. Optional,HTML สำหรับ ส่วนหัว ไม่จำเป็น
apps/frappe/frappe/model/rename_doc.py +337,Maximum {0} rows allowed,สูงสุด {0} แถว รับอนุญาต
DocType: Email Unsubscribe,Global Unsubscribe,ยกเลิกทั่วโลก
apps/frappe/frappe/core/doctype/communication/communication.js +8,View,ดู
DocType: Communication,Assigned,ที่ได้รับมอบหมาย
apps/frappe/frappe/public/js/frappe/views/communication.js +76,Select Print Format,เลือกรูปแบบพิมพ์
DocType: DocField,Print Hide,พิมพ์ซ่อน
apps/frappe/frappe/public/js/frappe/ui/messages.js +62,Enter Value,ใส่ ความคุ้มค่า
DocType: Workflow State,tint,สี
DocType: Workflow State,Style,สไตล์
apps/frappe/frappe/custom/doctype/custom_field/custom_field.js +55,e.g.:,เช่น:
apps/frappe/frappe/website/doctype/blog_post/blog_post.py +85,{0} comments,{0} ความคิดเห็น
apps/frappe/frappe/desk/page/applications/applications.js +44,Select Category...,เลือกประเภท...
DocType: Customize Form Field,Label and Type,ฉลาก และ ประเภท
DocType: Workflow State,forward,ข้างหน้า
apps/frappe/frappe/public/js/frappe/form/sidebar.js +58,{0} edited this {1},{0} ได้แก้ไข {1} นี้
DocType: Web Page,Custom Javascript,ที่กำหนดเอง Javascript
DocType: DocPerm,Submit,เสนอ
apps/frappe/frappe/core/doctype/file/file_list.js +63,New Folder,แฟ้มใหม่
DocType: Website Settings,Sub-domain provided by erpnext.com,โดเมนย่อยโดย erpnext.com
DocType: System Settings,dd-mm-yyyy,dd-mm-yyyy
apps/frappe/frappe/desk/query_report.py +70,Must have report permission to access this report.,ต้องได้รับอนุญาตรายงานการเข้าถึงรายงานนี้
apps/frappe/frappe/email/doctype/newsletter/newsletter.py +107,{0} has been successfully unsubscribed from this list.,{0} ได้รับการยกเลิกการสมัครที่ประสบความสำเร็จจากรายการนี้
apps/frappe/frappe/public/js/frappe/desk.js +456,Added,ที่เพิ่ม
apps/frappe/frappe/desk/doctype/event/event.py +62,Daily Event Digest is sent for Calendar Events where reminders are set.,ประจำวันเหตุการณ์สำคัญจะถูกส่งสำหรับปฏิทินเหตุการณ์การแจ้งเตือนที่มีการตั้งค่า
apps/frappe/frappe/public/js/frappe/ui/toolbar/navbar.html +32,View Website,ดูเว็บไซต์
DocType: Workflow State,remove,เอาออก
DocType: Email Account,If non standard port (e.g. 587),ถ้าพอร์ตมาตรฐานไม่ (เช่น 587)
apps/frappe/frappe/public/js/frappe/form/toolbar.js +149,Reload,โหลด
apps/frappe/frappe/core/page/usage_info/usage_info.html +103,Total,ทั้งหมด
DocType: Event,Participants,เข้าร่วม
DocType: Email Queue,Reference DocName,DocName อ้างอิง
DocType: Web Form,Success Message,ข้อความที่ประสบความสำเร็จ
DocType: DocType,User Cannot Search,ผู้ใช้ไม่สามารถค้นหา
DocType: DocPerm,Apply this rule if the User is the Owner,ใช้กฎนี้ถ้าผู้ใช้เป็นเจ้าของ
apps/frappe/frappe/desk/page/activity/activity.js +70,Build Report,สร้าง รายงาน
apps/frappe/frappe/model/rename_doc.py +96,"{0} {1} does not exist, select a new target to merge",{0} {1} ไม่อยู่ เลือกเป้าหมายใหม่ ในการผสาน
apps/frappe/frappe/core/page/user_permissions/user_permissions.py +66,Cannot set permission for DocType: {0} and Name: {1},ไม่สามารถตั้งค่า อนุญาตให้ DocType : {0} และ ชื่อ: {1}
apps/frappe/frappe/public/js/frappe/form/footer/assign_to.js +154,Add to To Do,เพิ่มสิ่งที่ต้องทำ
DocType: Footer Item,Company,บริษัท
apps/frappe/frappe/public/js/frappe/list/list_sidebar.html +20,Assigned To Me,มอบหมายให้ฉัน
apps/frappe/frappe/public/js/frappe/ui/messages.js +213,Verify Password,ยืนยันรหัสผ่าน
apps/frappe/frappe/public/js/frappe/form/footer/attachments.js +138,There were errors,มีข้อผิดพลาด ได้
apps/frappe/frappe/core/doctype/communication/communication.js +19,Close,ปิด
apps/frappe/frappe/model/document.py +536,Cannot change docstatus from 0 to 2,ไม่สามารถเปลี่ยน docstatus 0-2
apps/frappe/frappe/custom/doctype/customize_form/customize_form.js +110,Update,อัพเดท
DocType: Error Snapshot,Snapshot View,ดูภาพรวม
apps/frappe/frappe/email/doctype/newsletter/newsletter.py +78,Please save the Newsletter before sending,กรุณาบันทึก ข่าวก่อนที่จะส่ง
apps/frappe/frappe/core/doctype/doctype/doctype.py +300,Options must be a valid DocType for field {0} in row {1},ตัวเลือก จะต้องเป็น DocType ที่ถูกต้องสำหรับ เขตข้อมูล {0} ในแถว {1}
apps/frappe/frappe/print/page/print_format_builder/print_format_builder.js +160,Edit Properties,แก้ไขคุณสมบัติ
DocType: Patch Log,List of patches executed,รายชื่อของแพทช์ดำเนินการ
apps/frappe/frappe/email/doctype/email_unsubscribe/email_unsubscribe.py +21,{0} already unsubscribed,{0} ได้ยกเลิกการเป็นสมาชิกแล้ว
apps/frappe/frappe/public/js/frappe/views/communication.js +68,Communication Medium,กลางการสื่อสาร
DocType: Website Settings,Banner HTML,แบนเนอร์ HTML
DocType: Error Snapshot,Pyver,Pyver
apps/frappe/frappe/model/base_document.py +482,"{0} {1} cannot be ""{2}"". It should be one of ""{3}""","{0} {1} ไม่สามารถเป็น ""{2}"" มันควรจะเป็นอย่างใดอย่างหนึ่งของ ""{3}"""
apps/frappe/frappe/utils/data.py +522,{0} or {1},{0} หรือ {1}
apps/frappe/frappe/core/page/modules_setup/modules_setup.js +4,Show or Hide Desktop Icons,แสดงหรือซ่อนไอคอนสก์ท็อป
apps/frappe/frappe/core/doctype/user/user.py +199,Password Update,รหัสผ่านปรับปรุง
DocType: Workflow State,trash,ถังขยะ
DocType: Web Form,"In JSON as [{""title"":""Jobs"", ""name"":""jobs""}]","ใน JSON เป็น [{&quot;ชื่อ&quot;: &quot;งาน&quot;, &quot;ชื่อ&quot;: &quot;งาน&quot;}]"
DocType: Event,Leave blank to repeat always,ปล่อยว่าง ที่จะทำซ้ำ เสมอ
apps/frappe/frappe/email/doctype/newsletter/newsletter.py +166,Confirmed,ได้รับการยืนยัน
DocType: Event,Ends on,สิ้นสุด
DocType: Website Settings,"Added HTML in the &lt;head&gt; section of the web page, primarily used for website verification and SEO",เพิ่ม HTML ในส่วน &lt;head&gt; ของหน้าเว็บส่วนใหญ่ใช้สำหรับการตรวจสอบเว็บไซต์และ SEO
apps/frappe/frappe/core/doctype/error_snapshot/error_snapshot_list.js +9,Relapsed,อาการกำเริบ
apps/frappe/frappe/utils/nestedset.py +181,Item cannot be added to its own descendents,รายการที่ ไม่สามารถเพิ่ม ไปยัง ลูกหลาน ของตัวเอง
DocType: Error Snapshot,Relapses,อาการกำเริบ
apps/frappe/frappe/public/js/frappe/form/sidebar.js +61,{0} created this {1},{0} ได้สร้าง {1} นี้
apps/frappe/frappe/public/js/frappe/form/workflow.js +36,Document is only editable by users of role,เอกสารเป็นเพียงแก้ไขได้โดยผู้ใช้ของบทบาท
apps/frappe/frappe/desk/form/assign_to.py +146,"The task {0}, that you assigned to {1}, has been closed by {2}.",งาน {0} ที่คุณได้รับมอบหมายให้ {1} ได้รับการปิดโดย {2}
DocType: Blogger,Short Name,ชื่อสั้น
DocType: Workflow State,magnet,แม่เหล็ก
