DocType: Data Import,If you don't want to create any new records while updating the older records.,หากคุณไม่ต้องการสร้างระเบียนใหม่ในขณะที่อัปเดตระเบียนที่เก่ากว่า
apps/frappe/frappe/core/doctype/data_import/exporter.py +272,Info:,ข้อมูล:
DocType: Custom Field,Permission Level,ระดับของสิทธิ์
DocType: User,Send Notifications for Transactions I Follow,ส่งการแจ้งเตือนสำหรับรายการที่ฉันติดตาม
apps/frappe/frappe/core/doctype/doctype/doctype.py +806,"{0}: Cannot set Submit, Cancel, Amend without Write",{0} : ไม่สามารถตั้งค่า การส่ง การยกเลิก และ การแก้ไข ได้โดยไม่ได้ เขียน
DocType: Google Maps Settings,Client Key,คีย์ไคลเอ็นต์
apps/frappe/frappe/public/js/frappe/form/footer/attachments.js +78,Are you sure you want to delete the attachment?,คุณแน่ใจหรือว่าต้องการลบสิ่งที่แนบมา?
apps/frappe/frappe/__init__.py +1178,Thank you,ขอบคุณ
apps/frappe/frappe/public/js/frappe/form/save.js +11,Saving,กำลังบันทึก
DocType: Print Settings,Print Style Preview,ตัวอย่างรูปแบบการพิมพ์
apps/frappe/frappe/core/doctype/file/test_file.py +249,Test_Folder,Test_Folder
apps/frappe/frappe/public/js/frappe/ui/toolbar/modules_select.js +50,Icons,ไอคอน
apps/frappe/frappe/website/doctype/web_form/web_form.py +366,You are not allowed to update this Web Form Document,คุณยังไม่ได้รับอนุญาตให้ปรับปรุงเอกสารเว็บฟอร์มนี้
apps/frappe/frappe/core/page/usage_info/usage_info.html +31,Emails,อีเมล์
apps/frappe/frappe/core/report/feedback_ratings/feedback_ratings.js +26,Please select Document Type first,กรุณาเลือกประเภทเอกสารแรก
apps/frappe/frappe/integrations/oauth2.py +108,Please set Base URL in Social Login Key for Frappe,โปรดตั้งค่า URL พื้นฐานในคีย์การเข้าสู่ระบบสังคมสำหรับ Frappe
DocType: About Us Settings,About Us Settings,การตั้งค่าข้อมูลเกี่ยวกับเรา
DocType: Website Settings,Website Theme,ธีมเว็บไซต์
DocType: User,Api Access,Api Access
DocType: DocField,In List View,ในมุมมองรายการ
DocType: Email Account,Use TLS,ใช้ TLS
apps/frappe/frappe/email/smtp.py +24,Invalid login or password,เข้าสู่ระบบ ที่ไม่ถูกต้อง หรือรหัสผ่าน
apps/frappe/frappe/core/doctype/data_import/data_import.js +72,Download Template,ดาวน์โหลดแม่แบบ
apps/frappe/frappe/config/setup.py +259,Add custom javascript to forms.,เพิ่ม javascript ที่กำหนดเอง ในรูปแบบ
,Role Permissions Manager,ผู้จัดการ สิทธิ์ บทบาท
apps/frappe/frappe/printing/page/print_format_builder/print_format_builder.js +117,Name of the new Print Format,ชื่อของรูปแบบพิมพ์ใหม่
apps/frappe/frappe/public/js/frappe/views/reports/report_view.js +1040,Toggle Sidebar,สลับแถบด้านข้าง
DocType: Data Migration Run,Pull Insert,ดึง Insert
apps/frappe/frappe/public/js/frappe/form/controls/attach.js +60,Clear Attachment,สิ่งที่ส่งมาชัดเจน
apps/frappe/frappe/core/doctype/data_import/exporter.py +270,Mandatory:,บังคับ:
DocType: Chat Message,Mentions,กล่าวถึง
DocType: Chat Room,Chat Room,ห้องสนทนา
DocType: Chat Profile,Conversation Tones,เสียงสนทนา
DocType: Property Setter,New value to be set,ค่าใหม่ที่จะตั้ง
DocType: Notification,Days Before or After,วันก่อนหรือหลัง
apps/frappe/frappe/desk/doctype/auto_repeat/auto_repeat.py +75,Next Date's day and Repeat on Day of Month must be equal,วันวันถัดไปและทำซ้ำในวันเดือนจะต้องเท่ากัน
apps/frappe/frappe/core/page/permission_manager/permission_manager_help.html +34,Select Document Types to set which User Permissions are used to limit access.,เลือกประเภทของเอกสารที่จะกำหนดสิทธิ์ของผู้ใช้ที่จะใช้ในการ จำกัด การเข้าถึง
DocType: Website Settings,HTML Header & Robots,HTML ส่วนหัวและหุ่นยนต์
DocType: User Permission,User Permission,การอนุญาต ของผู้ใช้
apps/frappe/frappe/config/website.py +32,Blog,บล็อก
apps/frappe/frappe/integrations/doctype/ldap_settings/ldap_settings.py +37,LDAP Not Installed,ไม่ได้ติดตั้ง LDAP
apps/frappe/frappe/core/doctype/data_import/data_import.js +204,Download with data,ดาวน์โหลดที่มีข้อมูล
DocType: Workflow State,hand-right,มือ-ขวา
DocType: Website Settings,Subdomain,subdomain
apps/frappe/frappe/config/integrations.py +68,Settings for OAuth Provider,การตั้งค่าสำหรับผู้ให้บริการ OAuth
apps/frappe/frappe/public/js/frappe/form/workflow.js +37,Current status,สถานะปัจจุบัน
DocType: Web Form,Allow Delete,อนุญาตให้ลบ
DocType: Notification,Message Examples,ตัวอย่างข้อความ
DocType: Web Form,Login Required,ต้องเข้าสู่ระบบ
apps/frappe/frappe/config/website.py +42,Write titles and introductions to your blog.,เขียนชื่อและที่จะแนะนำบล็อกของคุณ
DocType: Email Account,Email Login ID,รหัสการเข้าสู่ระบบอีเมล
DocType: Email Account,Email Login ID,รหัสการเข้าสู่ระบบอีเมล
apps/frappe/frappe/templates/pages/integrations/payment-cancel.html +3,Payment Cancelled,การชำระเงินที่ถูกยกเลิก
,Addresses And Contacts,ที่อยู่และรายชื่อผู้ติดต่อ
apps/frappe/frappe/core/doctype/data_import/data_import.js +99,Please select document type first.,โปรดเลือกประเภทเอกสารก่อน
apps/frappe/frappe/core/doctype/error_log/error_log_list.js +12,Clear Error Logs,บันทึกข้อผิดพลาดที่ชัดเจน
apps/frappe/frappe/templates/emails/feedback_request_url.html +2,Please select a rating,กรุณาเลือกคะแนน
apps/frappe/frappe/core/doctype/user/user.js +103,Reset OTP Secret,รีเซ็ต OTP Secret
DocType: Email Account,Notify if unreplied for (in mins),ถ้ายังไม่มีการตอบแจ้งสำหรับ (ในนาที)
apps/frappe/frappe/public/js/frappe/list/list_renderer.js +570,2 days ago,2 วันที่ผ่านมา
apps/frappe/frappe/config/website.py +47,Categorize blog posts.,แบ่งหมวดหมู่ของบล็อกโพสต์
DocType: Workflow State,Time,เวลา
DocType: DocField,Attach,แนบ
apps/frappe/frappe/core/doctype/doctype/doctype.py +637,{{{0}}} is not a valid fieldname pattern. It should be {{field_name}}.,{{{0}}} ไม่ใช่รูปแบบเขตข้อมูลที่ถูกต้อง ควรจะเป็น {{}} FIELD_NAME
DocType: Feedback Trigger,Send Feedback Request only if there is at least one communication is available for the document.,ส่งข้อเสนอแนะขอเพียง แต่ถ้ามีอย่างน้อยหนึ่งการสื่อสารสามารถใช้ได้สำหรับเอกสาร
DocType: Custom Role,Permission Rules,กฎการอนุญาต
DocType: Braintree Settings,Public Key,คีย์สาธารณะ
DocType: GSuite Settings,GSuite Settings,การตั้งค่า GSuite
DocType: Address,Links,ลิงค์
apps/frappe/frappe/core/doctype/data_export/data_export.js +38,Please select the Document Type.,โปรดเลือกประเภทเอกสาร
apps/frappe/frappe/model/base_document.py +406,Value missing for,ค่าที่หายไปสำหรับ
apps/frappe/frappe/public/js/frappe/views/treeview.js +183,Add Child,เพิ่ม เด็ก
apps/frappe/frappe/model/delete_doc.py +176,{0} {1}: Submitted Record cannot be deleted.,{0} {1}: รายการที่ส่งแล้วไม่สามารถลบได้
DocType: GSuite Templates,Template Name,ชื่อเทมเพลต
apps/frappe/frappe/public/js/frappe/ui/toolbar/awesome_bar.js +133,new type of document,ชนิดใหม่ของเอกสาร
DocType: Communication,Read,อ่าน
DocType: Address,Chhattisgarh,Chhattisgarh
DocType: Role Permission for Page and Report,Role Permission for Page and Report,อนุญาตบทบาทสำหรับหน้าและรายงาน
apps/frappe/frappe/printing/page/print_format_builder/print_format_builder.js +460,Align Value,ตําแหน่งราคา
apps/frappe/frappe/www/update-password.html +14,Old Password,รหัสผ่านเก่า
apps/frappe/frappe/website/doctype/blog_post/blog_post.py +106,Posts by {0},โพสต์โดย {0}
apps/frappe/frappe/core/doctype/report/report.js +9,"To format columns, give column labels in the query.",การจัดรูปแบบคอลัมน์ให้ป้ายชื่อคอลัมน์ในแบบสอบถาม
DocType: Has Domain,Has Domain,มีโดเมน
apps/frappe/frappe/core/page/desktop/desktop.js +190,Hide,ปิดบัง
apps/frappe/frappe/www/login.html +55,Don't have an account? Sign up,ไม่ได้มีบัญชีอยู่แล้ว? ลงชื่อ
apps/frappe/frappe/public/js/frappe/views/reports/report_view.js +682,Cannot remove ID field,ไม่สามารถลบฟิลด์รหัสได้
apps/frappe/frappe/core/doctype/doctype/doctype.py +831,{0}: Cannot set Assign Amend if not Submittable,{0} : ไม่สามารถตั้งค่ากำหนดการแก้ไข ถ้าไม่ Submittable
DocType: Address,Bihar,มคธ
DocType: Activity Log,Link DocType,การเชื่อมโยง DocType
apps/frappe/frappe/public/js/frappe/chat.js +1703,You don't have any messages yet.,คุณยังไม่มีข้อความเลย
apps/frappe/frappe/custom/doctype/customize_form/customize_form.js +76,Remove all customizations?,ลบ การปรับแต่ง ทั้งหมดหรือไม่
DocType: Website Slideshow,Slideshow Name,ชื่อสไลด์โชว์
DocType: Address,Andhra Pradesh,อานธรประเทศ
apps/frappe/frappe/public/js/frappe/form/save.js +15,Cancelling,กำลังยกเลิก
DocType: DocType,Allow Rename,อนุญาตให้เปลี่ยนชื่อ
DocType: Activity Log,Full Name,ชื่อเต็ม
apps/frappe/frappe/public/js/frappe/list/list_filter.js +102,Duplicate Filter Name,ชื่อตัวกรองซ้ำ
DocType: DocType,Child Tables are shown as a Grid in other DocTypes.,ตารางเด็กจะปรากฏเป็นเส้นตารางใน doctypes อื่น ๆ
DocType: Chat Room User,Chat Room User,ผู้ใช้ห้องแชท
apps/frappe/frappe/model/workflow.py +38,Workflow State not set,ไม่ได้ตั้งค่าสถานะเวิร์กโฟลว์
apps/frappe/frappe/www/404.html +23,The page you are looking for is missing. This could be because it is moved or there is a typo in the link.,หน้าเว็บที่คุณกำลังมองหาจะหายไป ซึ่งอาจเป็นเพราะมันจะถูกย้ายหรือมีการพิมพ์ผิดในการเชื่อมโยง
apps/frappe/frappe/www/404.html +26,Error Code: {0},รหัสข้อผิดพลาด: {0}
DocType: Blog Post,"Description for listing page, in plain text, only a couple of lines. (max 140 characters)",คำอธิบายสำหรับหน้าแสดงรายการในข้อความธรรมดาเพียงคู่สาย (สูงสุด 140 ตัวอักษร)
DocType: Workflow,Allow Self Approval,อนุญาตการอนุมัติตนเอง
DocType: Event,Event Category,ประเภทเหตุการณ์
apps/frappe/frappe/templates/pages/integrations/stripe_checkout.html +27,John Doe,John Doe
DocType: DocType,Name Case,กรณีชื่อ
apps/frappe/frappe/public/js/frappe/form/share.js +27,Shared with everyone,ที่ใช้ร่วมกันกับทุกคน
apps/frappe/frappe/model/base_document.py +402,Data missing in table,ข้อมูลที่หายไปในตาราง
DocType: Web Form,Success URL,URL ที่ประสบความสำเร็จ
DocType: Email Account,Append To,ผนวกกับ
apps/frappe/frappe/integrations/doctype/dropbox_settings/dropbox_settings.py +29,Number of DB backups cannot be less than 1,จำนวนสำรองข้อมูล DB ต้องไม่น้อยกว่า 1
DocType: Workflow Document State,Only Allow Edit For,อนุญาตให้เฉพาะสำหรับแก้ไข
apps/frappe/frappe/core/doctype/role_permission_for_page_and_report/role_permission_for_page_and_report.js +108,Mandatory field: {0},ฟิลด์บังคับ: {0}
apps/frappe/frappe/templates/includes/comments/comments.html +35,Your Name,ชื่อของคุณ
apps/frappe/frappe/templates/pages/integrations/gcalendar-success.html +3,Connection Success,ความสำเร็จในการเชื่อมต่อ
DocType: DocType,InnoDB,InnoDB
DocType: File,Is Folder,เป็นโฟลเดอร์
,Feedback Ratings,ผลตอบรับความนิยม
DocType: DocType,DocType,DOCTYPE
DocType: Website Theme,"If image is selected, color will be ignored.",หากภาพเลือกสีจะถูกละเว้น
DocType: User,Mute Sounds,ปิดเสียง
DocType: Top Bar Item,Top Bar Item,รายการ Bar สถานที่ยอด
DocType: Auto Repeat,SUB-,อนุ
apps/frappe/frappe/utils/csvutils.py +53,"Unknown file encoding. Tried utf-8, windows-1250, windows-1252.","การเข้ารหัส ไฟล์ ที่ไม่รู้จัก พยายาม UTF -8 , Windows - 1250 1252 หน้าต่าง"
apps/frappe/frappe/printing/doctype/print_style/print_style.py +15,Standard Print Style cannot be changed. Please duplicate to edit.,ไม่สามารถเปลี่ยนสไตล์การพิมพ์มาตรฐานได้ โปรดทำซ้ำเพื่อแก้ไข
DocType: Website Settings,Robots.txt,robots.txt
apps/frappe/frappe/core/doctype/user/user.py +191,Sorry! Sharing with Website User is prohibited.,ขออภัย! ร่วมกับผู้ใช้เว็บไซต์เป็นสิ่งต้องห้าม
apps/frappe/frappe/public/js/frappe/roles_editor.js +30,Add all roles,เพิ่ม บทบาท ทั้งหมด
DocType: Website Theme,Bootstrap Theme,ธีม Bootstrap
apps/frappe/frappe/templates/includes/contact.js +15,"Please enter both your email and message so that we \
				can get back to you. Thanks!","กรุณากรอกตัวอักษรทั้งอีเมล์และข้อความของคุณเพื่อให้เรา \
 จะได้รับกลับมาให้คุณ ขอบคุณ!"
apps/frappe/frappe/email/smtp.py +203,Could not connect to outgoing email server,ไม่สามารถ เชื่อมต่อกับเซิร์ฟเวอร์ อีเมลขาออก
apps/frappe/frappe/email/doctype/newsletter/newsletter.py +168,Thank you for your interest in subscribing to our updates,ขอบคุณที่ให้ความสนใจในการสมัครรับการปรับปรุงของเรา
DocType: Braintree Settings,Payment Gateway Name,ชื่อเกตเวย์การชำระเงิน
apps/frappe/frappe/public/js/frappe/views/kanban/kanban_view.js +288,Custom Column,คอลัมน์ที่กำหนดเอง
DocType: Workflow State,resize-full,ปรับขนาดเต็ม
DocType: Workflow State,off,ปิด
apps/frappe/frappe/public/js/frappe/ui/capture.js +168,Retake,เอาคืน
apps/frappe/frappe/desk/query_report.py +30,Report {0} is disabled,รายงาน {0} เป็นคนพิการ
DocType: Activity Log,Core,แกน
apps/frappe/frappe/custom/doctype/customize_form/customize_form.js +79,Set Permissions,สิทธิ์ในการตั้งค่า
DocType: DocField,Set non-standard precision for a Float or Currency field,ตั้งความแม่นยำที่ไม่ได้มาตรฐานสำหรับลอยหรือสาขาสกุลเงิน
DocType: Email Account,Ignore attachments over this size,ละเว้นสิ่งที่แนบมามากกว่าขนาดนี้
DocType: Address,Preferred Billing Address,ที่อยู่การเรียกเก็บเงินที่ต้องการ
apps/frappe/frappe/model/workflow.py +134,Workflow State {0} is not allowed,สถานะ Workflow State {0} ไม่ได้รับอนุญาต
apps/frappe/frappe/database/database.py +246,Too many writes in one request. Please send smaller requests,เขียน มากเกินไปใน หนึ่งขอ กรุณา ส่งคำขอ มีขนาดเล็ก
apps/frappe/frappe/core/doctype/version/version_view.html +8,Values Changed,ค่าเปลี่ยน
DocType: Workflow State,arrow-up,ลูกศรขึ้น
DocType: OAuth Bearer Token,Expires In,จะหมดอายุใน
DocType: DocField,Allow on Submit,อนุญาตให้ส่ง
DocType: DocField,HTML,HTML
DocType: Error Snapshot,Exception Type,ประเภทยกเว้น
apps/frappe/frappe/public/js/frappe/views/reports/reportview.js +606,Pick Columns,เลือกคอลัมน์
DocType: Web Page,Add code as &lt;script&gt;,เพิ่มรหัสเป็น &lt;script&gt;
DocType: Webhook,Headers,ส่วนหัว
apps/frappe/frappe/integrations/doctype/dropbox_settings/dropbox_settings.js +35,Please enter values for App Access Key and App Secret Key,กรุณาป้อนค่าสำหรับ App คีย์และ app คีย์ลับ
DocType: Web Form,Accept Payment,ยอมรับการชำระเงิน
apps/frappe/frappe/config/core.py +62,A log of request errors,บันทึกข้อผิดพลาดของการร้องขอ
DocType: Report,Letter Head,หัวจดหมาย
DocType: DocType,Quick Entry,รายการด่วน
DocType: Web Form,Button Label,ปุ่มฉลาก
DocType: Website Theme,UPPERCASE,พิมพ์ใหญ่
apps/frappe/frappe/public/js/frappe/list/list_view.js +892,{0} items selected,{0} รายการถูกเลือก
apps/frappe/frappe/email/doctype/email_queue/email_queue_list.js +16,Suspend Sending,ระงับการส่ง
apps/frappe/frappe/printing/page/print_format_builder/print_format_builder_layout.html +3,Drag elements from the sidebar to add. Drag them back to trash.,องค์ประกอบลากจากแถบด้านข้างเพื่อเพิ่ม ลากพวกเขากลับไปยังถังขยะ
DocType: Workflow State,resize-small,ปรับขนาดเล็ก
DocType: Address,Postal Code,รหัสไปรษณีย์
apps/frappe/frappe/core/doctype/communication/communication.js +106,Relink Communication,การสื่อสารเชื่อมโยงอีกครั้ง
apps/frappe/frappe/www/third_party_apps.html +58,No Active Sessions,ไม่มีเซสชันที่ใช้งานอยู่
DocType: Web Form,Route to Success Link,เส้นทางสู่ความสำเร็จ Link
DocType: Top Bar Item,Right,ขวา
DocType: User,User Type,ประเภทผู้ใช้
DocType: Prepared Report,Ref Report DocType,เอกสารอ้างอิง DocType
apps/frappe/frappe/email/doctype/auto_email_report/auto_email_report.js +65,Click table to edit,คลิกที่ตารางเพื่อแก้ไข
DocType: GCalendar Settings,Client ID,รหัสลูกค้า
DocType: Async Task,Reference Doc,อ้างอิงหมอ
DocType: Communication,Keep a track of all communications,ติดตามการสื่อสารทั้งหมด
apps/frappe/frappe/desk/form/save.py +34,Did not save,ไม่ได้บันทึก
DocType: Property Setter,Property,คุณสมบัติ
DocType: Email Account,Yandex.Mail,Yandex.Mail
apps/frappe/frappe/public/js/frappe/views/reports/report_view.js +413,Chart Type,ประเภทแผนภูมิ
DocType: Website Slideshow,"Note: For best results, images must be of the same size and width must be greater than height.",หมายเหตุ: สำหรับผลลัพธ์ที่ดีที่สุดภาพต้องมีขนาดเท่ากันและความกว้างต้องมากกว่าความสูง
DocType: DocType,Auto Name,ชื่ออัตโนมัติ
apps/frappe/frappe/utils/password_strength.py +125,Avoid sequences like abc or 6543 as they are easy to guess,หลีกเลี่ยงการลำดับเช่น ABC หรือ 6543 ที่พวกเขาเป็นเรื่องง่ายที่จะคาดเดา
apps/frappe/frappe/public/js/frappe/request.js +144,Please try again,กรุณาลองอีกครั้ง
apps/frappe/frappe/custom/doctype/custom_field/custom_field.js +63,Option 3,ตัวเลือกที่ 3
DocType: Communication,uid,UID
DocType: Workflow State,Edit,แก้ไข
apps/frappe/frappe/custom/doctype/customize_form/customize_form.js +229,Permissions can be managed via Setup &gt; Role Permissions Manager,สิทธิ์สามารถจัดการได้ผ่านการตั้งค่า & gt; บทบาทผู้จัดการสิทธิ์
DocType: Website Settings,Chat Operators,ผู้ดำเนินการแชท
DocType: Contact Us Settings,Pincode,Pincode
apps/frappe/frappe/core/doctype/data_import/importer.py +106,Please make sure that there are no empty columns in the file.,กรุณาตรวจสอบให้แน่ใจว่าไม่มีคอลัมน์ที่ว่างเปล่าในแฟ้ม
apps/frappe/frappe/utils/oauth.py +184,Please ensure that your profile has an email address,โปรดตรวจสอบว่ารายละเอียดของคุณมีที่อยู่อีเมล
apps/frappe/frappe/public/js/frappe/model/create_new.js +288,You have unsaved changes in this form. Please save before you continue.,คุณมีการเปลี่ยนแปลงที่ไม่ได้บันทึกในฟอร์มนี้ กรุณาบันทึกเพื่อที่จะดำเนินการต่อ
DocType: Address,Telangana,พรรคเตลัง
apps/frappe/frappe/core/doctype/doctype/doctype.py +562,Default for {0} must be an option,เริ่มต้นสำหรับ {0} จะต้องเป็นตัวเลือก
DocType: Tag Doc Category,Tag Doc Category,แท็ก Doc หมวดหมู่
DocType: User,User Image,รูปภาพของผู้ใช้
apps/frappe/frappe/email/queue.py +345,Emails are muted,อีเมลเป็น เงียบ
apps/frappe/frappe/config/integrations.py +88,Google Services,บริการของ Google
apps/frappe/frappe/public/js/frappe/form/grid_row_form.js +67,Ctrl + Up,Ctrl + ขึ้น
DocType: Website Theme,Heading Style,สไตล์มุ่งหน้าไป
apps/frappe/frappe/utils/data.py +641,1 weeks ago,1 สัปดาห์ที่ผ่านมา
DocType: Communication,Error,ความผิดพลาด
apps/frappe/frappe/desk/doctype/auto_repeat/auto_repeat.js +129,Please setup a message first,โปรดตั้งค่าข้อความก่อน
DocType: Auto Repeat,End Date,วันที่สิ้นสุด
