apps/frappe/frappe/custom/doctype/customize_form/customize_form.js +225,Press Esc to close,กด Esc เพื่อปิด
apps/frappe/frappe/desk/form/assign_to.py +153,"A new task, {0}, has been assigned to you by {1}. {2}",งานใหม่ {0} ได้รับมอบหมายให้กับคุณโดย {1} {2}
apps/frappe/frappe/desk/page/messages/messages_main.html +12,Post,เสา
apps/frappe/frappe/config/setup.py +98,Rename many items by uploading a .csv file.,เปลี่ยนชื่อ หลายรายการ โดยการอัปโหลดไฟล์ CSV .
DocType: Workflow State,pause,หยุด
apps/frappe/frappe/templates/pages/desk.py +18,You are not permitted to access this page.,คุณยังไม่ได้รับอนุญาตให้เข้าถึงหน้านี้
DocType: User,Facebook Username,Facebook ชื่อผู้ใช้งาน
apps/frappe/frappe/email/bulk.py +148,Cannot send this email. You have crossed the sending limit of {0} emails for this month.,ไม่สามารถส่งอีเมล์นี้ คุณได้ข้ามขีด จำกัด การส่ง {0} อีเมลสำหรับเดือนนี้
apps/frappe/frappe/public/js/legacy/form.js +690,Permanently Submit {0}?,อย่างถาวร ส่ง {0}?
apps/frappe/frappe/client.py +162,Invalid file path: {0},เส้นทางของไฟล์ไม่ถูกต้อง: {0}
DocType: Workflow State,eye-open,ตาเปิด
DocType: Bulk Email,Send After,หลังจากที่ส่ง
apps/frappe/frappe/utils/file_manager.py +30,Please select a file or url,โปรดเลือกไฟล์หรือพิมพ์ URL
DocType: DocField,DocField,DocField
DocType: Comment,Comment By Fullname,ความคิดเห็นที่ Fullname
DocType: DocField,Options,ตัวเลือก
apps/frappe/frappe/public/js/frappe/views/reports/reportview.js +344,Cannot edit standard fields,ไม่สามารถแก้ไข เขตข้อมูลมาตรฐาน
DocType: Print Format,Print Format Builder,พิมพ์รูปแบบสร้าง
apps/frappe/frappe/public/js/frappe/ui/page.js +4,Form,แบบฟอร์ม
DocType: Report,Report Manager,จัดการรายงาน
DocType: Workflow,Document States,เอกสารสหรัฐอเมริกา
apps/frappe/frappe/public/js/frappe/views/pageview.js +102,Sorry! I could not find what you were looking for.,ขออภัย! ฉันไม่สามารถหาสิ่งที่คุณกำลังมองหา
DocType: DocPerm,This role update User Permissions for a user,บทบาทนี้ สิทธิ์ การปรับปรุง ผู้ใช้งานของ ผู้ใช้
apps/frappe/frappe/public/js/frappe/model/model.js +486,Rename {0},เปลี่ยนชื่อ {0}
DocType: Workflow State,zoom-out,ซูมออก
DocType: Comment,Reference DocType and Reference Name are used to render a comment as a link (href) to a Doc.,อ้างอิง DocType และชื่อที่ใช้ในการอ้างอิงเพื่อแสดงความคิดเห็นเป็นลิงค์ (href) เพื่อหมอ
apps/frappe/frappe/public/js/legacy/form.js +65,Cannot open {0} when its instance is open,ไม่สามารถเปิด {0} เมื่อ ตัวอย่าง ที่ เปิดให้บริการ
apps/frappe/frappe/model/document.py +749,Table {0} cannot be empty,ตารางที่ {0} ไม่ว่างเปล่า
apps/frappe/frappe/public/js/frappe/views/reports/grid_report.js +891,With Ledgers,ด้วย Ledgers
DocType: Social Login Keys,GitHub,GitHub
apps/frappe/frappe/model/base_document.py +465,"{0}, Row {1}",{0} แถว {1}
apps/frappe/frappe/model/document.py +723,Beginning with,เริ่มต้นด้วย
apps/frappe/frappe/core/page/data_import_tool/exporter.py +51,Data Import Template,ข้อมูลนำเข้าแม่แบบ
apps/frappe/frappe/public/js/frappe/model/model.js +31,Parent,ผู้ปกครอง
apps/frappe/frappe/print/doctype/print_format/print_format.py +32,Syntax error in Jinja template,ไวยากรณ์ผิดพลาดในแม่แบบ Jinja
DocType: About Us Settings,"""Team Members"" or ""Management""","“สมาชิกในทีม"" หรือ ""ผู้บริหาร"""
apps/frappe/frappe/core/doctype/doctype/doctype.py +284,Default for 'Check' type of field must be either '0' or '1',เริ่มต้นสำหรับ 'ตรวจสอบ' ประเภทของข้อมูลต้องเป็น '0' หรือ '1'
apps/frappe/frappe/public/js/frappe/list/listview.js +340,Yesterday,เมื่อวาน
apps/frappe/frappe/public/js/frappe/views/test_runner.js +10,Test Runner,วิ่งทดสอบ
DocType: Email Account,Enable Incoming,เปิดใช้งานเข้ามา
DocType: Workflow State,Danger,อันตราย
DocType: Workflow State,th-large,-th ใหญ่
DocType: Communication,Unread Notification Sent,แจ้งส่งยังไม่ได้อ่าน
apps/frappe/frappe/public/js/frappe/misc/tools.js +8,Export not allowed. You need {0} role to export.,ส่งออก ไม่ได้รับอนุญาต คุณต้อง {0} บทบาท ในการส่งออก
apps/frappe/frappe/public/js/frappe/ui/filters/edit_filter.html +11,Not Like,ไม่ชอบ
apps/frappe/frappe/custom/doctype/customize_form/customize_form.js +155,Set the display label for the field,ตั้งป้ายแสดงผลสำหรับฟิลด์
apps/frappe/frappe/model/document.py +740,Incorrect value: {0} must be {1} {2},ค่าไม่ถูกต้อง: {0} จะต้อง {1} {2}
apps/frappe/frappe/config/setup.py +196,"Change field properties (hide, readonly, permission etc.)","เปลี่ยนคุณสมบัติ เขตข้อมูล (ซ่อน , อ่านได้อย่างเดียว ได้รับอนุญาต ฯลฯ )"
DocType: Workflow State,lock,ล็อค
apps/frappe/frappe/config/website.py +74,Settings for Contact Us Page.,การตั้งค่าสำหรับหน้าติดต่อเรา
apps/frappe/frappe/core/doctype/user/user.py +490,Administrator Logged In,ผู้ดูแลระบบเข้าสู่ระบบ
DocType: Contact Us Settings,"Contact options, like ""Sales Query, Support Query"" etc each on a new line or separated by commas.",ตัวเลือกการติดต่อเช่น &quot;แบบสอบถามขายการสนับสนุนแบบสอบถาม&quot; ฯลฯ แต่ละบรรทัดใหม่หรือคั่นด้วยเครื่องหมายจุลภาค
apps/frappe/frappe/public/js/frappe/ui/editor.js +448,Insert,แทรก
apps/frappe/frappe/public/js/frappe/form/link_selector.js +21,Select {0},เลือก {0}
DocType: Feed,Color,สี
apps/frappe/frappe/public/js/frappe/views/reports/query_report.js +49,For ranges,สำหรับช่วง
DocType: Workflow State,indent-right,เยื้องขวา
apps/frappe/frappe/public/js/frappe/ui/upload.html +12,Web Link,เว็บลิงค์
apps/frappe/frappe/core/page/data_import_tool/data_import_main.html +33,"Recommended bulk editing records via import, or understanding the import format.",แนะนำบันทึกการแก้ไขเป็นกลุ่มผ่านการนำเข้าหรือการทำความเข้าใจรูปแบบการนำเข้า
apps/frappe/frappe/core/page/permission_manager/permission_manager_help.html +36,"Apart from System Manager, roles with Set User Permissions right can set permissions for other users for that Document Type.",นอกเหนือจากการจัดการระบบบทบาทกับการตั้งค่าสิทธิ์ของผู้ใช้ที่เหมาะสมสามารถกำหนดสิทธิ์สำหรับผู้ใช้อื่น ๆ สำหรับประเภทเอกสารที่
DocType: Company History,Company History,ประวัติ บริษัท
DocType: Workflow State,volume-up,ปริมาณขึ้น
apps/frappe/frappe/core/page/data_import_tool/importer.py +45,Only allowed {0} rows in one import,ได้รับอนุญาตเท่านั้น {0} แถว หนึ่งใน การนำเข้า
apps/frappe/frappe/public/js/frappe/list/list_sidebar.js +61,Refresh Stats,รีเฟรชสถิติ
apps/frappe/frappe/core/page/data_import_tool/data_import_main.html +4,"To import or update records, you must first download the template for importing.",ที่จะนำเข้าหรือระเบียนการปรับปรุงก่อนอื่นคุณต้องดาวน์โหลดแม่แบบสำหรับการนำเข้า
DocType: DocType,Default Print Format,รูปแบบการพิมพ์เริ่มต้น
DocType: Workflow State,Tags,แท็ก
apps/frappe/frappe/public/js/frappe/form/workflow.js +33,None: End of Workflow,: ไม่มีสิ้นสุดเวิร์กโฟลว์
apps/frappe/frappe/model/db_schema.py +315,"{0} field cannot be set as unique in {1}, as there are non-unique existing values",{0} สนามไม่สามารถกำหนดให้เป็นเอกลักษณ์ใน {1} เนื่องจากมีค่าที่มีอยู่ที่ไม่ซ้ำกัน
apps/frappe/frappe/core/page/permission_manager/permission_manager.js +47,Document Types,ประเภทเอกสาร
DocType: Workflow,Workflow State Field,ฟิลด์รัฐเวิร์กโฟลว์
DocType: DocType,Title Field,ชื่อ ฟิลด์
apps/frappe/frappe/core/doctype/user/user.py +487,"If you think this is unauthorized, please change the Administrator password.",หากคุณคิดว่านี่คือไม่ได้รับอนุญาตโปรดเปลี่ยนรหัสผ่านของผู้ดูแลระบบ
DocType: Workflow State,eject,ขับ
apps/frappe/frappe/core/page/user_permissions/user_permissions.js +16,Help for User Permissions,ช่วยเหลือสำหรับสิทธิ์ของผู้ใช้
DocType: Communication,Visit,เยี่ยม
apps/frappe/frappe/desk/page/applications/application_row.html +7,Install,ติดตั้ง
apps/frappe/frappe/public/js/legacy/form.js +423,This form has been modified after you have loaded it,รูปแบบนี้ได้รับการแก้ไขหลังจากที่คุณได้โหลด
DocType: Website Settings,Twitter Share via,แบ่งปัน Twitter ผ่าน
apps/frappe/frappe/config/website.py +33,Embed image slideshows in website pages.,ฝังภาพสไลด์ภาพในหน้าเว็บไซต์
DocType: Workflow Action,Workflow Action Name,ชื่อการกระทำเวิร์กโฟลว์
apps/frappe/frappe/core/doctype/doctype/doctype.py +145,DocType can not be merged,DocType ไม่สามารถ รวม
DocType: Web Form Field,Fieldtype,fieldtype
apps/frappe/frappe/desk/form/save.py +46,Did not cancel,ไม่ได้ยกเลิก
DocType: Workflow State,plus,บวก
apps/frappe/frappe/config/desktop.py +10,File Manager,ตัวจัดการไฟล์
DocType: Scheduler Log,Scheduler Log,เข้าสู่ระบบการจัดตารางเวลา
apps/frappe/frappe/public/js/frappe/form/footer/timeline.html +15,You,คุณ
DocType: Website Theme,lowercase,ตัวพิมพ์เล็ก
DocType: Print Format,Helvetica,Helvetica
DocType: Note,Everyone can read,ทุกคนสามารถอ่าน
apps/frappe/frappe/core/report/permitted_documents_for_user/permitted_documents_for_user.py +25,Please specify user,โปรดระบุผู้ใช้
DocType: Email Unsubscribe,Email Unsubscribe,อีเมล์ยกเลิก
DocType: Website Settings,Select an image of approx width 150px with a transparent background for best results.,เลือกภาพจาก 150px ความกว้างประมาณกับพื้นหลังโปร่งใสเพื่อให้ได้ผลลัพธ์ที่ดีที่สุด
apps/frappe/frappe/public/js/frappe/form/grid_body.html +14,Add multiple rows,เพิ่มหลายแถว
apps/frappe/frappe/custom/doctype/custom_field/custom_field.py +61,"Insert After field '{0}' mentioned in Custom Field '{1}', does not exist",หลังจากที่ แทรก ฟิลด์ ' {0} ' ที่กล่าวถึงใน ฟิลด์ที่กำหนดเอง ' {1} ' ไม่อยู่
DocType: Workflow State,circle-arrow-up,วงกลมลูกศรขึ้น
apps/frappe/frappe/public/js/frappe/upload.js +84,Uploading...,อัพโหลด ...
DocType: Workflow State,italic,ตัวเอียง
apps/frappe/frappe/core/doctype/doctype/doctype.py +445,{0}: Cannot set Import without Create,{0}: ไม่ สามารถตั้งค่า ได้โดยไม่ต้อง นำเข้า สร้าง
DocType: Comment,Post Topic,เริ่มหัวข้อ
apps/frappe/frappe/config/desk.py +21,Event and other calendars.,เหตุการณ์และปฏิทินอื่น ๆ
apps/frappe/frappe/public/js/frappe/views/reports/reportview.js +611,Drag to sort columns,ลากเพื่อเรียงลำดับคอลัมน์
apps/frappe/frappe/print/page/print_format_builder/print_format_builder_column_selector.html +2,Widths can be set in px or %.,ความกว้างสามารถตั้งค่าในพิกเซลหรือ%
apps/frappe/frappe/core/doctype/file/file.py +147,Cannot delete Home and Attachments folders,ไม่สามารถลบหน้าแรกและโฟลเดอร์ไฟล์แนบ
apps/frappe/frappe/core/page/permission_manager/permission_manager_help.html +6,Permissions get applied on Users based on what Roles they are assigned.,สิทธิ์ ที่ได้รับ นำไปใช้ กับ ผู้ใช้ที่ อยู่บนพื้นฐานของ สิ่งที่ พวกเขา บทบาท ที่ได้รับมอบหมาย
apps/frappe/frappe/public/js/frappe/views/communication.js +409,You are not allowed to send emails related to this document,คุณยังไม่ได้ รับอนุญาตให้ส่ง อีเมล ที่เกี่ยวข้องกับ เอกสารฉบับนี้
apps/frappe/frappe/website/doctype/website_theme/website_theme.py +30,You are not allowed to delete a standard Website Theme,คุณยังไม่ได้รับอนุญาตให้ลบรูปแบบมาตรฐานเว็บไซต์
apps/frappe/frappe/custom/doctype/customize_form/customize_form.js +177,Example,ตัวอย่าง
DocType: Workflow State,gift,ของขวัญ
apps/frappe/frappe/custom/doctype/customize_form/customize_form.js +181,Reqd,reqd
apps/frappe/frappe/core/doctype/communication/communication.py +193,Unable to find attachment {0},ไม่สามารถที่จะ หา สิ่งที่แนบมา {0}
apps/frappe/frappe/custom/doctype/customize_form/customize_form.js +169,Assign a permission level to the field.,การกำหนดระดับการอนุญาตให้ข้อมูล
apps/frappe/frappe/config/setup.py +72,Show / Hide Modules,แสดง / ซ่อน โมดูล
apps/frappe/frappe/core/doctype/report/report.js +37,Disable Report,ปิดการใช้งานรายงาน
DocType: Report,JavaScript Format: frappe.query_reports['REPORTNAME'] = {},รูปแบบ JavaScript : frappe.query_reports [ 'ชื่อรายงาน ] = { }
DocType: Version,Doclist JSON,Doclist JSON
DocType: Workflow State,chevron-up,บั้งขึ้น
apps/frappe/frappe/public/js/frappe/ui/toolbar/offcanvas_left_sidebar.html +27,Documentation,เอกสาร
DocType: DocShare,Internal record of document shares,บันทึกของหุ้นเอกสารภายใน
DocType: Workflow State,Comment,ความเห็น
apps/frappe/frappe/core/page/permission_manager/permission_manager_help.html +17,"You can change Submitted documents by cancelling them and then, amending them.",คุณสามารถเปลี่ยน เอกสารที่ เขียนโดย ยกเลิก พวกเขาและ จากนั้น พวกเขา แก้
DocType: DocField,Display,แสดงผล
apps/frappe/frappe/core/page/permission_manager/permission_manager_help.html +25,"If a Role does not have access at Level 0, then higher levels are meaningless.",หาก บทบาทไม่สามารถเข้าถึง ที่ ระดับ 0 แล้ว ระดับที่สูงขึ้น มีความหมาย
DocType: Scheduler Log,Seen,การกระทำ
apps/frappe/frappe/public/js/frappe/form/layout.js +85,Show more details,แสดงรายละเอียดเพิ่มเติม
DocType: System Settings,Run scheduled jobs only if checked,เรียกใช้งานที่กำหนดเฉพาะในกรณีที่มีการตรวจสอบ
DocType: User,"Enter default value fields (keys) and values. If you add multiple values for a field, the first one will be picked. These defaults are also used to set ""match"" permission rules. To see list of fields, go to ""Customize Form"".",สาขาใส่ค่าเริ่มต้น (ปุ่ม) และค่านิยม ถ้าคุณเพิ่มค่าหลายสนามคนแรกที่จะได้รับเลือก เริ่มต้นเหล่านี้ยังใช้ในการตั้งค่า &quot;การแข่งขัน&quot; กฎได้รับอนุญาต เพื่อดูรายชื่อสาขาที่ให้ไปที่ &quot;การปรับแต่งรูปแบบ&quot;
DocType: Customize Form Field,"Print Width of the field, if the field is a column in a table",พิมพ์หน้ากว้างของข้อมูลหากข้อมูลเป็นคอลัมน์ในตาราง
DocType: Workflow State,headphones,หูฟัง
DocType: Bulk Email,Bulk Email records.,บันทึกอีเมล์ขยะ
DocType: Email Account,e.g. replies@yourcomany.com. All replies will come to this inbox.,เช่น replies@yourcomany.com คำตอบทั้งหมดจะมาถึงกล่องจดหมายนี้
apps/frappe/frappe/templates/includes/login/login.js +33,Valid email and name required,อีเมลที่ถูกต้องและชื่อที่ต้องการ
DocType: DocType,Hide Heading,ซ่อนหัวเรื่อง
DocType: Workflow State,remove-circle,ลบวงกลม
apps/frappe/frappe/config/website.py +54,Javascript to append to the head section of the page.,จาวาสคริปต์เพื่อผนวกกับส่วนหัวของหน้า
apps/frappe/frappe/custom/doctype/customize_form/customize_form.js +53,Reset to defaults,รีเซ็ตเป็นค่าเริ่มต้น
DocType: Workflow,Transition Rules,กฎการเปลี่ยน
apps/frappe/frappe/core/doctype/report/report.js +11,Example:,ตัวอย่าง:
DocType: Workflow,Defines workflow states and rules for a document.,กำหนดขั้นตอนการทำงานรัฐและกฎระเบียบสำหรับเอกสาร
DocType: Workflow State,Filter,กรอง
DocType: DocType,Show this field as title,แสดง ด้านนี้ เป็นชื่อ
apps/frappe/frappe/model/db_schema.py +521,Fieldname {0} cannot have special characters like {1},fieldname {0} ไม่สามารถมีอักขระพิเศษเช่น {1}
apps/frappe/frappe/model/document.py +428,Error: Document has been modified after you have opened it,ข้อผิดพลาด: เอกสารได้รับการแก้ไขหลังจากที่คุณได้เปิดมัน
apps/frappe/frappe/core/doctype/doctype/doctype.py +466,{0}: Cannot set Assign Submit if not Submittable,{0}: ไม่ สามารถตั้งค่า กำหนด ส่ง ถ้าไม่ Submittable
DocType: Social Login Keys,Facebook,Facebook
apps/frappe/frappe/templates/pages/list.py +46,"Filtered by ""{0}""",กรองตาม &quot;{0}&quot;
apps/frappe/frappe/desk/page/messages/messages.js +47,Message from {0},ข้อความจาก {0}
DocType: Blog Settings,Blog Title,หัวข้อบล็อก
apps/frappe/frappe/print/page/print_format_builder/print_format_builder_layout.html +12,Edit to set heading,แก้ไขการตั้งค่าการมุ่งหน้าไป
DocType: About Us Settings,Team Members,สมาชิกในทีม
apps/frappe/frappe/public/js/frappe/upload.js +74,Please attach a file or set a URL,กรุณาแนบไฟล์หรือตั้งค่า URL
DocType: DocField,Permissions,สิทธิ์
DocType: User,Get your globally recognized avatar from Gravatar.com,ได้รับการยอมรับทั่วโลกประจำตัวของคุณจาก Gravatar.com
DocType: Workflow State,plus-sign,บวกเซ็น
apps/frappe/frappe/__init__.py +760,App {0} is not installed,App {0} ไม่ได้ติดตั้ง
DocType: Event,Public,สาธารณะ
apps/frappe/frappe/public/js/frappe/ui/listing.js +52,Nothing to show,ไม่มีอะไรที่จะแสดง
apps/frappe/frappe/email/smtp.py +139,Email Account not setup. Please create a new Email Account from Setup > Email > Email Account,บัญชีอีเมล์ไม่ได้ติดตั้ง กรุณาสร้างบัญชีผู้ใช้อีเมล์ใหม่จากตั้งค่า> อีเมล์> บัญชีอีเมล์
apps/frappe/frappe/public/js/frappe/form/footer/attachments.js +209,Upload Attachment,อัพโหลดไฟล์แนบ
DocType: Block Module,Block Module,บล็อกโมดูล
apps/frappe/frappe/core/page/data_import_tool/data_import_main.html +3,Export Template,ส่งออกแม่แบบ
apps/frappe/frappe/public/js/frappe/views/reports/reportview.js +346,No permission to edit,ได้รับอนุญาตให้ แก้ไข ไม่
DocType: Block Module,Module,โมดูล
DocType: Email Alert,Send Alert On,แจ้งเตือนเมื่อวันที่
DocType: Web Form,Website URL,URL ของเว็บไซต์
DocType: Customize Form,"Customize Label, Print Hide, Default etc.","กำหนด Label, ซ่อนพิมพ์ ฯลฯ เริ่มต้น"
apps/frappe/frappe/print/page/print_format_builder/print_format_builder_start.html +16,Create a New Format,สร้างรูปแบบใหม่
DocType: Website Settings,Add a banner to the site. (small banners are usually good),เพิ่มแบนเนอร์ไปยังเว็บไซต์ (ป้ายขนาดเล็กมักจะดี)
DocType: Website Settings,Set Banner from Image,ตั้งป้ายโฆษณาจากภาพ
apps/frappe/frappe/templates/emails/new_user.html +3,A new account has been created for you at {0},บัญชีใหม่ได้รับการสร้างขึ้นสำหรับคุณที่ {0}
DocType: Print Format,Verdana,Verdana
apps/frappe/frappe/core/doctype/user/user.py +203,User {0} cannot be deleted,ผู้ใช้ {0} ไม่สามารถลบได้
apps/frappe/frappe/public/js/frappe/request.js +92,Another transaction is blocking this one. Please try again in a few seconds.,การทำธุรกรรมก็คือการปิดกั้นคนนี้ โปรดลองอีกครั้งในไม่กี่วินาที
DocType: Property Setter,Field Name,ชื่อเขต
apps/frappe/frappe/public/js/frappe/misc/utils.js +107,or,หรือ
apps/frappe/frappe/public/js/frappe/ui/toolbar/awesome_bar.js +92,module name...,ชื่อโมดูล ...
apps/frappe/frappe/templates/generators/web_form.html +264,Continue,ต่อ
DocType: Custom Field,Fieldname,fieldname
DocType: Workflow State,certificate,ใบรับรอง
DocType: User,Tile,กระเบื้อง
