DocType: OAuth Authorization Code,Scopes,ขอบเขต
DocType: About Us Settings,Company Introduction,แนะนำ บริษัท
DocType: DocField,Length,ระยะ
DocType: Feedback Trigger,"To add dynamic subject, use jinja tags like

<div><pre><code>{{ doc.name }} Delivered</code></pre></div>",ในการเพิ่มเรื่องแบบไดนามิกที่ใช้แท็ก jinja เช่น <div><pre> <code>{{ doc.name }} Delivered</code> </pre> </div>
DocType: Custom DocPerm,Apply User Permissions,สมัคร สิทธิ์ของผู้ใช้
DocType: User,Modules HTML,โมดูล HTML
apps/frappe/frappe/public/js/frappe/ui/field_group.js +79,Missing Values Required,ค่านิยม ที่จำเป็น ขาดหายไป
DocType: DocType,Other Settings,ตั้งค่าอื่น ๆ
DocType: Social Login Keys,Frappe,เย็นเป็นวุ้น
apps/frappe/frappe/public/js/frappe/list/list_permission_footer.html +12,{0} is not set,{0} ไม่ได้กำหนดค่า
DocType: Authentication Log,Operation,การทำงาน
DocType: Customize Form,Change Label (via Custom Translation),เปลี่ยนป้าย (ผ่านการแปลกำหนดเอง)
apps/frappe/frappe/share.py +136,No permission to {0} {1} {2},ไม่มีสิทธิ์ในการ {0} {1} {2}
apps/frappe/frappe/public/js/frappe/form/workflow.js +42,Note: Other permission rules may also apply,หมายเหตุ: กฎอนุญาตอื่น ๆ ที่ยังอาจมี
apps/frappe/frappe/permissions.py +270,Not allowed to access {0} with {1} = {2},ไม่ได้รับอนุญาต ในการเข้าถึง {0} ด้วย {1} = {2}
apps/frappe/frappe/templates/emails/print_link.html +2,View this in your browser,ดูในเบราว์เซอร์ของคุณ
DocType: DocType,Search Fields,เขตข้อมูลการค้นหา
DocType: OAuth Bearer Token,OAuth Bearer Token,OAuth ถือ Token
apps/frappe/frappe/public/js/legacy/print_format.js +124,No document selected,เอกสารไม่ได้เลือก
DocType: Event,Event,เหตุการณ์
apps/frappe/frappe/public/js/frappe/views/communication.js +537,"On {0}, {1} wrote:","เมื่อวันที่ {0}, {1} เขียน:"
apps/frappe/frappe/custom/doctype/customize_form/customize_form.js +133,Cannot delete standard field. You can hide it if you want,ไม่สามารถลบสนามมาตรฐาน คุณสามารถซ่อนได้ถ้าคุณต้องการ
DocType: Top Bar Item,For top bar,สำหรับ แถบด้านบน
apps/frappe/frappe/utils/bot.py +148,Could not identify {0},ไม่สามารถระบุ {0}
DocType: Address,Address,ที่อยู่
apps/frappe/frappe/templates/pages/integrations/payment-failed.html +3,Payment Failed,การชำระเงินล้มเหลว
DocType: Print Settings,In points. Default is 9.,ในจุดที่ เริ่มต้นคือ 9
DocType: OAuth Client,Redirect URIs,เปลี่ยนเส้นทางยูริ
DocType: Workflow State,heart,หัวใจ
DocType: Role,Desk Access,โต๊ะเขียนหนังสือ
DocType: Workflow State,minus,ลบ
apps/frappe/frappe/public/js/frappe/request.js +118,Server Error: Please check your server logs or contact tech support.,ข้อผิดพลาด ของเซิร์ฟเวอร์: กรุณาตรวจสอบ เซิร์ฟเวอร์ล็อก หรือติดต่อฝ่ายสนับสนุน ด้านเทคนิค ของคุณ
apps/frappe/frappe/core/doctype/user/user.py +182,Welcome email sent,ส่ง อีเมล์ต้อนรับ
apps/frappe/frappe/desk/page/setup_wizard/setup_wizard.js +370,Let's prepare the system for first use.,มาจัดเตรียมระบบสำหรับการใช้งานครั้งแรก
apps/frappe/frappe/desk/page/applications/applications.js +129,Featured,แนะนำ
apps/frappe/frappe/core/doctype/user/user.py +601,Already Registered,ลงทะเบียนเรียบร้อยแล้ว
DocType: System Settings,Float Precision,พรีซิชั่ลอย
apps/frappe/frappe/core/doctype/page/page.py +39,Only Administrator can edit,ผู้ดูแลระบบเท่านั้นที่สามารถแก้ไข
DocType: DocType,Editable Grid,ที่สามารถแก้ไขได้กริด
DocType: Property Setter,Property Setter,สถานที่ให้บริการ Setter
apps/frappe/frappe/core/page/user_permissions/user_permissions.js +222,Select User or DocType to start.,เลือก ผู้ใช้ หรือ DocType ที่จะเริ่มต้น
DocType: Web Form,Allow Print,อนุญาตให้พิมพ์
apps/frappe/frappe/desk/page/applications/applications.js +25,No Apps Installed,ปพลิเคชันที่ติดตั้ง
apps/frappe/frappe/custom/doctype/customize_form/customize_form.js +238,Mark the field as Mandatory,ทำเครื่องหมายฟิลด์เป็นข้อบังคับ
DocType: Communication,Clicked,คลิก
apps/frappe/frappe/public/js/legacy/form.js +945,No permission to '{0}' {1},ไม่ อนุญาตให้ ' {0} ' {1}
DocType: User,Google User ID,ID ผู้ใช้ Google
apps/frappe/frappe/email/doctype/auto_email_report/auto_email_report.js +38,Scheduled to send,การกำหนดตารางเวลาในการส่ง
DocType: DocType,Track Seen,ติดตามการกระทำ
apps/frappe/frappe/desk/form/utils.py +55,This method can only be used to create a Comment,วิธีการนี้สามารถนำมาใช้เพียงเพื่อสร้างแสดงความคิดเห็น
apps/frappe/frappe/public/js/frappe/list/doclistview.js +478,No {0} found,ไม่มี {0} พบ
apps/frappe/frappe/config/setup.py +264,Add custom forms.,เพิ่มรูปแบบที่กำหนดเอง
apps/frappe/frappe/desk/like.py +84,{0}: {1} in {2},{0}: {1} ใน {2}
apps/frappe/frappe/core/page/permission_manager/permission_manager_help.html +9,The system provides many pre-defined roles. You can add new roles to set finer permissions.,ระบบให้ บทบาท ที่กำหนดไว้ล่วงหน้า หลาย คุณสามารถเพิ่ม บทบาทใหม่ เพื่อกำหนดสิทธิ์ ปลีกย่อย
DocType: Communication,CC,CC
DocType: Address,Geo,Geo
apps/frappe/frappe/desk/page/applications/applications.js +46,Domains,โดเมน
DocType: Blog Category,Blog Category,หมวดหมู่บล็อก
apps/frappe/frappe/model/mapper.py +108,Cannot map because following condition fails: ,ไม่สามารถ map เพราะเงื่อนไขดังต่อไปนี้ล้มเหลว:
DocType: User,Roles HTML,HTML บทบาท
apps/frappe/frappe/website/doctype/website_settings/website_settings.js +84,Select a Brand Image first.,เลือกยี่ห้อภาพแรก
apps/frappe/frappe/core/doctype/user/user_list.js +12,Active,ใช้งาน
apps/frappe/frappe/public/js/frappe/form/templates/grid_form.html +13,Insert Below,ใส่ด้านล่าง
DocType: Kanban Board Column,Blue,สีฟ้า
apps/frappe/frappe/custom/doctype/customize_form/customize_form.js +166,All customizations will be removed. Please confirm.,การปรับแต่งทั้งหมดจะถูกลบออก กรุณายืนยัน
DocType: Page,Page HTML,HTML หน้า
apps/frappe/frappe/public/js/frappe/views/treeview.js +262,Further nodes can be only created under 'Group' type nodes,โหนด เพิ่มเติมสามารถ ถูกสร้างขึ้น ภายใต้ โหนด ' กลุ่ม ประเภท
DocType: Web Page,Header,ส่วนหัว
apps/frappe/frappe/public/js/frappe/model/model.js +80,Unknown Column: {0},ไม่ทราบ คอลัมน์ : {0}
apps/frappe/frappe/core/page/permission_manager/permission_manager.js +301,Users with role {0}:,ผู้ใช้ที่มี บทบาท {0}:
apps/frappe/frappe/desk/page/applications/applications.py +83,Installing App {0},การติดตั้ง App {0}
DocType: Print Format,Custom Format,รูปแบบที่กำหนดเอง
DocType: Workflow State,random,สุ่ม
DocType: Dropbox Settings,Integrations,Integrations
DocType: DocField,Section Break,แบ่งส่วน
DocType: Address,Warehouse,คลังสินค้า
,Messages,ข้อความ
apps/frappe/frappe/desk/page/applications/applications.js +49,Portal,พอร์ทัล
apps/frappe/frappe/desk/query_report.py +82,Must specify a Query to run,ต้องระบุแบบสอบถามที่จะเรียกใช้
apps/frappe/frappe/config/setup.py +73,"Language, Date and Time settings",ภาษา วันที่ และ เวลาที่ การตั้งค่า
DocType: Event,Saturday,วันเสาร์
DocType: User,Represents a User in the system.,หมายถึงผู้ใช้งานในระบบ
DocType: Communication,Label,ฉลาก
apps/frappe/frappe/desk/form/assign_to.py +140,"The task {0}, that you assigned to {1}, has been closed.","งาน {0} ที่คุณได้รับมอบหมายให้ {1}, ถูกปิด"
DocType: User,Modules Access,การเข้าถึงโมดูล
DocType: Print Format,Print Format Type,พิมพ์รูปแบบประเภท
apps/frappe/frappe/public/js/frappe/ui/toolbar/about.js +7,Open Source Applications for the Web,เปิดโปรแกรมที่มาสำหรับเว็บ
DocType: Website Theme,"Add the name of a ""Google Web Font"" e.g. ""Open Sans""",เพิ่มชื่อของ &quot;Google เว็บอักษร&quot; เช่น &quot;เปิดซอง&quot;
apps/frappe/frappe/public/js/frappe/request.js +123,Request Timed Out,ร้องขอหมดเวลา
DocType: DocType,Hide Toolbar,ซ่อนแถบเครื่องมือ
DocType: User,Last Active,เคลื่อนไหวล่าสุด
DocType: Email Account,SMTP Settings for outgoing emails,การตั้งค่า SMTP สำหรับอีเมลขาออก
apps/frappe/frappe/core/page/data_import_tool/data_import_tool.js +209,Import Failed,นำเข้าล้มเหลว
apps/frappe/frappe/templates/emails/password_update.html +3,Your password has been updated. Here is your new password,รหัสผ่านของคุณได้รับการปรับปรุง นี่คือรหัสผ่านใหม่ของคุณ
DocType: Email Account,Auto Reply Message,ข้อความตอบกลับอัตโนมัติ
DocType: Feedback Trigger,Condition,สภาพ
DocType: Contact,User ID,รหัสผู้ใช้
DocType: Communication,Sent,ส่ง
DocType: File,Lft,ซ้าย
DocType: User,Simultaneous Sessions,ประชุมพร้อมกัน
DocType: OAuth Client,Client Credentials,ข้อมูลประจำตัวของไคลเอ็นต์
apps/frappe/frappe/public/js/frappe/ui/toolbar/awesome_bar.js +169,Open a module or tool,เปิดโมดูลหรือเครื่องมือ
DocType: Communication,Delivery Status,สถานะการจัดส่งสินค้า
DocType: Module Def,App Name,ชื่อ แอพพลิเคชั่น
apps/frappe/frappe/templates/generators/web_form.html +385,Max file size allowed is {0}MB,ขนาดไฟล์สูงสุดที่อนุญาตคือ {0} MB
DocType: Workflow,"Field that represents the Workflow State of the transaction (if field is not present, a new hidden Custom Field will be created)",สนามที่แสดงถึงรัฐเวิร์กโฟลว์ของการทำธุรกรรม (ถ้าเขตข้อมูลไม่ใช่ปัจจุบันฟิลด์ที่กำหนดเองใหม่ซ่อนจะถูกสร้างขึ้น)
apps/frappe/frappe/utils/oauth.py +194,Email not verified with {1},อีเมล์ ไม่ได้ ตรวจสอบกับ {1}
DocType: Help Article,Knowledge Base Contributor,ฐานความรู้ผู้มีส่วนร่วม
DocType: Email Queue,Unsubscribe Method,วิธีการยกเลิกการเป็นสมาชิก
apps/frappe/frappe/print/page/print_format_builder/print_format_builder.js +674,Edit to add content,แก้ไขเพื่อเพิ่มเนื้อหา
apps/frappe/frappe/public/js/frappe/views/communication.js +80,Select Languages,เลือกภาษา
apps/frappe/frappe/__init__.py +499,No permission for {0},ไม่อนุญาตให้ {0}
DocType: DocType,Advanced,ก้าวหน้า
apps/frappe/frappe/integrations/doctype/razorpay_settings/razorpay_settings.py +90,Seems API Key or API Secret is wrong !!!,ดูเหมือนว่าคีย์ API หรือ API ลับที่ไม่ถูกต้อง !!!
apps/frappe/frappe/templates/emails/auto_reply.html +3,Reference: {0} {1},อ้างอิง: {0} {1}
DocType: File,Attached To Name,ที่แนบมากับชื่อ
DocType: Address,Address Type,ประเภทของที่อยู่
apps/frappe/frappe/email/receive.py +91,Invalid User Name or Support Password. Please rectify and try again.,ชื่อผู้ใช้งาน ที่ไม่ถูกต้อง หรือ การสนับสนุน ผ่าน กรุณา แก้ไข และลองอีกครั้ง
DocType: Email Account,Login Id is Different,เข้าสู่ระบบที่แตกต่างกันคือ Id
DocType: Email Account,Yahoo Mail,จดหมาย Yahoo
apps/frappe/frappe/limits.py +69,Your subscription will expire tomorrow.,การสมัครของคุณจะหมดอายุในวันพรุ่งนี้
apps/frappe/frappe/core/page/permission_manager/permission_manager.js +482,Saved!,ที่บันทึกไว้!
apps/frappe/frappe/desk/page/activity/activity_row.html +21,Updated {0}: {1},Updated {0}: {1}
DocType: DocType,User Cannot Create,ผู้ใช้ไม่สามารถสร้าง
apps/frappe/frappe/core/doctype/file/file.py +295,Folder {0} does not exist,โฟลเดอร์ {0} ไม่อยู่
apps/frappe/frappe/core/page/user_permissions/user_permissions.js +27,"These will also be set as default values for those links, if only one such permission record is defined.",เหล่านี้จะ ถูกกำหนดเป็น ค่าเริ่มต้น สำหรับการเชื่อมโยง เหล่านั้น ถ้า เพียงคนเดียวที่ ได้รับอนุญาต ดังกล่าว บันทึก ถูกกำหนดไว้
DocType: Customize Form,Enter Form Type,ป้อนประเภทแบบฟอร์ม
apps/frappe/frappe/public/js/frappe/list/list_sidebar_stat.html +5,No records tagged.,ระเบียนที่ไม่มีการติดแท็ก
DocType: User,Send Password Update Notification,ส่งแจ้งเตือนการปรับปรุงรหัสผ่าน
apps/frappe/frappe/public/js/legacy/form.js +63,"Allowing DocType, DocType. Be careful!","ช่วยให้ DocType , DocType ระวัง !"
apps/frappe/frappe/config/core.py +32,"Customized Formats for Printing, Email","รูปแบบที่กำหนดเองสำหรับการพิมพ์, อีเมล์"
apps/frappe/frappe/public/js/frappe/desk.js +357,Updated To New Version,การปรับปรุงเพื่อให้รุ่นใหม่
DocType: Custom Field,Depends On,ขึ้นอยู่กับ
DocType: Kanban Board Column,Green,สีเขียว
DocType: Custom DocPerm,Additional Permissions,สิทธิ์ เพิ่มเติม
apps/frappe/frappe/templates/includes/comments/comments.html +21,Login to comment,เข้าสู่ระบบเพื่อแสดงความคิดเห็น
apps/frappe/frappe/core/page/data_import_tool/data_import_tool.py +13,Start entering data below this line,เริ่มป้อนข้อมูลด้านล่างบรรทัดนี้
DocType: Workflow State,retweet,retweet
apps/frappe/frappe/core/page/data_import_tool/data_import_main.html +53,Update the template and save in CSV (Comma Separate Values) format before attaching.,อัพเดทแม่แบบและบันทึกในรูปแบบ CSV (Comma เฉพาะกิจค่า) รูปแบบก่อนที่จะแนบ
apps/frappe/frappe/custom/doctype/customize_form/customize_form.js +220,Specify the value of the field,ระบุค่าของฟิลด์
DocType: Report,Disabled,ถูกปิดการใช้งาน
DocType: Workflow State,eye-close,ตาใกล้
apps/frappe/frappe/integrations/doctype/paypal_settings/paypal_settings.py +93,Please select another payment method. {0} does not support transactions in currency '{1}',โปรดเลือกวิธีการชำระเงินอีกครั้ง {0} ไม่สนับสนุนการทำธุรกรรมในสกุลเงิน &#39;{1}&#39;
DocType: OAuth Provider Settings,OAuth Provider Settings,การตั้งค่าของผู้ให้บริการ OAuth
apps/frappe/frappe/public/js/frappe/request.js +309,Report this issue,รายงานปัญหานี้
apps/frappe/frappe/public/js/frappe/form/save.js +78,Name is required,ชื่อจะต้อง
DocType: Custom Script,Adds a custom script (client or server) to a DocType,เพิ่มสคริปต์ที่กำหนดเอง (ไคลเอนต์หรือเซิร์ฟเวอร์) เพื่อ DocType
DocType: Address,City/Town,เมือง / จังหวัด
apps/frappe/frappe/email/doctype/email_alert/email_alert.py +68,Cannot set Email Alert on Document Type {0},ไม่สามารถตั้งค่าอีเมล์แจ้งเตือนเกี่ยวกับชนิดเอกสาร {0}
DocType: Address,Is Your Company Address,คือที่อยู่ บริษัท ของคุณ
apps/frappe/frappe/public/js/frappe/form/templates/grid_form.html +4,Editing Row,แก้ไขแถว
DocType: Workflow Action,Workflow Action Master,แม่แบบกระบวนการทำงาน
DocType: Custom Field,Field Type,ฟิลด์ชนิด
apps/frappe/frappe/utils/data.py +449,only.,เท่านั้น
apps/frappe/frappe/utils/password_strength.py +113,Avoid years that are associated with you.,หลีกเลี่ยงการปีที่เกี่ยวข้องกับคุณ
apps/frappe/frappe/public/js/frappe/views/reports/reportview.js +646,Descending,น้อย
apps/frappe/frappe/email/receive.py +57,Invalid Mail Server. Please rectify and try again.,เซิร์ฟเวอร์ของจดหมายที่ ไม่ถูกต้อง กรุณา แก้ไข และลองอีกครั้ง
DocType: DocField,"For Links, enter the DocType as range.
For Select, enter list of Options, each on a new line.",สำหรับลิงค์ป้อน DocType เป็นช่วง สำหรับการเลือกใส่รายชื่อของตัวเลือกในแต่ละบรรทัดใหม่
DocType: Workflow State,film,ฟิล์ม
apps/frappe/frappe/model/db_query.py +363,No permission to read {0},ไม่อนุญาตให้อ่าน {0}
apps/frappe/frappe/config/desktop.py +16,Tools,เครื่องมือ
apps/frappe/frappe/utils/password_strength.py +112,Avoid recent years.,หลีกเลี่ยงการปีที่ผ่านมา
apps/frappe/frappe/utils/nestedset.py +229,Multiple root nodes not allowed.,โหนด ราก หลาย ไม่ได้รับอนุญาต
DocType: OAuth Client,"If checked, users will not see the Confirm Access dialog.",หากการตรวจสอบผู้ใช้จะไม่เห็นกล่องโต้ตอบยืนยันการเข้า
apps/frappe/frappe/public/js/frappe/views/reports/reportview.js +527,ID field is required to edit values using Report. Please select the ID field using the Column Picker,ข้อมูล ID จะต้องแก้ไขค่าใช้รายงาน กรุณาเลือกฟิลด์ ID ใช้ Picker คอลัมน์
apps/frappe/frappe/public/js/frappe/model/model.js +25,Comments,ความเห็น
apps/frappe/frappe/public/js/frappe/ui/modal.html +17,Confirm,ยืนยัน
apps/frappe/frappe/public/js/frappe/views/reports/query_report.js +49,Collapse All,ยุบทั้งหมด
apps/frappe/frappe/desk/page/applications/applications.js +164,Install {0}?,ติดตั้ง {0}?
apps/frappe/frappe/www/login.html +71,Forgot Password?,ลืมรหัสผ่าน?
DocType: System Settings,yyyy-mm-dd,ปปปป-ดด-วว
apps/frappe/frappe/public/js/frappe/model/model.js +17,ID,ID
apps/frappe/frappe/integrations/doctype/razorpay_settings/razorpay_settings.py +110,Server Error,เซิร์ฟเวอร์ผิดพลาด
apps/frappe/frappe/email/doctype/email_account/email_account.py +43,Login Id is required,Id จะต้องเข้าสู่ระบบ
DocType: Website Slideshow,Website Slideshow,สไลด์โชว์เว็บไซต์
apps/frappe/frappe/public/js/frappe/form/templates/grid_body.html +6,No Data,ไม่มีข้อมูล
DocType: Website Settings,"Link that is the website home page. Standard Links (index, login, products, blog, about, contact)",เชื่อมโยง ที่เป็นหน้าแรกของเว็บไซต์ ลิงค์ มาตรฐาน ( ดัชนี เข้าสู่ระบบ ผลิตภัณฑ์ บล็อก เกี่ยวกับการ ติดต่อ)
apps/frappe/frappe/email/doctype/email_account/email_account.py +162,Authentication failed while receiving emails from Email Account {0}. Message from server: {1},รับรองความถูกต้องล้มเหลวในขณะที่ได้รับอีเมลจากบัญชีอีเมล {0} ข้อความจากเซิร์ฟเวอร์: {1}
apps/frappe/frappe/public/js/frappe/views/reports/query_report.js +53,values and dates,ค่านิยมและวันที่
DocType: Custom Field,Custom Field,ฟิลด์ที่กำหนดเอง
apps/frappe/frappe/email/doctype/email_alert/email_alert.py +25,Please specify which date field must be checked,โปรดระบุที่ฟิลด์วันจะต้องตรวจสอบ
DocType: Custom DocPerm,Set User Permissions,กำหนด สิทธิ์ของผู้ใช้
DocType: Email Account,Email Account Name,อีเมล์ชื่อบัญชี
apps/frappe/frappe/core/page/permission_manager/permission_manager.js +251,Select Document Types,เลือกประเภทของเอกสาร
DocType: File,old_parent,old_parent
apps/frappe/frappe/config/desk.py +13,"Newsletters to contacts, leads.",จดหมายข่าวไปยังรายชื่อนำไปสู่
DocType: Email Account,"e.g. ""Support"", ""Sales"", ""Jerry Yang""","เช่น ""การสนับสนุน "","" ขาย "","" เจอร์รี่ หยาง"""
apps/frappe/frappe/public/js/frappe/form/workflow.js +115,Document Status transition from,เอกสารการเปลี่ยนสถานะจาก
DocType: DocField,Description,คำอธิบาย
DocType: Print Settings,Repeat Header and Footer in PDF,ทำซ้ำส่วนหัวและท้ายในรูปแบบไฟล์ PDF
DocType: Address Template,Is Default,เป็นค่าเริ่มต้น
DocType: User,Facebook User ID,Facebook ID ผู้ใช้
DocType: Workflow State,fast-forward,อย่างรวดเร็วไปข้างหน้า
DocType: Communication,Communication,การสื่อสาร
apps/frappe/frappe/print/page/print_format_builder/print_format_builder_column_selector.html +1,"Check columns to select, drag to set order.",ตรวจสอบคอลัมน์เพื่อเลือกลากเพื่อตั้งค่าลำดับ
