apps/frappe/frappe/core/doctype/user/user.py +607,"Too many users signed up recently, so the registration is disabled. Please try back in an hour",ผู้ใช้จำนวนมากเกินไปลงนามเมื่อเร็ว ๆ นี้เพื่อลงทะเบียนเป็นคนพิการ โปรดลองกลับมาในอีกหนึ่งชั่วโมง
apps/frappe/frappe/core/page/permission_manager/permission_manager.js +375,Add New Permission Rule,เพิ่มกฎการอนุญาตใหม่
apps/frappe/frappe/public/js/frappe/form/link_selector.js +24,You can use wildcard %,คุณสามารถใช้สัญลักษณ์แทน%
apps/frappe/frappe/public/js/frappe/upload.js +131,"Only image extensions (.gif, .jpg, .jpeg, .tiff, .png, .svg) allowed","เฉพาะส่วนขยายของภาพ (.gif, .jpg, .jpeg, .tiff, .png, SVG) ผู้ที่ได้รับอนุญาต"
DocType: DocType,Database Engine,โปรแกรมฐานข้อมูล
DocType: Customize Form,"Fields separated by comma (,) will be included in the ""Search By"" list of Search dialog box","ทุ่งคั่นด้วยเครื่องหมายจุลภาค (,) จะรวมอยู่ใน &quot;ค้นหาโดย&quot; รายการการค้นหากล่องโต้ตอบ"
apps/frappe/frappe/website/doctype/website_theme/website_theme.py +35,Please Duplicate this Website Theme to customize.,กรุณาซ้ำธีมเว็บไซต์นี้เพื่อปรับแต่ง
DocType: DocField,Text Editor,แก้ไขข้อความ
apps/frappe/frappe/config/website.py +73,Settings for About Us Page.,การตั้งค่าสำหรับหน้าเกี่ยวกับเรา
apps/frappe/frappe/print/page/print_format_builder/print_format_builder.js +679,Edit Custom HTML,แก้ไข HTML ที่กำหนดเอง
DocType: Error Snapshot,Error Snapshot,ภาพรวมข้อผิดพลาด
apps/frappe/frappe/public/js/frappe/ui/filters/filters.js +701,In,ใน
DocType: Email Alert,Value Change,ค่าเปลี่ยน
DocType: Standard Reply,Standard Reply,ตอบดูมาตรฐาน
apps/frappe/frappe/custom/doctype/customize_form/customize_form.js +232,Width of the input box,ความกว้างของกล่องใส่
DocType: UserRole,UserRole,UserRole
DocType: Address,Subsidiary,บริษัท สาขา
DocType: System Settings,In Hours,ในชั่วโมง
apps/frappe/frappe/public/js/frappe/list/doclistview.js +844,With Letterhead,ด้วยจดหมาย
apps/frappe/frappe/email/smtp.py +189,Invalid Outgoing Mail Server or Port,เซิร์ฟเวอร์ อีเมลขาออก ที่ไม่ถูกต้อง หรือ พอร์ต
DocType: Custom DocPerm,Write,เขียน
apps/frappe/frappe/core/doctype/report/report.py +33,Only Administrator allowed to create Query / Script Reports,เฉพาะผู้ดูแลระบบอนุญาตให้สร้างรายงานคำ / Script
apps/frappe/frappe/public/js/frappe/form/save.js +13,Updating,อัปเดต
DocType: File,Preview,แสดงตัวอย่าง
apps/frappe/frappe/desk/doctype/bulk_update/bulk_update.js +8,"Field ""value"" is mandatory. Please specify value to be updated",ฟิลด์ &quot;ค่า&quot; มีผลบังคับใช้ กรุณาระบุค่าได้รับการปรับปรุง
DocType: Customize Form,Use this fieldname to generate title,ใช้ fieldname นี้เพื่อสร้างชื่อ
apps/frappe/frappe/email/doctype/email_group/email_group.js +13,Import Email From,นำเข้าอีเมล์จาก
apps/frappe/frappe/email/doctype/contact/contact.js +20,Invite as User,เชิญผู้ใช้
apps/frappe/frappe/public/js/frappe/views/communication.js +83,Select Attachments,เลือกสิ่งที่แนบ
apps/frappe/frappe/model/naming.py +95, for {0},สำหรับ {0}
apps/frappe/frappe/templates/generators/web_form.html +654,There were errors. Please report this.,มีข้อผิดพลาดอยู่ กรุณารายงาน
apps/frappe/frappe/public/js/legacy/form.js +175,You are not allowed to print this document,คุณยังไม่ได้ รับอนุญาตให้ พิมพ์เอกสาร นี้
apps/frappe/frappe/public/js/frappe/views/reports/query_report.js +352,Loading Report,โหลดรายงาน
apps/frappe/frappe/limits.py +66,Your subscription will expire today.,การสมัครของคุณจะหมดอายุในวันนี้
DocType: Page,Standard,มาตรฐาน
apps/frappe/frappe/public/js/frappe/form/templates/form_sidebar.html +46,Attach File,แนบไฟล์
apps/frappe/frappe/templates/emails/password_update.html +1,Password Update Notification,รหัสผ่านปรับปรุงการแจ้งเตือน
apps/frappe/frappe/desk/page/backups/backups.html +13,Size,ขนาด
apps/frappe/frappe/public/js/frappe/form/footer/assign_to.js +59,Assignment Complete,ที่ได้รับมอบหมายให้เสร็จสมบูรณ์
DocType: Custom DocPerm,User Permission DocTypes,ผู้ใช้สิทธิ์ doctypes
DocType: Desktop Icon,Idx,IDX
DocType: Deleted Document,New Name,ชื่อใหม่
apps/frappe/frappe/public/js/frappe/form/footer/assign_to.js +112,Please save the document before removing assignment,กรุณาบันทึกเอกสารก่อนที่จะลบที่ได้รับมอบหมาย
apps/frappe/frappe/public/js/frappe/form/templates/grid_form.html +10,Insert Above,แทรกเหนือ
apps/frappe/frappe/utils/password_strength.py +163,Common names and surnames are easy to guess.,ชื่อสามัญชื่อและนามสกุลเป็นเรื่องง่ายที่จะคาดเดา
apps/frappe/frappe/public/js/frappe/model/indicator.js +51,Draft,ร่าง
apps/frappe/frappe/utils/password_strength.py +153,This is similar to a commonly used password.,นี้จะคล้ายกับรหัสผ่านที่ใช้กันทั่วไป
DocType: User,Female,หญิง
DocType: Print Settings,Modern,ทันสมัย
apps/frappe/frappe/desk/page/applications/applications.js +61,Search Results,ผลการค้นหา
apps/frappe/frappe/public/js/frappe/model/indicator.js +19,Not Saved,ที่บันทึกไว้ไม่ได้
DocType: Communication,Replied,Replied
DocType: Newsletter,Test,ทดสอบ
DocType: Custom Field,Default Value,ค่าเริ่มต้น
apps/frappe/frappe/public/js/frappe/ui/messages.js +217,Verify,ตรวจสอบ
DocType: Workflow Document State,Update Field,ปรับปรุงเขต
apps/frappe/frappe/desk/doctype/bulk_update/bulk_update.py +36,Validation failed for {0},การตรวจสอบล้มเหลวสำหรับ {0}
apps/frappe/frappe/desk/page/applications/applications.js +50,Regional Extensions,ส่วนขยายในภูมิภาค
DocType: LDAP Settings,Base Distinguished Name (DN),ฐานชื่อ (DN)
apps/frappe/frappe/core/doctype/communication/email.py +141,Leave this conversation,ออกจากการสนทนานี้
apps/frappe/frappe/model/base_document.py +460,Options not set for link field {0},ไม่ได้ตั้งค่า ตัวเลือก สำหรับฟิลด์ ลิงค์ {0}
DocType: DocType,"Must be of type ""Attach Image""",ต้องเป็นชนิด &quot;แนบรูปภาพ&quot;
apps/frappe/frappe/core/page/data_import_tool/data_import_main.html +25,Unselect All,ไม่เลือกทั้งหมด
apps/frappe/frappe/custom/doctype/customize_form/customize_form.py +194,You cannot unset 'Read Only' for field {0},คุณไม่สามารถล้าง &#39;อ่านอย่างเดียว&#39; สำหรับเขตข้อมูล {0}
apps/frappe/frappe/desk/page/setup_wizard/setup_wizard_page.html +18,Complete Setup,การติดตั้ง เสร็จสมบูรณ์
DocType: Workflow State,asterisk,เครื่องหมายดอกจัน
apps/frappe/frappe/core/page/data_import_tool/exporter.py +61,Please do not change the template headings.,กรุณาอย่าเปลี่ยนหัวแม่แบบ
DocType: Communication,Linked,ลิงค์แล้ว
apps/frappe/frappe/public/js/frappe/form/save.js +84,Enter the name of the new {0},ป้อนชื่อของใหม่ {0}
DocType: User,Frappe User ID,Frappe รหัสผู้ใช้
apps/frappe/frappe/config/desk.py +54,Activity log of all users.,บันทึกกิจกรรมของผู้ใช้ทั้งหมด
DocType: Workflow State,shopping-cart,ช้อปปิ้งรถเข็น
apps/frappe/frappe/public/js/frappe/list/doclistview.js +578,Week,สัปดาห์
DocType: Social Login Keys,Google,Google
apps/frappe/frappe/public/js/frappe/ui/sort_selector.js +140,Most Used,ใช้มากที่สุด
DocType: Dropbox Settings,Backup Frequency,ความถี่ในการสำรองข้อมูล
DocType: Workflow State,Inverse,ผกผัน
DocType: DocField,User permissions should not apply for this Link,สิทธิ์ผู้ใช้ ไม่ควร ใช้สำหรับ การเชื่อมโยง นี้
apps/frappe/frappe/model/naming.py +95,Invalid naming series (. missing),ชุดการตั้งชื่อไม่ถูกต้อง (. หายไป)
apps/frappe/frappe/core/page/usage_info/usage_info.html +20,Current Users,ผู้ใช้ในปัจจุบัน
DocType: Language,Language,ภาษา
apps/frappe/frappe/templates/pages/integrations/razorpay_checkout.py +27,Some information is missing,ข้อมูลบางอย่างจะหายไป
DocType: Custom DocPerm,Cancel,ยกเลิก
apps/frappe/frappe/public/js/frappe/views/reports/reportview.js +109,Add to Desktop,เพิ่มในสก์ท็อป
apps/frappe/frappe/core/doctype/file/file.py +136,File {0} does not exist,ไฟล์ {0} ไม่อยู่
apps/frappe/frappe/core/page/data_import_tool/exporter.py +98,Leave blank for new records,เว้นว่างไว้สำหรับบันทึกใหม่
apps/frappe/frappe/config/website.py +63,List of themes for Website.,รายชื่อของรูปแบบสำหรับเว็บไซต์
DocType: Authentication Log,Logout,ออกจากระบบ
apps/frappe/frappe/core/page/permission_manager/permission_manager_help.html +26,Permissions at higher levels are Field Level permissions. All Fields have a Permission Level set against them and the rules defined at that permissions apply to the field. This is useful in case you want to hide or make certain field read-only for certain Roles.,สิทธิ์ในระดับที่สูงมีสิทธิ์ในระดับเขต ฟิลด์ทั้งหมดมีชุดการระดับสิทธิ์กับพวกเขาและกฎระเบียบที่กำหนดไว้ว่าสิทธิ์นำไปใช้กับข้อมูล นี้จะเป็นประโยชน์ในกรณีที่คุณต้องการที่จะซ่อนหรือทำให้ข้อมูลบางอย่างอ่านอย่างเดียวสำหรับบทบาทบางอย่าง
apps/frappe/frappe/core/page/permission_manager/permission_manager_help.html +38,"If these instructions where not helpful, please add in your suggestions on GitHub Issues.",ถ้า คำแนะนำเหล่านี้ ที่ ไม่เป็นประโยชน์ โปรดเพิ่ม ใน คำแนะนำของคุณ เกี่ยวกับ GitHub ปัญหา
DocType: Workflow State,bookmark,คั่น
DocType: Note,Note,หมายเหตุ
apps/frappe/frappe/core/doctype/error_snapshot/error_snapshot.html +32,Error Report,รายงานข้อผิดพลาด
apps/frappe/frappe/core/doctype/doctype/doctype.py +506,Timeline field must be a valid fieldname,ข้อมูล Timeline จะต้องเป็น fieldname ที่ถูกต้อง
DocType: Currency,Symbol,สัญญลักษณ์
apps/frappe/frappe/model/base_document.py +529,Row #{0}:,แถว # {0}:
apps/frappe/frappe/core/doctype/user/user.py +134,New password emailed,ส่ง รหัสผ่านใหม่
apps/frappe/frappe/auth.py +242,Login not allowed at this time,เข้าสู่ระบบ ไม่ได้รับอนุญาต ในเวลานี้
DocType: Async Task,Runtime,Runtime
DocType: Contact Us Settings,Introduction,การแนะนำ
apps/frappe/frappe/public/js/frappe/ui/filters/filters.js +24,Hide Filters,ซ่อนตัวกรอง
DocType: DocType,Permissions Settings,การตั้งค่าสิทธิ์
apps/frappe/frappe/www/list.html +3,{0} List,{0} รายชื่อ
apps/frappe/frappe/desk/form/assign_to.py +41,Already in user's To Do list,อยู่ในรายการสิ่งที่ต้องทำของผู้ใช้แล้ว
DocType: Email Account,Enable Outgoing,เปิดใช้งานขาออก
DocType: Address,Fax,แฟกซ์
apps/frappe/frappe/config/setup.py +268,Custom Tags,แท็กที่กำหนดเอง
apps/frappe/frappe/desk/page/applications/applications.js +147,No matching apps found,ไม่พบปพลิเคชันที่ตรงกัน
DocType: Communication,Submitted,Submitted
DocType: System Settings,Email Footer Address,ที่อยู่อีเมล์ท้าย
apps/frappe/frappe/public/js/frappe/form/grid.js +552,Table updated,ตารางการปรับปรุง
DocType: Communication,Timeline DocType,DocType Timeline
DocType: DocField,Text,ข้อความ
apps/frappe/frappe/config/setup.py +150,Standard replies to common queries.,มาตรฐานตอบแบบสอบถามที่พบบ่อย
apps/frappe/frappe/email/doctype/email_account/email_account_list.js +14,Default Sending,เริ่มต้นส่ง
DocType: Workflow State,volume-off,ปริมาณออก
apps/frappe/frappe/public/js/frappe/form/footer/timeline_item.html +160,Liked by {0},ชอบ {0}
DocType: Footer Item,Footer Item,ส่วนท้ายของรายการ
,Download Backups,ดาวน์โหลดสำรอง
apps/frappe/frappe/core/doctype/file/test_file.py +43,Home/Test Folder 1,หน้าแรก / โฟลเดอร์ทดสอบ 1
apps/frappe/frappe/core/page/data_import_tool/data_import_main.html +65,"Do not update, but insert new records.",ไม่อัปเดต แต่แทรกระเบียนใหม่
apps/frappe/frappe/public/js/frappe/form/footer/assign_to.js +140,Assign to me,กำหนดให้ฉัน
apps/frappe/frappe/core/doctype/file/file_list.js +81,Edit Folder,แก้ไขโฟลเดอร์
DocType: DocField,Dynamic Link,การเชื่อมโยงแบบไดนามิก
apps/frappe/frappe/core/report/feedback_ratings/feedback_ratings.js +40,To Date,นัด
apps/frappe/frappe/core/page/background_jobs/background_jobs_outer.html +5,Show failed jobs,แสดงงานล้มเหลว
apps/frappe/frappe/email/page/email_inbox/inbox_email.html +28,Details,รายละเอียด
DocType: Property Setter,DocType or Field,DocType หรือสาขา
DocType: Communication,Soft-Bounced,นุ่มเด้ง
apps/frappe/frappe/core/page/permission_manager/permission_manager_help.html +3,Quick Help for Setting Permissions,ความช่วยเหลือด่วนสำหรับการตั้งค่าสิทธิ์
DocType: Tag Doc Category,Doctype to Assign Tags,ประเภทเอกสารที่จะกำหนดแท็ก
apps/frappe/frappe/core/doctype/error_snapshot/error_snapshot.js +9,Show Relapses,แสดงอาการกำเริบ
DocType: Report,Report Builder,สร้างรายงาน
DocType: Async Task,Task Name,ชื่องาน
DocType: Communication,Workflow,กระบวนการทำงาน
DocType: Workflow State,Upload,อัปโหลด
DocType: System Settings,Date Format,รูปแบบวันที่
apps/frappe/frappe/website/doctype/blog_post/blog_post_list.js +7,Not Published,ไม่ได้เผยแพร่
apps/frappe/frappe/config/setup.py +198,"Actions for workflow (e.g. Approve, Cancel).","การดำเนินการสำหรับขั้นตอนการทำงานิ (เช่น อนุมัติ, ยกเลิก )"
DocType: Email Flag Queue,flag,ธง
DocType: Web Page,Text Align,ข้อความตําแหน่ง
apps/frappe/frappe/model/naming.py +176,Name cannot contain special characters like {0},ชื่อไม่สามารถมีตัวอักษรพิเศษเช่น {0}
DocType: Contact Us Settings,Forward To Email Address,ไปข้างหน้า เพื่อ ที่อยู่อีเมล์
apps/frappe/frappe/core/doctype/doctype/doctype.py +469,Title field must be a valid fieldname,ฟิลด์ จะต้องfieldname ถูกต้อง
apps/frappe/frappe/config/core.py +7,Documents,เอกสาร
apps/frappe/frappe/www/me.html +22,Edit Profile,แก้ไขโปรไฟล์
DocType: Kanban Board Column,Archived,เก็บไว้
DocType: System Settings,Session Expiry in Hours e.g. 06:00,หมดอายุในเซสชั่นชั่วโมงเช่น 06:00
DocType: Customize Form Field,"This field will appear only if the fieldname defined here has value OR the rules are true (examples): 
myfield
eval:doc.myfield=='My Value'
eval:doc.age&gt;18",ฟิลด์นี้จะปรากฏเฉพาะถ้า fieldname ที่กำหนดไว้ที่นี่มีค่าหรือกฎระเบียบที่เป็นจริง (ตัวอย่าง): myfield EVAL: doc.myfield == &#39;ค่าของฉัน&#39; EVAL: doc.age&gt; 18
apps/frappe/frappe/core/page/permission_manager/permission_manager_help.html +35,"Once you have set this, the users will only be able access documents (eg. Blog Post) where the link exists (eg. Blogger).",เมื่อคุณได้ตั้ง นี้ผู้ใช้ จะมีเพียง เอกสาร การเข้าถึง สามารถ ( เช่น โพสต์ บล็อก ) ที่ การเชื่อมโยง ที่มีอยู่ (เช่น Blogger )
DocType: Error Log,Log of Scheduler Errors,เข้าสู่ระบบของข้อผิดพลาดจัดตารางเวลา
DocType: User,Bio,ไบโอ
DocType: OAuth Client,App Client Secret,ลับไคลเอ็นต์ของโปรแกรมประยุกต์
apps/frappe/frappe/public/js/frappe/form/save.js +12,Submitting,ส่ง
apps/frappe/frappe/desk/page/activity/activity.js +83,Show Likes,แสดงที่ชอบ
DocType: DocType,UPPER CASE,UPPER CASE
apps/frappe/frappe/print/page/print_format_builder/print_format_builder.js +189,Custom HTML,ที่กำหนดเอง HTML
apps/frappe/frappe/core/doctype/file/file_list.js +78,Enter folder name,ป้อนชื่อโฟลเดอร์
apps/frappe/frappe/core/page/permission_manager/permission_manager.js +54,Select Role,เลือกบทบาท
DocType: Communication,Deleted,ที่ถูกลบ
DocType: Workflow State,adjust,ปรับ
DocType: Web Form,Sidebar Settings,การตั้งค่าแถบด้านข้าง
DocType: Website Settings,Disable Customer Signup link in Login page,ปิดการใช้งานของลูกค้าที่ลิงค์สมัครสมาชิกในหน้าเข้าสู่ระบบ
apps/frappe/frappe/core/report/todo/todo.py +20,Assigned To/Owner,มอบหมายให้ / เจ้าของ
DocType: Workflow State,arrow-left,ลูกศรซ้าย
apps/frappe/frappe/desk/page/applications/applications.js +77,Installed,การติดตั้ง
apps/frappe/frappe/desk/page/applications/applications.js +47,Developer Tools,เครื่องมือสำหรับนักพัฒนา
DocType: Workflow State,fullscreen,เต็มจอ
apps/frappe/frappe/public/js/frappe/views/reports/query_report.js +212,You are not allowed to make PDF for this report,คุณยังไม่ได้รับอนุญาตให้ PDF สำหรับรายงานนี้
apps/frappe/frappe/limits.py +31,Your subscription expired on {0},การสมัครของคุณหมดอายุวันที่ {0}
DocType: Event,Ref Name,ชื่อ Ref
DocType: Web Page,Center,ศูนย์
apps/frappe/frappe/core/doctype/error_snapshot/error_snapshot_list.js +11,First Level,ระดับแรก
DocType: Workflow Document State,Represents the states allowed in one document and role assigned to change the state.,ที่เป็นตัวแทนของรัฐที่ได้รับอนุญาตในเอกสารและบทบาทที่ได้รับมอบหมายในการเปลี่ยนสถานะ
apps/frappe/frappe/custom/doctype/customize_form/customize_form.js +71,Refresh Form,แบบฟอร์มรีเฟรช
DocType: DocField,Select,เลือก
apps/frappe/frappe/utils/csvutils.py +27,File not attached,ไฟล์ ที่แนบมา ไม่ได้
apps/frappe/frappe/utils/password_strength.py +88,"Repeats like ""aaa"" are easy to guess",ซ้ำเช่น &quot;AAA&quot; เป็นเรื่องง่ายที่จะคาดเดา
DocType: Top Bar Item,"If you set this, this Item will come in a drop-down under the selected parent.",ถ้าคุณตั้งค่า นี้ รายการ นี้ จะมาในแบบเลื่อนลง ภายใต้การ ปกครอง ที่เลือก
DocType: Print Format,Show Section Headings,แสดงส่วนหัว
DocType: Bulk Update,Limit,จำกัด
apps/frappe/frappe/model/db_query.py +470,Please select atleast 1 column from {0} to sort,กรุณาเลือก atleast 1 คอลัมน์ จาก {0} การจัดเรียง
apps/frappe/frappe/www/print.py +219,No template found at path: {0},พบได้ที่เส้นทางแม่ไม่มี: {0}
apps/frappe/frappe/core/page/data_import_tool/data_import_main.html +77,Submit after importing.,ส่งหลังจากการนำเข้า
DocType: Communication,Cancelled,ยกเลิกแล้ว
DocType: Standard Reply,Standard Reply Help,ตอบช่วยเหลือมาตรฐาน
DocType: Blogger,Avatar,รูปส่วนตัว
DocType: Blogger,Posts,กระทู้
apps/frappe/frappe/core/doctype/doctype/doctype.py +329,"DocType's name should start with a letter and it can only consist of letters, numbers, spaces and underscores",ชื่อ DocType ควรเริ่มต้นด้วยตัวอักษรและมันอาจประกอบด้วยตัวอักษรตัวเลขและขีดช่องว่าง
DocType: Integration Request,Integration Request,ขอบูรณาการ
apps/frappe/frappe/public/js/frappe/views/communication.js +522,Dear,น่ารัก
DocType: Contact,Accounts User,ผู้ใช้งานบัญชี
DocType: Web Page,HTML for header section. Optional,HTML สำหรับ ส่วนหัว ไม่จำเป็น
apps/frappe/frappe/public/js/frappe/form/templates/form_sidebar.html +13,This feature is brand new and still experimental,คุณลักษณะนี้จะเป็นแบรนด์ใหม่และยังคงทดลอง
apps/frappe/frappe/model/rename_doc.py +355,Maximum {0} rows allowed,สูงสุด {0} แถว รับอนุญาต
DocType: Email Unsubscribe,Global Unsubscribe,ยกเลิกทั่วโลก
apps/frappe/frappe/utils/password_strength.py +151,This is a very common password.,นี่คือรหัสผ่านที่พบบ่อยมาก
apps/frappe/frappe/email/doctype/email_group/email_group.js +9,View,ดู
DocType: Communication,Assigned,ที่ได้รับมอบหมาย
DocType: Print Format,Js,js
apps/frappe/frappe/public/js/frappe/views/communication.js +78,Select Print Format,เลือกรูปแบบพิมพ์
